旅宿民稱,地址,電話,官方網站,總房間數,定價,星級
台東的家民宿,臺東縣臺東市開封街805巷16號,089-328176,-,5間,NT$2500-5000(定價係指各種房型之最高備查價格區間，各房型實際售價請依旅宿業者公布為主。),-
欲望。旅人民宿,臺東縣臺東市中山路119-3號,089-345310,http://blog.xuite.net/lapacehostel/lapace,3間,NT$2000-3200(定價係指各種房型之最高備查價格區間，各房型實際售價請依旅宿業者公布為主。),-
珊瑚海民宿,臺東縣臺東市富岡里吉林路二段571巷10號,0909-837224,-,5間,NT$4500-6000(定價係指各種房型之最高備查價格區間，各房型實際售價請依旅宿業者公布為主。),-
簡單生活民宿,臺東縣臺東市中華路一段892巷136號,0933-693632,-,11間,NT$5280-6880(定價係指各種房型之最高備查價格區間，各房型實際售價請依旅宿業者公布為主。),-
初衷民宿,臺東縣臺東市建和二街90巷3號,0915-519231,-,4間,NT$3000-4000(定價係指各種房型之最高備查價格區間，各房型實際售價請依旅宿業者公布為主。),-
小馬客棧民宿,臺東縣成功鎮信義里小馬路92-1號,089-896625,-,3間,NT$3500-4000(定價係指各種房型之最高備查價格區間，各房型實際售價請依旅宿業者公布為主。),-
煙燻貓民宿,臺東縣臺東市開封街805巷10號,0927-807778,http://www.smokeycatbnb.com,4間,NT$4600-5600(定價係指各種房型之最高備查價格區間，各房型實際售價請依旅宿業者公布為主。),-
小鹿茶旅民宿,臺東縣鹿野鄉龍田村7鄰光榮路422號,09-87083751,https://site.traiwan.com/deertea/,5間,NT$2700-4200(定價係指各種房型之最高備查價格區間，各房型實際售價請依旅宿業者公布為主。),-
明通別館民宿,臺東縣綠島鄉南寮村漁港17號,089-672305,-,1間,NT$1600-1600(定價係指各種房型之最高備查價格區間，各房型實際售價請依旅宿業者公布為主。),-
今晨舞宿民宿,臺東縣池上鄉福原村11鄰仁愛路203號,0978-885781,-,12間,NT$3600-5800(定價係指各種房型之最高備查價格區間，各房型實際售價請依旅宿業者公布為主。),-
台東田的家民宿,臺東縣臺東市中興路三段275巷35弄11衖3號,0928-787866,-,5間,NT$5000-5000(定價係指各種房型之最高備查價格區間，各房型實際售價請依旅宿業者公布為主。),-
金玉旅社,臺東縣關山鎮中山路38號,089-811007,-,22間,NT$700-1200(定價係指各種房型之最高備查價格區間，各房型實際售價請依旅宿業者公布為主。),-
台東慢漫遊民宿,臺東縣臺東市新站路232號,0989-794223,-,5間,NT$1800-3600(定價係指各種房型之最高備查價格區間，各房型實際售價請依旅宿業者公布為主。),-
油桐花坊民宿,臺東縣成功鎮忠孝里美山路1-2號,089-871233,-,5間,NT$6800-8800(定價係指各種房型之最高備查價格區間，各房型實際售價請依旅宿業者公布為主。),-
棒棒糖民宿,臺東縣臺東市中興路3段275巷36弄5號,089-223640,-,5間,NT$5000-6000(定價係指各種房型之最高備查價格區間，各房型實際售價請依旅宿業者公布為主。),-
阿達公主民宿,臺東縣臺東市新站路1-1號,0921-577782,-,5間,NT$4500-5500(定價係指各種房型之最高備查價格區間，各房型實際售價請依旅宿業者公布為主。),-
紅茶先生民宿,臺東縣臺東市中華路一段766號,0935-390490,http://redteahouse.iwopop.com,3間,NT$2000-2500(定價係指各種房型之最高備查價格區間，各房型實際售價請依旅宿業者公布為主。),-
叁樓民宿,臺東縣臺東市復興路129號3樓,089-347676,-,5間,NT$8800-8800(定價係指各種房型之最高備查價格區間，各房型實際售價請依旅宿業者公布為主。),-
貳壹國際渡假山莊,臺東縣鹿野鄉永安村永樂路306巷7號,089-550211,-,4間,NT$4000-4500(定價係指各種房型之最高備查價格區間，各房型實際售價請依旅宿業者公布為主。),-
藍色.棉花糖民宿,臺東縣臺東市新站路57號,0937-599629,-,5間,NT$4000-5000(定價係指各種房型之最高備查價格區間，各房型實際售價請依旅宿業者公布為主。),-
鐵道旅人民宿,臺東縣臺東市新站路14巷2號,0912-151082,-,4間,NT$3500-4500(定價係指各種房型之最高備查價格區間，各房型實際售價請依旅宿業者公布為主。),-
尚林民宿,臺東縣大武鄉尚武村4鄰環港路6-6號,089-792565,-,5間,NT$2000-4800(定價係指各種房型之最高備查價格區間，各房型實際售價請依旅宿業者公布為主。),-
伯朗大道民宿,臺東縣池上鄉大埔村埔新二街2號,0965-061122,-,5間,NT$3300-5200(定價係指各種房型之最高備查價格區間，各房型實際售價請依旅宿業者公布為主。),-
東方商務旅館,臺東縣太麻里鄉泰和村外環路66號,089-781123,-,18間,NT$700-1200(定價係指各種房型之最高備查價格區間，各房型實際售價請依旅宿業者公布為主。),-
吉米民宿,臺東縣臺東市鐵花路87巷1號,0900-155366,-,5間,NT$2400-7200(定價係指各種房型之最高備查價格區間，各房型實際售價請依旅宿業者公布為主。),-
小森旅宿民宿,臺東縣臺東市岩灣里安和路102巷100號,0978-888179,-,5間,NT$7000-7000(定價係指各種房型之最高備查價格區間，各房型實際售價請依旅宿業者公布為主。),-
阿朵避民宿,臺東縣長濱鄉三間村三間屋1-8號,0911-915261,http://odobe.pixnet.net/blog,4間,NT$1600-3800(定價係指各種房型之最高備查價格區間，各房型實際售價請依旅宿業者公布為主。),-
藍洋洋民宿,臺東縣臺東市國泰街115號,0978-888179,-,5間,NT$7000-7000(定價係指各種房型之最高備查價格區間，各房型實際售價請依旅宿業者公布為主。),-
皇家好宅民宿,臺東縣臺東市鄭州街107號,0912-346317,-,2間,NT$3300-3300(定價係指各種房型之最高備查價格區間，各房型實際售價請依旅宿業者公布為主。),-
成功66民宿,臺東縣臺東市成功路66號,0978-320352,https://www.facebook.com/success66bnb/,5間,NT$4600-9000(定價係指各種房型之最高備查價格區間，各房型實際售價請依旅宿業者公布為主。),-
筆拉農莊民宿,臺東縣鹿野鄉永安村8鄰永樂路143巷17弄8號,0958-920716,-,5間,NT$5000-9000(定價係指各種房型之最高備查價格區間，各房型實際售價請依旅宿業者公布為主。),-
阿芬姐民宿,臺東縣臺東市樂利路27巷25號,089-221407,-,4間,NT$3200-4800(定價係指各種房型之最高備查價格區間，各房型實際售價請依旅宿業者公布為主。),-
雙魚82號民宿,臺東縣臺東市中興路2段82號,0935-846632,-,4間,NT$2800-4800(定價係指各種房型之最高備查價格區間，各房型實際售價請依旅宿業者公布為主。),-
沅宿,臺東縣臺東市四維路二段766號,0921-230069,-,5間,NT$4000-6000(定價係指各種房型之最高備查價格區間，各房型實際售價請依旅宿業者公布為主。),-
玉長居民宿,臺東縣長濱鄉竹湖村南竹湖34-7號,0972-169946,-,5間,NT$3000-5000(定價係指各種房型之最高備查價格區間，各房型實際售價請依旅宿業者公布為主。),-
來臼埔民宿,臺東縣東河鄉都蘭村舊部21-1號,089-531178,-,5間,NT$6000-6000(定價係指各種房型之最高備查價格區間，各房型實際售價請依旅宿業者公布為主。),-
達樂斯民宿,臺東縣臺東市永安街228號,0988-070398,-,5間,NT$4500-6500(定價係指各種房型之最高備查價格區間，各房型實際售價請依旅宿業者公布為主。),-
YuKi民宿,臺東縣臺東市更生北路634巷41號,0936-110273,http://yuki.taitungbnb.tw,3間,NT$1600-2600(定價係指各種房型之最高備查價格區間，各房型實際售價請依旅宿業者公布為主。),-
迦南美地農莊民宿,臺東縣成功鎮麒麟路4-8號,0966-102557,-,5間,NT$6000-8000(定價係指各種房型之最高備查價格區間，各房型實際售價請依旅宿業者公布為主。),-
台東輕旅民宿,臺東縣臺東市台東市新站路36號,089-236707,-,5間,NT$4000-10000(定價係指各種房型之最高備查價格區間，各房型實際售價請依旅宿業者公布為主。),-
山界57民宿,臺東縣海端鄉海端村5鄰山界57號,089-861412,-,5間,NT$2500-3500(定價係指各種房型之最高備查價格區間，各房型實際售價請依旅宿業者公布為主。),-
歡樂心民宿,臺東縣臺東市國泰街111號,0905-636272,-,5間,NT$5500-6600(定價係指各種房型之最高備查價格區間，各房型實際售價請依旅宿業者公布為主。),-
三仙台美山花園民宿,臺東縣成功鎮成廣路17-6號,0906-666459,-,2間,NT$1200-1500(定價係指各種房型之最高備查價格區間，各房型實際售價請依旅宿業者公布為主。),-
HoHaiYan呼喊海洋民宿,臺東縣成功鎮都歷路316-1號,089-841491,-,5間,NT$2300-2300(定價係指各種房型之最高備查價格區間，各房型實際售價請依旅宿業者公布為主。),-
第二道曙光民宿,臺東縣卑南鄉富山村4鄰漁場90號,0933-580698,-,5間,NT$3600-6000(定價係指各種房型之最高備查價格區間，各房型實際售價請依旅宿業者公布為主。),-
陶淵閒居民宿,臺東縣卑南鄉賓朗村頂永豐41-1號,089-343248,http://halipay41-1.jri.tw/,5間,NT$2500-3800(定價係指各種房型之最高備查價格區間，各房型實際售價請依旅宿業者公布為主。),-
熊愛來,臺東縣臺東市樂利路58號,0980-026649,-,5間,NT$3400-5000(定價係指各種房型之最高備查價格區間，各房型實際售價請依旅宿業者公布為主。),-
蕃薯荳荳民宿,臺東縣臺東市更生路552巷51號,093-7609119,-,3間,NT$4800-5200(定價係指各種房型之最高備查價格區間，各房型實際售價請依旅宿業者公布為主。),-
樂氣球民宿,臺東縣臺東市正氣北路231號,0911-191305,-,5間,NT$2800-5200(定價係指各種房型之最高備查價格區間，各房型實際售價請依旅宿業者公布為主。),-
普羅旺斯咖啡莊園民宿,臺東縣臺東市志航路一段146巷20弄15號,089-235456,-,5間,NT$4800-6800(定價係指各種房型之最高備查價格區間，各房型實際售價請依旅宿業者公布為主。),-
戀戀桃花源民宿,臺東縣長濱鄉竹湖村1鄰41-1號,089-832383,http://www.juhu.com.tw,2間,NT$6900-6900(定價係指各種房型之最高備查價格區間，各房型實際售價請依旅宿業者公布為主。),-
小確幸民宿,臺東縣臺東市豐榮里3鄰仁昌街182號,0911-419095,-,5間,NT$3500-5000(定價係指各種房型之最高備查價格區間，各房型實際售價請依旅宿業者公布為主。),-
築在這民宿,臺東縣臺東市民安街168號,09-56785777,-,5間,NT$4000-10800(定價係指各種房型之最高備查價格區間，各房型實際售價請依旅宿業者公布為主。),-
米開朗花園民宿,臺東縣池上鄉福文村12鄰文化路211-5號,089-865878,-,5間,NT$3600-4500(定價係指各種房型之最高備查價格區間，各房型實際售價請依旅宿業者公布為主。),-
真王子大旅社,臺東縣成功鎮中山路56.58.60號1-4樓,089-851612,-,38間,NT$2000-3000(定價係指各種房型之最高備查價格區間，各房型實際售價請依旅宿業者公布為主。),-
飛旅行民宿,臺東縣臺東市山西路一段235巷12號,089-332953,-,5間,NT$3600-6800(定價係指各種房型之最高備查價格區間，各房型實際售價請依旅宿業者公布為主。),-
依戀東風民宿,臺東縣臺東市永安街56巷25號,089-226867,-,3間,NT$3800-4800(定價係指各種房型之最高備查價格區間，各房型實際售價請依旅宿業者公布為主。),-
星晴民宿,臺東縣關山鎮里壠里23鄰水源30號,0905-956705,-,3間,NT$4000-6000(定價係指各種房型之最高備查價格區間，各房型實際售價請依旅宿業者公布為主。),-
樹舍民宿,臺東縣鹿野鄉龍田村4鄰南三路168號,0983-079849,-,3間,NT$4800-6200(定價係指各種房型之最高備查價格區間，各房型實際售價請依旅宿業者公布為主。),-
鳥鳴民宿,臺東縣臺東市大學路1段188巷23號,089-511211,-,5間,NT$1500-1500(定價係指各種房型之最高備查價格區間，各房型實際售價請依旅宿業者公布為主。),-
沐泉民宿,臺東縣臺東市福建路137號,089-327789,-,4間,NT$3500-6000(定價係指各種房型之最高備查價格區間，各房型實際售價請依旅宿業者公布為主。),-
台東海風民宿,臺東縣臺東市強國街322-2號,0936-424303,-,5間,NT$2000-3000(定價係指各種房型之最高備查價格區間，各房型實際售價請依旅宿業者公布為主。),-
龍鎭民宿,臺東縣鹿野鄉龍田村光榮路572號,0981-012083,-,4間,NT$3600-4800(定價係指各種房型之最高備查價格區間，各房型實際售價請依旅宿業者公布為主。),-
3原色背包房二館民宿,臺東縣臺東市中興路二段47號,089-237947,https://www.facebook.com/Sulibnb/,5間,NT$1500-6750(定價係指各種房型之最高備查價格區間，各房型實際售價請依旅宿業者公布為主。),-
阿甘的家,臺東縣臺東市知本路一段90號,089-332776,-,5間,NT$3000-3000(定價係指各種房型之最高備查價格區間，各房型實際售價請依旅宿業者公布為主。),-
眾樂宿八,臺東縣池上鄉福原村中正路37號,089-861234,-,5間,NT$2500-6000(定價係指各種房型之最高備查價格區間，各房型實際售價請依旅宿業者公布為主。),-
梅花鹿庭園家屋民宿,臺東縣成功鎮三民路166號,0933-657620,http://sikadeer.ittbnb.com/,4間,NT$1800-2500(定價係指各種房型之最高備查價格區間，各房型實際售價請依旅宿業者公布為主。),-
享想民宿,臺東縣臺東市更生北路277巷7號,0919-759489,-,4間,NT$5500-5500(定價係指各種房型之最高備查價格區間，各房型實際售價請依旅宿業者公布為主。),-
艾若米民宿,臺東縣池上鄉福原村福原229號,0928-299702,http://www.airuomi.com/,5間,NT$3600-5200(定價係指各種房型之最高備查價格區間，各房型實際售價請依旅宿業者公布為主。),-
台灣台東民宿,臺東縣臺東市南榮里20鄰馬亨亨大道1542號,0988-611887,-,4間,NT$3200-4800(定價係指各種房型之最高備查價格區間，各房型實際售價請依旅宿業者公布為主。),-
米漾民宿,臺東縣池上鄉福原村11鄰仁愛路211號,0910-865953,-,4間,NT$2600-2600(定價係指各種房型之最高備查價格區間，各房型實際售價請依旅宿業者公布為主。),-
兩間民宿,臺東縣卑南鄉利吉村17鄰環山路175號,0932-582198,-,2間,NT$4000-4000(定價係指各種房型之最高備查價格區間，各房型實際售價請依旅宿業者公布為主。),-
吉軒民宿,臺東縣關山鎮民權路56-4號,089-811889,-,2間,NT$2000-4000(定價係指各種房型之最高備查價格區間，各房型實際售價請依旅宿業者公布為主。),-
拉芬朵兒民宿,臺東縣臺東市興安路一段200巷21弄23號,0921-577847,-,5間,NT$8000-8000(定價係指各種房型之最高備查價格區間，各房型實際售價請依旅宿業者公布為主。),-
會唱歌的石頭民宿,臺東縣臺東市吉林路一段231巷8號,0915-104655,-,4間,NT$2800-3000(定價係指各種房型之最高備查價格區間，各房型實際售價請依旅宿業者公布為主。),-
鎖定台東民宿,臺東縣臺東市興安路一段22號,0932-688482,-,5間,NT$3800-5600(定價係指各種房型之最高備查價格區間，各房型實際售價請依旅宿業者公布為主。),-
水都威尼斯,臺東縣臺東市正氣路73號,089-360666,http://venice.so-ez.com.tw,5間,NT$2000-4000(定價係指各種房型之最高備查價格區間，各房型實際售價請依旅宿業者公布為主。),-
水菓糖民宿,臺東縣臺東市正氣北路137號,0989-010312,-,2間,NT$2500-3600(定價係指各種房型之最高備查價格區間，各房型實際售價請依旅宿業者公布為主。),-
老船長民宿,臺東縣太麻里鄉金崙村溫泉26號,0928-733888,-,5間,NT$8000-8000(定價係指各種房型之最高備查價格區間，各房型實際售價請依旅宿業者公布為主。),-
綠島翔鹿民宿,臺東縣綠島鄉南寮村南寮149號,0937-390853,-,2間,NT$6000-6000(定價係指各種房型之最高備查價格區間，各房型實際售價請依旅宿業者公布為主。),-
紅瓦厝民宿,臺東縣東河鄉都蘭村18鄰都蘭57-3號,089-530318,-,5間,NT$3500-4200(定價係指各種房型之最高備查價格區間，各房型實際售價請依旅宿業者公布為主。),-
Here民宿,臺東縣綠島鄉中寮村中寮78號,0982-838436,-,5間,NT$6000-8000(定價係指各種房型之最高備查價格區間，各房型實際售價請依旅宿業者公布為主。),-
阿達王子民宿,臺東縣臺東市新站路1號,0921-577782,-,5間,NT$4500-5500(定價係指各種房型之最高備查價格區間，各房型實際售價請依旅宿業者公布為主。),-
御來光民宿,臺東縣鹿野鄉永安村9鄰高台路136號,0988-655552,-,5間,NT$5000-7600(定價係指各種房型之最高備查價格區間，各房型實際售價請依旅宿業者公布為主。),-
金樽有晴月海景民宿,臺東縣東河鄉東河村金樽160號,0921-767882,-,8間,NT$4500-8800(定價係指各種房型之最高備查價格區間，各房型實際售價請依旅宿業者公布為主。),-
東方雲民宿,臺東縣大武鄉南興村安興19號,0988-180813,-,3間,NT$3000-5500(定價係指各種房型之最高備查價格區間，各房型實際售價請依旅宿業者公布為主。),-
音悅家民宿,臺東縣臺東市永安街230巷2號,0910-382419,-,5間,NT$5500-6500(定價係指各種房型之最高備查價格區間，各房型實際售價請依旅宿業者公布為主。),-
八逸民宿,臺東縣太麻里鄉美和路荒野20-1號,089-311571,-,5間,NT$6580-6580(定價係指各種房型之最高備查價格區間，各房型實際售價請依旅宿業者公布為主。),-
船長之家民宿,臺東縣綠島鄉南寮村南寮42號,089-671050,-,5間,NT$1600-2400(定價係指各種房型之最高備查價格區間，各房型實際售價請依旅宿業者公布為主。),-
白色小屋民宿,臺東縣成功鎮小馬路134-13號,0933-702128,http://pony.yoyotaitung.com.tw,5間,NT$3600-4200(定價係指各種房型之最高備查價格區間，各房型實際售價請依旅宿業者公布為主。),-
亞莊酒店,臺東縣卑南鄉溫泉村溫泉路68號1-7樓,089-511199,-,56間,NT$5720-8580(定價係指各種房型之最高備查價格區間，各房型實際售價請依旅宿業者公布為主。),-
夢之谷民宿,臺東縣卑南鄉太平村和平路366號,0910-556779,-,10間,NT$6000-6000(定價係指各種房型之最高備查價格區間，各房型實際售價請依旅宿業者公布為主。),-
台東新生民宿,臺東縣臺東市中興路2段743巷22弄11號,0927-530173,-,4間,NT$2200-3200(定價係指各種房型之最高備查價格區間，各房型實際售價請依旅宿業者公布為主。),-
心之海民宿,臺東縣臺東市樂利路57巷16-1號,0932-575546,-,4間,NT$2600-3200(定價係指各種房型之最高備查價格區間，各房型實際售價請依旅宿業者公布為主。),-
狗窩民宿,臺東縣臺東市正氣北路798號,0910-558758,http://www.love-taitung.com/doghouse,5間,NT$2500-4000(定價係指各種房型之最高備查價格區間，各房型實際售價請依旅宿業者公布為主。),-
馬亨亨民宿,臺東縣臺東市新站路15號,0988-250249,-,5間,NT$3000-7200(定價係指各種房型之最高備查價格區間，各房型實際售價請依旅宿業者公布為主。),-
晶龍景觀民宿,臺東縣綠島鄉公館村1-2號,089-671139,-,2間,NT$4000-4000(定價係指各種房型之最高備查價格區間，各房型實際售價請依旅宿業者公布為主。),-
稻花香民宿,臺東縣池上鄉新興村6鄰新興76之3號,0937-370573,-,5間,NT$5500-5500(定價係指各種房型之最高備查價格區間，各房型實際售價請依旅宿業者公布為主。),-
日光涵館景觀民宿,臺東縣成功鎮信義里小馬路134-9號,0988-532985,-,4間,NT$6000-8000(定價係指各種房型之最高備查價格區間，各房型實際售價請依旅宿業者公布為主。),-
情人沙灘民宿,臺東縣長濱鄉三間村真柄88號,089-830269,-,4間,NT$4000-8000(定價係指各種房型之最高備查價格區間，各房型實際售價請依旅宿業者公布為主。),-
富裕商旅,"臺東縣臺東市中正路277號4樓,光明路90號4樓",089-360286,https://www.richhotel.com.tw/,19間,NT$4800-7600(定價係指各種房型之最高備查價格區間，各房型實際售價請依旅宿業者公布為主。),-
賢之芳咖啡休閒民宿,臺東縣成功鎮信義里9鄰新村路18之6號,0932-559916,-,4間,NT$2000-2000(定價係指各種房型之最高備查價格區間，各房型實際售價請依旅宿業者公布為主。),-
木頭魚民宿,臺東縣成功鎮信義里都歷路246-28號,0963-929778,http://woodenfish.okgo.tw,5間,NT$2200-4800(定價係指各種房型之最高備查價格區間，各房型實際售價請依旅宿業者公布為主。),-
打個蛋海旅民宿,臺東縣太麻里鄉金崙村金崙129號,089-771551,http://dagedanhouse.wix.com/dagedan,4間,NT$4600-4600(定價係指各種房型之最高備查價格區間，各房型實際售價請依旅宿業者公布為主。),-
動物園民宿,臺東縣臺東市開封街811巷9號,089-330658,http://www.zoobnb089.com/,5間,NT$3000-5000(定價係指各種房型之最高備查價格區間，各房型實際售價請依旅宿業者公布為主。),-
沐星民宿,臺東縣臺東市福建路135號,089-327789,-,4間,NT$3500-4500(定價係指各種房型之最高備查價格區間，各房型實際售價請依旅宿業者公布為主。),-
自在軒民宿,臺東縣臺東市豐榮里漢陽南路139巷69號,0937-396812,-,5間,NT$1000-1500(定價係指各種房型之最高備查價格區間，各房型實際售價請依旅宿業者公布為主。),-
幸福台東民宿,臺東縣卑南鄉賓朗村5鄰賓朗路133巷53號,0933-370966,-,3間,NT$3000-4000(定價係指各種房型之最高備查價格區間，各房型實際售價請依旅宿業者公布為主。),-
傑緣聖堡民宿,臺東縣臺東市知本路三段398巷25號,089-346321,-,5間,NT$4500-5500(定價係指各種房型之最高備查價格區間，各房型實際售價請依旅宿業者公布為主。),-
海天11線民宿,臺東縣臺東市常德路86號,089-322385,-,4間,NT$4550-4550(定價係指各種房型之最高備查價格區間，各房型實際售價請依旅宿業者公布為主。),-
愛的禮物民宿,臺東縣臺東市漢陽北路338號,0926-308726,-,5間,NT$3800-5800(定價係指各種房型之最高備查價格區間，各房型實際售價請依旅宿業者公布為主。),-
太太的小公館民宿,臺東縣臺東市仁一街341號,0933-716266,https://booking.owlting.com/madams-mansion?start=2020-05-15&end=2020-05-16&adult=1&child=0&infant=0,5間,NT$6000-7600(定價係指各種房型之最高備查價格區間，各房型實際售價請依旅宿業者公布為主。),-
丰宿民宿,臺東縣池上鄉大埔村大埔75號,0928-552301,-,3間,NT$7000-7000(定價係指各種房型之最高備查價格區間，各房型實際售價請依旅宿業者公布為主。),-
輔都大旅社,臺東縣大武鄉大武村復興路82號,089-791035,http://fudo.tdbnb.net,13間,NT$600-900(定價係指各種房型之最高備查價格區間，各房型實際售價請依旅宿業者公布為主。),-
後山人家民宿A館民宿,臺東縣鹿野鄉永安村2鄰永安路155號,089-551090,-,5間,NT$3800-7500(定價係指各種房型之最高備查價格區間，各房型實際售價請依旅宿業者公布為主。),-
海堤民宿,臺東縣臺東市吉林路2段513巷8號,0913-908082,-,5間,NT$7000-7000(定價係指各種房型之最高備查價格區間，各房型實際售價請依旅宿業者公布為主。),-
東宇居民宿,臺東縣鹿野鄉瑞豐村9鄰瑞景路四段96號,089-865165,-,3間,NT$3200-3200(定價係指各種房型之最高備查價格區間，各房型實際售價請依旅宿業者公布為主。),-
內太空民宿,臺東縣綠島鄉南寮村南寮10號,089--671205,-,5間,NT$3000-3600(定價係指各種房型之最高備查價格區間，各房型實際售價請依旅宿業者公布為主。),-
京棧民宿,臺東縣臺東市樂利路57巷16-2號,089-222932,-,5間,NT$2500-3000(定價係指各種房型之最高備查價格區間，各房型實際售價請依旅宿業者公布為主。),-
No.520民宿,臺東縣卑南鄉太平村太平路520號,0972-016568,-,5間,NT$5000-5000(定價係指各種房型之最高備查價格區間，各房型實際售價請依旅宿業者公布為主。),-
泰豫聚寶坊民宿,臺東縣鹿野鄉永安村永樂路119號,089-552250,https://www.google.com/search?sxsrf=ALeKk02RxhAvMcs8dbFctqCS3P7M714_tw%3A1592204197657&source=hp&ei=pRvnXqDMJaOUr7wPg6qeiA8&q=%E5%8F%B0%E6%9D%B1%E7%B8%A3%E9%B9%BF%E9%87%8E%E9%84%89%E6%B0%B8%E6%A8%82%E8%B7%AF%E6%B3%B0%E8%B1%AB%E8%81%9A%E5%AF%B6%E5%9D%8A%E6,5間,NT$4500-5500(定價係指各種房型之最高備查價格區間，各房型實際售價請依旅宿業者公布為主。),-
上善德雅花園民宿,臺東縣東河鄉都蘭村45鄰新社3-6號,0928-614887,-,5間,NT$6000-8000(定價係指各種房型之最高備查價格區間，各房型實際售價請依旅宿業者公布為主。),-
