旅宿民稱,地址,電話,官方網站,總房間數,定價,星級
11號幸福民宿,臺東縣臺東市新站一街11號,0917-677846,-,5間,NT$3500-5000(定價係指各種房型之最高備查價格區間，各房型實際售價請依旅宿業者公布為主。),-
兜風名澍民宿,臺東縣臺東市中興路三段275巷45弄1號,0911-825067,-,4間,NT$2800-3200(定價係指各種房型之最高備查價格區間，各房型實際售價請依旅宿業者公布為主。),-
找稻田民宿,臺東縣臺東市豐里里臨海路三段51巷18弄2號,0915-503531,-,5間,NT$5800-8600(定價係指各種房型之最高備查價格區間，各房型實際售價請依旅宿業者公布為主。),-
旅行蟲民宿,臺東縣東河鄉都蘭村都蘭134號,089-531668,-,5間,NT$700-2400(定價係指各種房型之最高備查價格區間，各房型實際售價請依旅宿業者公布為主。),-
綠島咖民宿,臺東縣綠島鄉公館村溫泉9-1號,089-671215,-,5間,NT$3600-3600(定價係指各種房型之最高備查價格區間，各房型實際售價請依旅宿業者公布為主。),-
小春家民宿,臺東縣臺東市志航路1段146巷20弄10號,0976-875858,-,3間,NT$3600-3800(定價係指各種房型之最高備查價格區間，各房型實際售價請依旅宿業者公布為主。),-
小桂林山莊民宿,臺東縣長濱鄉忠勇村4鄰忠勇路83-3號,089-832655,-,3間,NT$5000-5000(定價係指各種房型之最高備查價格區間，各房型實際售價請依旅宿業者公布為主。),-
鳥語花香民宿,臺東縣臺東市建興里5鄰青海路四段428巷222號,089-512597,http://m.facebook.com/monkeyandflower,3間,NT$2800-4000(定價係指各種房型之最高備查價格區間，各房型實際售價請依旅宿業者公布為主。),-
海島民宿,臺東縣綠島鄉公館村4鄰公館路61號,089-671314,-,5間,NT$3500-4000(定價係指各種房型之最高備查價格區間，各房型實際售價請依旅宿業者公布為主。),-
投優榻民宿,臺東縣池上鄉福原村11鄰仁愛路209號,0919-239459,-,5間,NT$2200-3800(定價係指各種房型之最高備查價格區間，各房型實際售價請依旅宿業者公布為主。),-
台東旅人民宿,臺東縣臺東市民安街167號,089-230267,-,4間,NT$4500-4500(定價係指各種房型之最高備查價格區間，各房型實際售價請依旅宿業者公布為主。),-
小熊管家民宿,臺東縣臺東市樂利路2號,0928-349076,-,5間,NT$4800-6800(定價係指各種房型之最高備查價格區間，各房型實際售價請依旅宿業者公布為主。),-
俗離居,臺東縣臺東市甘泉街97號,0937-212818,https://booking.owlting.com/su_li_g,4間,NT$6800-6800(定價係指各種房型之最高備查價格區間，各房型實際售價請依旅宿業者公布為主。),-
愛麗絲花園民宿,臺東縣臺東市豐年里8鄰興航街73號,089-235831,-,4間,NT$4500-6800(定價係指各種房型之最高備查價格區間，各房型實際售價請依旅宿業者公布為主。),-
奇拉黛優民宿,臺東縣長濱鄉寧埔村烏石鼻43-3號,0988-136381,-,5間,NT$3000-4000(定價係指各種房型之最高備查價格區間，各房型實際售價請依旅宿業者公布為主。),-
鄉村鼠民宿,臺東縣臺東市興盛路313巷25號,089-222224,-,5間,NT$2800-4800(定價係指各種房型之最高備查價格區間，各房型實際售價請依旅宿業者公布為主。),-
湯之莊民宿,臺東縣卑南鄉溫泉村龍泉路113巷27號,089-323757,-,5間,NT$1700-3500(定價係指各種房型之最高備查價格區間，各房型實際售價請依旅宿業者公布為主。),-
漂鳥之棲民宿,臺東縣東河鄉興昌村南八里11-10號,089-530499,-,3間,NT$2200-3600(定價係指各種房型之最高備查價格區間，各房型實際售價請依旅宿業者公布為主。),-
幸福有約民宿,臺東縣東河鄉興昌村農場2-2號,089-530248,-,4間,NT$3800-3800(定價係指各種房型之最高備查價格區間，各房型實際售價請依旅宿業者公布為主。),-
遊仔灣民宿,臺東縣臺東市樂利路27巷27號,089-221407,-,4間,NT$3200-4800(定價係指各種房型之最高備查價格區間，各房型實際售價請依旅宿業者公布為主。),-
娜娜雅筑民宿,臺東縣臺東市新站路13巷8號,0935-654379,-,5間,NT$3600-3600(定價係指各種房型之最高備查價格區間，各房型實際售價請依旅宿業者公布為主。),-
月光夏民宿,臺東縣臺東市馬亨亨大道625號,089--219618,-,5間,NT$4800-5800(定價係指各種房型之最高備查價格區間，各房型實際售價請依旅宿業者公布為主。),-
金龍湖民宿,臺東縣大武鄉尚武村金龍路2號,089-792484,-,5間,NT$3000-4000(定價係指各種房型之最高備查價格區間，各房型實際售價請依旅宿業者公布為主。),-
老鷹之歌海景民宿,臺東縣東河鄉都蘭村五線60-7號,0922-769567,https://www.facebook.com/eagle607/,5間,NT$2400-4800(定價係指各種房型之最高備查價格區間，各房型實際售價請依旅宿業者公布為主。),-
米鄉小棧民宿,臺東縣池上鄉福原村19鄰文田路102號,0932-191910,-,4間,NT$3200-4800(定價係指各種房型之最高備查價格區間，各房型實際售價請依旅宿業者公布為主。),-
馬可樓民宿,臺東縣成功鎮豐田路28-1號,089-841849,-,3間,NT$5500-8500(定價係指各種房型之最高備查價格區間，各房型實際售價請依旅宿業者公布為主。),-
心園民宿,臺東縣臺東市知本路一段45巷6弄53號,089-517191,-,5間,NT$3900-3900(定價係指各種房型之最高備查價格區間，各房型實際售價請依旅宿業者公布為主。),-
門廷若室河堤左岸館民宿,臺東縣臺東市開封街818巷2號,09-28688089,https://tiintinn-river.mydirectstay.com/tw/index.html,10間,NT$4000-5600(定價係指各種房型之最高備查價格區間，各房型實際售價請依旅宿業者公布為主。),-
山莊民宿,臺東縣關山鎮新福里2鄰和平路150號,089-812246,http://guanshan.taitungminsu.com.tw/bnb/shan.htm,5間,NT$2800-3500(定價係指各種房型之最高備查價格區間，各房型實際售價請依旅宿業者公布為主。),-
林園氛圍民宿,臺東縣臺東市樂利路52巷16號,092-8704069,-,5間,NT$4800-4800(定價係指各種房型之最高備查價格區間，各房型實際售價請依旅宿業者公布為主。),-
行雲會館,臺東縣臺東市復興路233號,0978-590812,-,59間,NT$6800-20000(定價係指各種房型之最高備查價格區間，各房型實際售價請依旅宿業者公布為主。),-
東旺民宿,臺東縣臺東市中興路一段305號,089-227873,-,5間,NT$1200-2400(定價係指各種房型之最高備查價格區間，各房型實際售價請依旅宿業者公布為主。),-
幸福麻吉民宿,臺東縣臺東市仁昌街138巷31號,089-356419,-,5間,NT$3500-5500(定價係指各種房型之最高備查價格區間，各房型實際售價請依旅宿業者公布為主。),-
紅瓦山舍民宿,臺東縣臺東市強國街348巷10號,0937-326098,-,5間,NT$6000-7200(定價係指各種房型之最高備查價格區間，各房型實際售價請依旅宿業者公布為主。),-
木子屋民宿,臺東縣關山鎮民族路152號,089-813301,http://www.facebook.com/pages/%E6%9C%A8%E5%AD%90%E5%B1%8B/1594705944092766,5間,NT$3600-6000(定價係指各種房型之最高備查價格區間，各房型實際售價請依旅宿業者公布為主。),-
吉安民宿,臺東縣臺東市興盛路252號,0978-873925,-,5間,NT$4000-5000(定價係指各種房型之最高備查價格區間，各房型實際售價請依旅宿業者公布為主。),-
願井民宿,臺東縣東河鄉隆昌村七里橋10-2號,089-541343,-,5間,NT$7800-8800(定價係指各種房型之最高備查價格區間，各房型實際售價請依旅宿業者公布為主。),-
焦糖民宿,臺東縣臺東市興安路一段200巷17號,0963-926591,-,5間,NT$4500-5500(定價係指各種房型之最高備查價格區間，各房型實際售價請依旅宿業者公布為主。),-
愛之船,臺東縣臺東市知本路三段398巷31號,089-783225,-,5間,NT$4500-5500(定價係指各種房型之最高備查價格區間，各房型實際售價請依旅宿業者公布為主。),-
耿家莊民宿,臺東縣卑南鄉溫泉村民生36號,0939-965640,-,4間,NT$2800-4500(定價係指各種房型之最高備查價格區間，各房型實際售價請依旅宿業者公布為主。),-
默砌旅店東海灣民宿,臺東縣長濱鄉寧埔村烏石鼻42-5號,089-801168,-,3間,NT$2000-2000(定價係指各種房型之最高備查價格區間，各房型實際售價請依旅宿業者公布為主。),-
安娜民宿,臺東縣臺東市漢陽北路352號,0926-308726,-,8間,NT$5800-5800(定價係指各種房型之最高備查價格區間，各房型實際售價請依旅宿業者公布為主。),-
繽紛色彩民宿,臺東縣臺東市博愛路57號,089-343525,-,4間,NT$3500-5000(定價係指各種房型之最高備查價格區間，各房型實際售價請依旅宿業者公布為主。),-
玫瑰園鄉芚民宿,臺東縣臺東市興安路一段592號,0933-538108,-,5間,NT$2500-5000(定價係指各種房型之最高備查價格區間，各房型實際售價請依旅宿業者公布為主。),-
山豬背包客民宿,臺東縣臺東市安和路102巷32號,0982-501238,-,5間,NT$3200-10000(定價係指各種房型之最高備查價格區間，各房型實際售價請依旅宿業者公布為主。),-
芹菜芋頭民宿,臺東縣臺東市樂利路1號,0986-603303,-,5間,NT$4200-6000(定價係指各種房型之最高備查價格區間，各房型實際售價請依旅宿業者公布為主。),-
旮祭來民宿,臺東縣成功鎮和平里1鄰和平路16號,089-841760,-,3間,NT$1600-3000(定價係指各種房型之最高備查價格區間，各房型實際售價請依旅宿業者公布為主。),-
卓亞民宿,臺東縣臺東市正氣北路76巷60號,089-333010,http://www.oiacafe.com,5間,NT$3600-6000(定價係指各種房型之最高備查價格區間，各房型實際售價請依旅宿業者公布為主。),-
松禾園民宿,臺東縣臺東市民航路689巷85號,0912-032872,-,4間,NT$8000-8000(定價係指各種房型之最高備查價格區間，各房型實際售價請依旅宿業者公布為主。),-
余水知歡民宿,臺東縣長濱鄉三間村真柄47-28號,0988-566788,http://www.yujoy.tw/,5間,NT$3200-4500(定價係指各種房型之最高備查價格區間，各房型實際售價請依旅宿業者公布為主。),-
河南堂民宿,臺東縣池上鄉富興村3鄰水墜43之1號,089-862953,-,4間,NT$1300-1800(定價係指各種房型之最高備查價格區間，各房型實際售價請依旅宿業者公布為主。),-
三仙台海滔民宿,臺東縣成功鎮芝田路1-3號,0937-851883,-,3間,NT$4200-4200(定價係指各種房型之最高備查價格區間，各房型實際售價請依旅宿業者公布為主。),-
解語花軒民宿,臺東縣臺東市志航路1段412巷17弄35號,0933-058844,-,5間,NT$2500-4200(定價係指各種房型之最高備查價格區間，各房型實際售價請依旅宿業者公布為主。),-
大姆灣民宿,臺東縣東河鄉都蘭村舊部14-9號,0905-167717,-,4間,NT$5600-7600(定價係指各種房型之最高備查價格區間，各房型實際售價請依旅宿業者公布為主。),-
橫賓浪漫民宿,臺東縣臺東市豐榮路88號,0912-789538,-,4間,NT$2800-6000(定價係指各種房型之最高備查價格區間，各房型實際售價請依旅宿業者公布為主。),-
台東快樂海民宿,臺東縣臺東市興盛路250號,0905-739393,-,5間,NT$3500-8000(定價係指各種房型之最高備查價格區間，各房型實際售價請依旅宿業者公布為主。),-
那界17民宿,臺東縣東河鄉都蘭村5鄰那界17號,0910-549165,-,5間,NT$7000-7000(定價係指各種房型之最高備查價格區間，各房型實際售價請依旅宿業者公布為主。),-
橙品民宿,臺東縣卑南鄉溫泉村龍泉路118號2樓,089-516263,-,5間,NT$8000-9500(定價係指各種房型之最高備查價格區間，各房型實際售價請依旅宿業者公布為主。),-
日安，巴黎民宿,臺東縣臺東市咸陽街55號,0912-134923,-,2間,NT$3600-5200(定價係指各種房型之最高備查價格區間，各房型實際售價請依旅宿業者公布為主。),-
滴入江的殼民宿,臺東縣臺東市開封街611號,0910-948228,-,2間,NT$4000-4000(定價係指各種房型之最高備查價格區間，各房型實際售價請依旅宿業者公布為主。),-
齊遇民宿,臺東縣臺東市文山路15號,089-359059,-,5間,NT$2000-2600(定價係指各種房型之最高備查價格區間，各房型實際售價請依旅宿業者公布為主。),-
初鹿溫馨小棧民宿,臺東縣卑南鄉初鹿村初鹿三街60號,089-571515,-,3間,NT$1500-4000(定價係指各種房型之最高備查價格區間，各房型實際售價請依旅宿業者公布為主。),-
陽光協奏曲民宿,臺東縣臺東市樂利路13號,089-238113,-,5間,NT$3600-4800(定價係指各種房型之最高備查價格區間，各房型實際售價請依旅宿業者公布為主。),-
驛亭民宿,臺東縣臺東市傳廣路388巷60號,089-226262,-,5間,NT$2000-2000(定價係指各種房型之最高備查價格區間，各房型實際售價請依旅宿業者公布為主。),-
文旅休閒民宿,臺東縣臺東市國泰街136號,0905-151758,-,5間,NT$4600-7200(定價係指各種房型之最高備查價格區間，各房型實際售價請依旅宿業者公布為主。),-
日光森林B舘民宿,臺東縣臺東市樂利路23號,0913-783755,-,9間,NT$9000-9000(定價係指各種房型之最高備查價格區間，各房型實際售價請依旅宿業者公布為主。),-
東美大飯店,臺東縣卑南鄉龍泉路53巷1號2~7樓,089-514662,-,22間,NT$4500-6000(定價係指各種房型之最高備查價格區間，各房型實際售價請依旅宿業者公布為主。),-
好待goodstay民宿,臺東縣東河鄉北東河49號,0932-016477,-,4間,NT$2500-3500(定價係指各種房型之最高備查價格區間，各房型實際售價請依旅宿業者公布為主。),-
旅享家民宿,臺東縣臺東市信義路357號,089-345496,-,4間,NT$3800-5500(定價係指各種房型之最高備查價格區間，各房型實際售價請依旅宿業者公布為主。),-
京棧興盛民宿,臺東縣臺東市興盛路208號,089-222932,-,15間,NT$3000-4000(定價係指各種房型之最高備查價格區間，各房型實際售價請依旅宿業者公布為主。),-
金崙裕豐民宿,臺東縣太麻里鄉金崙村14鄰溫泉21-9號,0911-504279,-,4間,NT$3000-5000(定價係指各種房型之最高備查價格區間，各房型實際售價請依旅宿業者公布為主。),-
過日子民宿,臺東縣綠島鄉公館村柴口55-1號,089-671500,http://ahsilife.okgo.tw/,5間,NT$5200-6500(定價係指各種房型之最高備查價格區間，各房型實際售價請依旅宿業者公布為主。),-
瑪莉年代民宿,臺東縣臺東市興安路一段200巷21弄25號,0939-602902,-,5間,NT$3500-5500(定價係指各種房型之最高備查價格區間，各房型實際售價請依旅宿業者公布為主。),-
康士美民宿,臺東縣臺東市更生北路306巷2號,089-227222,-,4間,NT$1000-1000(定價係指各種房型之最高備查價格區間，各房型實際售價請依旅宿業者公布為主。),-
旭旅民宿,臺東縣臺東市國泰街132號,0905-139768,-,5間,NT$4600-7200(定價係指各種房型之最高備查價格區間，各房型實際售價請依旅宿業者公布為主。),-
晨光藝旅休憩民宿,臺東縣臺東市台東市國泰街138號,0905-151758,-,5間,NT$4600-7200(定價係指各種房型之最高備查價格區間，各房型實際售價請依旅宿業者公布為主。),-
老謝的家民宿,臺東縣臺東市志航路1段146巷20弄2號,089-233393,-,4間,NT$3200-4800(定價係指各種房型之最高備查價格區間，各房型實際售價請依旅宿業者公布為主。),-
曼尼民宿,臺東縣臺東市新站二街32號,0912-749298,http://manne.taitungbnb.net/,5間,NT$4000-5000(定價係指各種房型之最高備查價格區間，各房型實際售價請依旅宿業者公布為主。),-
生活21房子民宿,臺東縣池上鄉萬安村10鄰龍仔尾11號,089-862809,http://life21.com.tw/,3間,NT$3500-3800(定價係指各種房型之最高備查價格區間，各房型實際售價請依旅宿業者公布為主。),-
日光森林A舘民宿,臺東縣臺東市臺東縣樂利路25號,0913-280502,-,10間,NT$5000-9000(定價係指各種房型之最高備查價格區間，各房型實際售價請依旅宿業者公布為主。),-
花漾幸福民宿,臺東縣臺東市興安路二段29號,089-238818,-,5間,NT$3200-5400(定價係指各種房型之最高備查價格區間，各房型實際售價請依旅宿業者公布為主。),-
森野民宿,臺東縣太麻里鄉美和村荒野20號,0966-625159,https://www.facebook.com/senya5159/,5間,NT$6580-6580(定價係指各種房型之最高備查價格區間，各房型實際售價請依旅宿業者公布為主。),-
夏之旅民宿,臺東縣臺東市永福路157號,0928-925273,-,5間,NT$1980-2800(定價係指各種房型之最高備查價格區間，各房型實際售價請依旅宿業者公布為主。),-
美人魚民宿,臺東縣綠島鄉公館村7鄰公館56號,0920-621630,-,4間,NT$3600-8000(定價係指各種房型之最高備查價格區間，各房型實際售價請依旅宿業者公布為主。),-
家居民宿,臺東縣臺東市興安路一段200巷21弄47號,0970-868975,-,4間,NT$4000-6000(定價係指各種房型之最高備查價格區間，各房型實際售價請依旅宿業者公布為主。),-
嘉園民宿,臺東縣臺東市中華路四段161巷399號,0910-558122,-,5間,NT$3600-4600(定價係指各種房型之最高備查價格區間，各房型實際售價請依旅宿業者公布為主。),-
東邑民宿,臺東縣臺東市重慶路91號,089-345656,-,5間,NT$2500-4500(定價係指各種房型之最高備查價格區間，各房型實際售價請依旅宿業者公布為主。),-
金站溫泉民宿,臺東縣太麻里鄉金崙村金崙127-1號,0983-438114,-,15間,NT$5000-7000(定價係指各種房型之最高備查價格區間，各房型實際售價請依旅宿業者公布為主。),-
月昇都蘭景觀民宿,臺東縣東河鄉都蘭村新社30-3號,089-531065,http://www.moonriseinn.com/,3間,NT$2800-4200(定價係指各種房型之最高備查價格區間，各房型實際售價請依旅宿業者公布為主。),-
悠閣旅民宿,臺東縣臺東市富裕路502巷11弄22號,0976-341413,-,5間,NT$4000-4000(定價係指各種房型之最高備查價格區間，各房型實際售價請依旅宿業者公布為主。),-
幸福小徑民宿,臺東縣臺東市漢陽南路139巷65號,0937-609020,-,5間,NT$3000-4500(定價係指各種房型之最高備查價格區間，各房型實際售價請依旅宿業者公布為主。),-
工寓民宿,臺東縣臺東市浙江路36號,0919-639408,-,12間,NT$5200-6000(定價係指各種房型之最高備查價格區間，各房型實際售價請依旅宿業者公布為主。),-
日卡地自然農莊,臺東縣鹿野鄉永安村1鄰永安路41號,0935-156000,-,1間,NT$6000-6000(定價係指各種房型之最高備查價格區間，各房型實際售價請依旅宿業者公布為主。),-
芭涵漢民宿,臺東縣臺東市吉泰路599巷25號,0966-717732,-,5間,NT$4500-5500(定價係指各種房型之最高備查價格區間，各房型實際售價請依旅宿業者公布為主。),-
小鬆宿台東民宿,臺東縣臺東市永安街47巷1號,0906-770877,-,4間,NT$4200-5000(定價係指各種房型之最高備查價格區間，各房型實際售價請依旅宿業者公布為主。),-
嘉明湖民宿,臺東縣池上鄉福源村19鄰文田路106號,0921-572436,-,4間,NT$1400-5600(定價係指各種房型之最高備查價格區間，各房型實際售價請依旅宿業者公布為主。),-
思鄉168民宿,臺東縣臺東市四川路一段287號,0921-203625,-,5間,NT$3000-5000(定價係指各種房型之最高備查價格區間，各房型實際售價請依旅宿業者公布為主。),-
招喚俠谷民宿,臺東縣卑南鄉溫泉村鎮樂87-3號,0988-383132,-,4間,NT$4200-5200(定價係指各種房型之最高備查價格區間，各房型實際售價請依旅宿業者公布為主。),-
貳館民宿,臺東縣長濱鄉長濱村3鄰崎腳11-2號,0937-474453,-,2間,NT$4800-4800(定價係指各種房型之最高備查價格區間，各房型實際售價請依旅宿業者公布為主。),-
北歐森林民宿,臺東縣臺東市永安街206巷10號,0910-966512,-,3間,NT$4200-5500(定價係指各種房型之最高備查價格區間，各房型實際售價請依旅宿業者公布為主。),-
郡界柒陸背包民宿,臺東縣卑南鄉富山村郡界76號,0934-470737,-,3間,NT$2000-6400(定價係指各種房型之最高備查價格區間，各房型實際售價請依旅宿業者公布為主。),-
米樂文旅民宿,臺東縣池上鄉新興村9鄰新興94之19號,089-863367,-,5間,NT$3000-4800(定價係指各種房型之最高備查價格區間，各房型實際售價請依旅宿業者公布為主。),-
奇瓦拉民宿,臺東縣金峰鄉賓茂村1鄰16-1號,0918-994390,-,3間,NT$1600-2600(定價係指各種房型之最高備查價格區間，各房型實際售價請依旅宿業者公布為主。),-
心海民宿,臺東縣臺東市臨海路一段88號,0921-689718,-,3間,NT$4000-6800(定價係指各種房型之最高備查價格區間，各房型實際售價請依旅宿業者公布為主。),-
夜聆民宿,臺東縣池上鄉新興村3鄰新興39號,0937-909332,-,5間,NT$4000-6000(定價係指各種房型之最高備查價格區間，各房型實際售價請依旅宿業者公布為主。),-
夏嶼天民宿,臺東縣綠島鄉南寮村南寮102-15號,0965-605215,-,5間,NT$5800-8800(定價係指各種房型之最高備查價格區間，各房型實際售價請依旅宿業者公布為主。),-
海VILLA旦（月曼）民宿,臺東縣長濱鄉寧埔村16鄰膽曼45之6號,0983-71997,https://oceanvilla-taitung.com/,5間,NT$12000-12000(定價係指各種房型之最高備查價格區間，各房型實際售價請依旅宿業者公布為主。),-
熱帶魚民宿,臺東縣綠島鄉公館村溫泉11-5號,0932-559884,-,5間,NT$2500-4600(定價係指各種房型之最高備查價格區間，各房型實際售價請依旅宿業者公布為主。),-
胖咪民宿,臺東縣臺東市豐榮路90巷42號,0939-585818,-,5間,NT$3900-4800(定價係指各種房型之最高備查價格區間，各房型實際售價請依旅宿業者公布為主。),-
分手巧克力民宿,臺東縣長濱鄉寧埔村城山45-1號,0972-126288,-,5間,NT$1600-4800(定價係指各種房型之最高備查價格區間，各房型實際售價請依旅宿業者公布為主。),-
貓咪太太與樹懶先生民宿,臺東縣臺東市知本路2段339巷176弄8號,0928-862561,-,5間,NT$5600-7000(定價係指各種房型之最高備查價格區間，各房型實際售價請依旅宿業者公布為主。),-
橘子民宿,臺東縣臺東市中興路三段196號,0932-559823,-,5間,NT$3600-3600(定價係指各種房型之最高備查價格區間，各房型實際售價請依旅宿業者公布為主。),-
廣闊民宿,臺東縣臺東市臨海路一段86號,0988-761917,-,3間,NT$4000-6800(定價係指各種房型之最高備查價格區間，各房型實際售價請依旅宿業者公布為主。),-
湘台民宿,臺東縣臺東市北安路52巷50號,0953-870891,https://www.facebook.com/taitung.shaunte888,5間,NT$4300-7300(定價係指各種房型之最高備查價格區間，各房型實際售價請依旅宿業者公布為主。),-
落腳民宿,臺東縣臺東市新生里10鄰仁一街251號,0918-113940,-,4間,NT$3000-4500(定價係指各種房型之最高備查價格區間，各房型實際售價請依旅宿業者公布為主。),-
INMYHOUSE在自己家民宿,臺東縣綠島鄉南寮村南寮91號,0919-127952,-,4間,NT$1800-2600(定價係指各種房型之最高備查價格區間，各房型實際售價請依旅宿業者公布為主。),-
東方大飯店,臺東縣臺東市中華里中華路一段136號2樓1-12,0932-660865,-,12間,NT$3000-4500(定價係指各種房型之最高備查價格區間，各房型實際售價請依旅宿業者公布為主。),-
青青民宿,臺東縣臺東市新站二街56號,0926-510026,-,5間,NT$4000-6000(定價係指各種房型之最高備查價格區間，各房型實際售價請依旅宿業者公布為主。),-
杉原古民家民宿,臺東縣卑南鄉富山村杉原67號,0978-623665,-,1間,NT$3200-3200(定價係指各種房型之最高備查價格區間，各房型實際售價請依旅宿業者公布為主。),-
輕風日和民宿,臺東縣臺東市北安路52巷118號,0913-870867,-,5間,NT$6200-6200(定價係指各種房型之最高備查價格區間，各房型實際售價請依旅宿業者公布為主。),-
沐民宿,臺東縣長濱鄉城子埔5-20號,0963-737031,-,5間,NT$12000-15000(定價係指各種房型之最高備查價格區間，各房型實際售價請依旅宿業者公布為主。),-
東眠民宿,臺東縣臺東市新生里24鄰濟南街65號,0983-001536,-,5間,NT$4200-4600(定價係指各種房型之最高備查價格區間，各房型實際售價請依旅宿業者公布為主。),-
羿修的家民宿,臺東縣臺東市建國里24鄰中正路30號,089-337411,-,2間,NT$5000-5000(定價係指各種房型之最高備查價格區間，各房型實際售價請依旅宿業者公布為主。),-
哈客棧民宿,臺東縣池上鄉池上鄉福文村文田路138號,09-87498025,-,3間,NT$1200-2400(定價係指各種房型之最高備查價格區間，各房型實際售價請依旅宿業者公布為主。),-
