旅宿名稱,地址,電話,官方網站,總房間數,定價,定價i,星級
諾丁漢海洋城堡民宿,花蓮縣花蓮市民有里14鄰海濱街89號,0922-865112,https://www.nottinghambnb.com/,5間,NT$3500-18000(定價係指各種房型之最高備查價格區間，各房型實際售價請依旅宿業者公布為主。),3500,-
真愛夜市電梯館民宿,花蓮縣花蓮市主計里8鄰忠孝街29之2號,0928-610350,-,5間,NT$3500-6000(定價係指各種房型之最高備查價格區間，各房型實際售價請依旅宿業者公布為主。),3500,-
和你民宿,花蓮縣新城鄉新城村26鄰中山路2之19號,0965-350589,-,5間,NT$3500-5500(定價係指各種房型之最高備查價格區間，各房型實際售價請依旅宿業者公布為主。),3500,-
荷苑民宿,花蓮縣吉安鄉仁和村8鄰南海三街200巷8號,0978-009197,https://www.0968521686.com/,4間,NT$3500-5000(定價係指各種房型之最高備查價格區間，各房型實際售價請依旅宿業者公布為主。),3500,-
海景軒民宿,花蓮縣壽豐鄉鹽寮村5鄰塩寮200之3號,0935-540059,-,4間,NT$3500-4980(定價係指各種房型之最高備查價格區間，各房型實際售價請依旅宿業者公布為主。),3500,-
北緯23.5度N民宿,花蓮縣吉安鄉永安村16鄰明仁一街51巷8號,0918-811764,-,3間,NT$3500-5500(定價係指各種房型之最高備查價格區間，各房型實際售價請依旅宿業者公布為主。),3500,-
東好民宿,花蓮縣玉里鎮中城里8鄰仁愛路一段199號,0937-976733,https://donghaohotel.tw,5間,NT$3500-4500(定價係指各種房型之最高備查價格區間，各房型實際售價請依旅宿業者公布為主。),3500,-
太魯閣767農莊民宿,花蓮縣秀林鄉秀林村4鄰民治35之22號,0965-325835,-,4間,NT$3500-4500(定價係指各種房型之最高備查價格區間，各房型實際售價請依旅宿業者公布為主。),3500,-
穗香民宿,花蓮縣瑞穗鄉瑞美村6鄰國光南路78號,0976-224978,-,5間,NT$3500-5000(定價係指各種房型之最高備查價格區間，各房型實際售價請依旅宿業者公布為主。),3500,-
北歐先生民宿,花蓮縣花蓮市國慶里12鄰中央路三段663號,0937-160167,-,5間,NT$3560-5960(定價係指各種房型之最高備查價格區間，各房型實際售價請依旅宿業者公布為主。),3560,-
犀牛的家民宿,花蓮縣花蓮市國聯里國聯一路129號,03-8357333,https://rhinohostel.com/index.php,4間,NT$3600-3600(定價係指各種房型之最高備查價格區間，各房型實際售價請依旅宿業者公布為主。),3600,-
洄瀾客棧,花蓮縣花蓮市民立里7鄰海岸路11號,03-8227188,http://ola.com.tw/,114間,NT$3600-5800(定價係指各種房型之最高備查價格區間，各房型實際售價請依旅宿業者公布為主。),3600,-
夏洛克民宿,花蓮縣吉安鄉干城村5鄰干城二街125巷12號,0988-959922,-,5間,NT$3600-7200(定價係指各種房型之最高備查價格區間，各房型實際售價請依旅宿業者公布為主。),3600,-
采沃旅店,花蓮縣花蓮市民享里3鄰球崙二路52巷16弄2號,03-8246399,-,43間,NT$3600-6600(定價係指各種房型之最高備查價格區間，各房型實際售價請依旅宿業者公布為主。),3600,-
旺家馨民宿,花蓮縣吉安鄉南昌村25鄰南昌路58之1號,0966-605596,-,5間,NT$3600-6000(定價係指各種房型之最高備查價格區間，各房型實際售價請依旅宿業者公布為主。),3600,-
花漾禾楓民宿,花蓮縣吉安鄉北昌村1鄰自立路2段5號,0963-011979,http://beautyflower.jri.tw/,5間,NT$3600-6600(定價係指各種房型之最高備查價格區間，各房型實際售價請依旅宿業者公布為主。),3600,-
悠旅民宿,花蓮縣花蓮市國盛里國民九街8之1號,0970-722977,-,5間,NT$3600-5600(定價係指各種房型之最高備查價格區間，各房型實際售價請依旅宿業者公布為主。),3600,-
二姐民宿,花蓮縣花蓮市民德里民德一街23號,0923-620807,http://chann8321575.pgo.tw,4間,NT$3600-5500(定價係指各種房型之最高備查價格區間，各房型實際售價請依旅宿業者公布為主。),3600,-
EZday民宿,花蓮縣吉安鄉宜昌村9鄰吉祥三街22號,03-8549973,http://ezday-bnb.com,3間,NT$3600-5000(定價係指各種房型之最高備查價格區間，各房型實際售價請依旅宿業者公布為主。),3600,-
人友民宿,花蓮縣吉安鄉光華村華城六街126號,0983-580660,-,4間,NT$3600-4800(定價係指各種房型之最高備查價格區間，各房型實際售價請依旅宿業者公布為主。),3600,-
印象．In巷民宿,花蓮縣花蓮市國防里進豐街57巷56號,0972-288513,-,5間,NT$3600-5000(定價係指各種房型之最高備查價格區間，各房型實際售價請依旅宿業者公布為主。),3600,-
吉美民宿,花蓮縣吉安鄉勝安村民治路436號,03-8522225,http://www.jimeihomestay.com/,5間,NT$3600-7200(定價係指各種房型之最高備查價格區間，各房型實際售價請依旅宿業者公布為主。),3600,-
玫瑰花園,花蓮縣花蓮市民生里公園路7-1號,03-8325857,http://www.roseland.com.tw/,3間,NT$3600-7500(定價係指各種房型之最高備查價格區間，各房型實際售價請依旅宿業者公布為主。),3600,-
夢田信箱田園民宿,花蓮縣花蓮市國興里建國路二段122巷21號,0915-175252,http://www.dream-home.idv.tw,4間,NT$3600-5000(定價係指各種房型之最高備查價格區間，各房型實際售價請依旅宿業者公布為主。),3600,-
綠窗小築民宿,花蓮縣花蓮市主力里國風街21巷19號,03-8331719,-,3間,NT$3600-4500(定價係指各種房型之最高備查價格區間，各房型實際售價請依旅宿業者公布為主。),3600,-
瑞穗山下的厝溫泉民宿,花蓮縣瑞穗鄉瑞祥村溫泉路3段137號,03-8870203,http://www.sunshinehotspring.com/,3間,NT$3600-9600(定價係指各種房型之最高備查價格區間，各房型實際售價請依旅宿業者公布為主。),3600,-
來去海邊民宿,花蓮縣豐濱鄉豐濱村永豐1-2號,03-8791898,http://59.127.207.35/www/idea1.htm,2間,NT$3600-5000(定價係指各種房型之最高備查價格區間，各房型實際售價請依旅宿業者公布為主。),3600,-
鳳凰52民宿,花蓮縣鳳林鎮鳳義里鳳凰路52號,0932-654137,-,2間,NT$3600-6000(定價係指各種房型之最高備查價格區間，各房型實際售價請依旅宿業者公布為主。),3600,-
花蓮希臘手作旅店民宿,花蓮縣吉安鄉北昌村37鄰建昌路140巷8弄7號,0913-182951,http://greece4251.pixnet.net,3間,NT$3600-4500(定價係指各種房型之最高備查價格區間，各房型實際售價請依旅宿業者公布為主。),3600,-
信義之家民宿,花蓮縣花蓮市主睦里信義街17-1號3樓,0933-995050,http://shinyi.970bnb.net/,3間,NT$3600-4000(定價係指各種房型之最高備查價格區間，各房型實際售價請依旅宿業者公布為主。),3600,-
薇琪小屋民宿,花蓮縣花蓮市國興四街8號,0905-516615,-,4間,NT$3600-5600(定價係指各種房型之最高備查價格區間，各房型實際售價請依旅宿業者公布為主。),3600,-
山腳民宿,花蓮縣吉安鄉太昌村中山路四段103號,03-8571810,-,2間,NT$3600-3600(定價係指各種房型之最高備查價格區間，各房型實際售價請依旅宿業者公布為主。),3600,-
梅匠庭園民宿,花蓮縣壽豐鄉志學村11鄰志新街123號,03-8663877,http://www.mei-jung.com,5間,NT$3600-4500(定價係指各種房型之最高備查價格區間，各房型實際售價請依旅宿業者公布為主。),3600,-
橋見幸福民宿,花蓮縣花蓮市國盛八街107號,0933-482752,-,5間,NT$3600-5600(定價係指各種房型之最高備查價格區間，各房型實際售價請依旅宿業者公布為主。),3600,-
回然慢時旅居,花蓮縣花蓮市國聯里10鄰國聯一路201號,03-8361116,https://www.mecihotel201.com/,42間,NT$3600-6400(定價係指各種房型之最高備查價格區間，各房型實際售價請依旅宿業者公布為主。),3600,-
戀戀花蓮住宿民宿,花蓮縣吉安鄉東昌村18鄰東海十街156巷19之3號,0986-993293,-,3間,NT$3600-6000(定價係指各種房型之最高備查價格區間，各房型實際售價請依旅宿業者公布為主。),3600,-
越牆工園民宿,花蓮縣壽豐鄉鹽寮村鹽寮146號,0936-833790,-,2間,NT$3600-3600(定價係指各種房型之最高備查價格區間，各房型實際售價請依旅宿業者公布為主。),3600,-
感覺民宿,花蓮縣吉安鄉勝安二街152巷1號,0916-039707,-,3間,NT$3600-5600(定價係指各種房型之最高備查價格區間，各房型實際售價請依旅宿業者公布為主。),3600,-
福田居民宿,花蓮縣吉安鄉福興村11鄰福興五街460號,03-8531105,-,4間,NT$3600-3600(定價係指各種房型之最高備查價格區間，各房型實際售價請依旅宿業者公布為主。),3600,-
白兔先生民宿,花蓮縣花蓮市國威里大同街48號,03-8322733,-,5間,NT$3600-5000(定價係指各種房型之最高備查價格區間，各房型實際售價請依旅宿業者公布為主。),3600,-
山海戀民宿,花蓮縣吉安鄉仁安村11鄰南海三街153號,03-8532708,-,4間,NT$3600-3600(定價係指各種房型之最高備查價格區間，各房型實際售價請依旅宿業者公布為主。),3600,-
翔美客宅院民宿,花蓮縣花蓮市民立里民德一街176號,0927-089089,-,3間,NT$3600-3600(定價係指各種房型之最高備查價格區間，各房型實際售價請依旅宿業者公布為主。),3600,-
異國風情民宿,花蓮縣花蓮市國強里豐村51-9號,03-8562512,-,3間,NT$3600-4800(定價係指各種房型之最高備查價格區間，各房型實際售價請依旅宿業者公布為主。),3600,-
春日小築民宿,花蓮縣吉安鄉東昌村11鄰東海一街114巷5號,0905-187885,-,4間,NT$3600-3600(定價係指各種房型之最高備查價格區間，各房型實際售價請依旅宿業者公布為主。),3600,-
双魚6號民宿,花蓮縣花蓮市民孝里9鄰東興三街6號,0972-708875,-,4間,NT$3600-7200(定價係指各種房型之最高備查價格區間，各房型實際售價請依旅宿業者公布為主。),3600,-
總裁行館民宿,花蓮縣花蓮市國光里尚志路29之7號,03-8246737,-,4間,NT$3600-5000(定價係指各種房型之最高備查價格區間，各房型實際售價請依旅宿業者公布為主。),3600,-
玉溫泉民宿,花蓮縣富里鄉吳江村安通58之9號,03-8888588,-,5間,NT$3600-3600(定價係指各種房型之最高備查價格區間，各房型實際售價請依旅宿業者公布為主。),3600,-
眺．舍旅店民宿,花蓮縣吉安鄉自強路113號,0905-992360,-,5間,NT$3600-3600(定價係指各種房型之最高備查價格區間，各房型實際售價請依旅宿業者公布為主。),3600,-
薩爾茲堡莊園民宿,花蓮縣壽豐鄉月眉村月眉3段127號,0921-688139,http://www.salzburg.com.tw,4間,NT$3600-6600(定價係指各種房型之最高備查價格區間，各房型實際售價請依旅宿業者公布為主。),3600,-
橘子糖民宿,花蓮縣花蓮市國防里進豐街113巷1弄11號,03-8359682,-,3間,NT$3600-4600(定價係指各種房型之最高備查價格區間，各房型實際售價請依旅宿業者公布為主。),3600,-
璞舍民宿,花蓮縣花蓮市民孝里東興三街10號,03-8239851,-,5間,NT$3600-4800(定價係指各種房型之最高備查價格區間，各房型實際售價請依旅宿業者公布為主。),3600,-
遠山林舍民宿,花蓮縣壽豐鄉平和村大學路二段63巷108弄30號,03-8662968,-,5間,NT$3600-4800(定價係指各種房型之最高備查價格區間，各房型實際售價請依旅宿業者公布為主。),3600,-
呼吸民宿,花蓮縣吉安鄉宜昌村9鄰吉祥三街22之2號,03-8529836,-,5間,NT$3600-4800(定價係指各種房型之最高備查價格區間，各房型實際售價請依旅宿業者公布為主。),3600,-
小晴天旅宿民宿,花蓮縣花蓮市民德一街158號,03-8233872,-,3間,NT$3600-6000(定價係指各種房型之最高備查價格區間，各房型實際售價請依旅宿業者公布為主。),3600,-
色彩空間民宿,花蓮縣新城鄉嘉里村嘉里三街260巷3號,03-8266380,http://www.fasbnb.com,4間,NT$3600-6800(定價係指各種房型之最高備查價格區間，各房型實際售價請依旅宿業者公布為主。),3600,-
靚民宿,花蓮縣吉安鄉稻香村25鄰廣賢路一段111號,0965-136111,-,4間,NT$3600-6000(定價係指各種房型之最高備查價格區間，各房型實際售價請依旅宿業者公布為主。),3600,-
成功168民宿,花蓮縣花蓮市主和里成功街168號,0981-333168,-,5間,NT$3600-4800(定價係指各種房型之最高備查價格區間，各房型實際售價請依旅宿業者公布為主。),3600,-
漫享民宿,花蓮縣吉安鄉光華村海岸路909號,0933-480957,-,5間,NT$3600-6800(定價係指各種房型之最高備查價格區間，各房型實際售價請依旅宿業者公布為主。),3600,-
美侖溪畔民宿,花蓮縣花蓮市國盛里26鄰國盛五街11號,0921-687785,http://www.meilunbnb.com/,4間,NT$3600-4800(定價係指各種房型之最高備查價格區間，各房型實際售價請依旅宿業者公布為主。),3600,-
幸福花田民宿,花蓮縣花蓮市主權里德安四街31之1號,03-8312316,-,5間,NT$3600-4800(定價係指各種房型之最高備查價格區間，各房型實際售價請依旅宿業者公布為主。),3600,-
十分有去民宿,花蓮縣花蓮市民孝里民孝街48號,0915-835015,-,2間,NT$3600-3600(定價係指各種房型之最高備查價格區間，各房型實際售價請依旅宿業者公布為主。),3600,-
鯉魚潭水漣渡假飯店,花蓮縣壽豐鄉池南村17鄰林園24號之2,03-8641400,-,14間,NT$3600-3600(定價係指各種房型之最高備查價格區間，各房型實際售價請依旅宿業者公布為主。),3600,-
放花蓮背包客棧民宿,花蓮縣花蓮市國盛一街228號,0972-376002,-,4間,NT$3600-6000(定價係指各種房型之最高備查價格區間，各房型實際售價請依旅宿業者公布為主。),3600,-
米拉賓民宿,花蓮縣吉安鄉宜昌村中華路二段120巷1號,0920-956366,-,4間,NT$3600-4500(定價係指各種房型之最高備查價格區間，各房型實際售價請依旅宿業者公布為主。),3600,-
荷雅居民宿,花蓮縣豐濱鄉港口村大港口1之8號,03-8781707,http://www.hlocean.tw/,5間,NT$3600-5500(定價係指各種房型之最高備查價格區間，各房型實際售價請依旅宿業者公布為主。),3600,-
六街民宿,花蓮縣花蓮市富裕六街22號,0918-793371,-,5間,NT$3600-4600(定價係指各種房型之最高備查價格區間，各房型實際售價請依旅宿業者公布為主。),3600,-
吉野閣民宿,花蓮縣吉安鄉福興村15鄰舊村一街23號,0927-898266,-,5間,NT$3600-3600(定價係指各種房型之最高備查價格區間，各房型實際售價請依旅宿業者公布為主。),3600,-
貓貓咪亞民宿,花蓮縣花蓮市中正路378號,0956-784000,-,4間,NT$3600-4800(定價係指各種房型之最高備查價格區間，各房型實際售價請依旅宿業者公布為主。),3600,-
愛戀鄉村風民宿,花蓮縣花蓮市國裕里富陽路43號,0937-608533,-,5間,NT$3600-9000(定價係指各種房型之最高備查價格區間，各房型實際售價請依旅宿業者公布為主。),3600,-
海芸民宿,花蓮縣花蓮市海濱街43號,0963-591589,-,12間,NT$3600-6800(定價係指各種房型之最高備查價格區間，各房型實際售價請依旅宿業者公布為主。),3600,-
東畔民宿,花蓮縣壽豐鄉平和村25鄰大學路二段63巷39號,0972-723550,-,5間,NT$3600-4800(定價係指各種房型之最高備查價格區間，各房型實際售價請依旅宿業者公布為主。),3600,-
品沐民宿,花蓮縣花蓮市民族里中山路155號,0933-992537,-,5間,NT$3600-5600(定價係指各種房型之最高備查價格區間，各房型實際售價請依旅宿業者公布為主。),3600,-
筑夢民宿,花蓮縣花蓮市國聯五路11-2號,0927-785268,-,5間,NT$3600-3600(定價係指各種房型之最高備查價格區間，各房型實際售價請依旅宿業者公布為主。),3600,-
愛思黛民宿,花蓮縣花蓮市國興二街66號,0933-799175,-,5間,NT$3600-6600(定價係指各種房型之最高備查價格區間，各房型實際售價請依旅宿業者公布為主。),3600,-
樂天園民宿,花蓮縣鳳林鎮林榮里永康路85號,03-8772389,-,3間,NT$3600-3600(定價係指各種房型之最高備查價格區間，各房型實際售價請依旅宿業者公布為主。),3600,-
溫馨可愛民宿,花蓮縣花蓮市林森路361巷1弄2號,0910-003611,-,5間,NT$3600-3600(定價係指各種房型之最高備查價格區間，各房型實際售價請依旅宿業者公布為主。),3600,-
水漣旅館,花蓮縣壽豐鄉池南村17鄰林園路24之1號,03-8641400,-,14間,NT$3600-3600(定價係指各種房型之最高備查價格區間，各房型實際售價請依旅宿業者公布為主。),3600,-
農舍居民宿,花蓮縣吉安鄉永興村1鄰永吉二街235號,0921-862132,-,5間,NT$3600-3600(定價係指各種房型之最高備查價格區間，各房型實際售價請依旅宿業者公布為主。),3600,-
趣旅行民宿,花蓮縣花蓮市國民九街35號,0961-199334,-,5間,NT$3600-4800(定價係指各種房型之最高備查價格區間，各房型實際售價請依旅宿業者公布為主。),3600,-
760高地民宿,花蓮縣吉安鄉南華村15鄰南華一街366號,03-8523785,-,4間,NT$3600-5600(定價係指各種房型之最高備查價格區間，各房型實際售價請依旅宿業者公布為主。),3600,-
天地‧艺术概念民宿,花蓮縣吉安鄉勝安村中原路一段49巷15號,03-8543039,http://www.hotel038.com.tw,4間,NT$3600-4500(定價係指各種房型之最高備查價格區間，各房型實際售價請依旅宿業者公布為主。),3600,-
安德森幸福莊園民宿,花蓮縣瑞穗鄉瑞穗村中正北路一段431號,0921-466256,http://andersondora1011.tw/index.php,5間,NT$3600-5000(定價係指各種房型之最高備查價格區間，各房型實際售價請依旅宿業者公布為主。),3600,-
牛舍土樓民宿,花蓮縣吉安鄉光華村2鄰永華一街92號,0911-385006,http://cowhouse.hi-bnb.com/,5間,NT$3600-5200(定價係指各種房型之最高備查價格區間，各房型實際售價請依旅宿業者公布為主。),3600,-
東岸精緻商務旅館,花蓮縣花蓮市國魂里1鄰延平街45號,03-8332889,-,79間,NT$3600-7800(定價係指各種房型之最高備查價格區間，各房型實際售價請依旅宿業者公布為主。),3600,-
蜜居民宿,花蓮縣花蓮市廣東街183號,0912-674552,-,5間,NT$3600-6400(定價係指各種房型之最高備查價格區間，各房型實際售價請依旅宿業者公布為主。),3600,-
拾穗精品民宿,花蓮縣新城鄉嘉里村38鄰仁義街83號,0905-185953,-,3間,NT$3600-4500(定價係指各種房型之最高備查價格區間，各房型實際售價請依旅宿業者公布為主。),3600,-
幸運工匠民宿,花蓮縣吉安鄉太昌村12鄰明義五街216巷3號,0976-687602,-,4間,NT$3600-6000(定價係指各種房型之最高備查價格區間，各房型實際售價請依旅宿業者公布為主。),3600,-
樂文旅民宿,花蓮縣花蓮市主工里中正路475號,0933-482765,-,5間,NT$3600-3600(定價係指各種房型之最高備查價格區間，各房型實際售價請依旅宿業者公布為主。),3600,-
立霧客棧,花蓮縣秀林鄉富世村11鄰富世242之2號,03-8610660,http://www.liwu.hoseo.tw/,18間,NT$3600-7800(定價係指各種房型之最高備查價格區間，各房型實際售價請依旅宿業者公布為主。),3600,-
觀想139民宿,花蓮縣花蓮市國盛里國民八街139號,03-8339668,-,5間,NT$3600-4600(定價係指各種房型之最高備查價格區間，各房型實際售價請依旅宿業者公布為主。),3600,-
涵庭民宿,花蓮縣花蓮市國慶里中山路一段229號,0922-266644,-,5間,NT$3600-4800(定價係指各種房型之最高備查價格區間，各房型實際售價請依旅宿業者公布為主。),3600,-
艾米爾電梯時尚民宿,花蓮縣花蓮市國聯里14鄰國興二街100號,0905-723686,http://www.amirbnb.com,5間,NT$3600-4000(定價係指各種房型之最高備查價格區間，各房型實際售價請依旅宿業者公布為主。),3600,-
群心園民宿,花蓮縣吉安鄉福興村福興六街449號,03-8527130,-,4間,NT$3600-6000(定價係指各種房型之最高備查價格區間，各房型實際售價請依旅宿業者公布為主。),3600,-
開心居民宿,花蓮縣花蓮市民生里中正路572號,0933-480432,-,5間,NT$3600-4000(定價係指各種房型之最高備查價格區間，各房型實際售價請依旅宿業者公布為主。),3600,-
艾迪行旅民宿,花蓮縣瑞穗鄉國光南路60巷40號,0978-165703,-,3間,NT$3600-4600(定價係指各種房型之最高備查價格區間，各房型實際售價請依旅宿業者公布為主。),3600,-
文旅小自由民宿,花蓮縣花蓮市國盛二街41號,0936-912918,http://www.facebook.com/smalltravelodge/,5間,NT$3600-3600(定價係指各種房型之最高備查價格區間，各房型實際售價請依旅宿業者公布為主。),3600,-
客亭商旅,花蓮縣玉里鎮中城里34鄰樂園街7號,03-8881000,http://www.ket-hotel.com,36間,NT$3600-4580(定價係指各種房型之最高備查價格區間，各房型實際售價請依旅宿業者公布為主。),3600,-
遊手浩賢民宿,花蓮縣秀林鄉富世3之9號,0933-775036,-,3間,NT$3600-3600(定價係指各種房型之最高備查價格區間，各房型實際售價請依旅宿業者公布為主。),3600,-
紫軒屋民宿,花蓮縣富里鄉朝寧97號,0933-090161,-,5間,NT$3600-5000(定價係指各種房型之最高備查價格區間，各房型實際售價請依旅宿業者公布為主。),3600,-
蒔菓花園民宿,花蓮縣秀林鄉佳民村7鄰佳民101之12號,0937-168881,-,5間,NT$3600-6000(定價係指各種房型之最高備查價格區間，各房型實際售價請依旅宿業者公布為主。),3600,-
停佇宿旅民宿,花蓮縣花蓮市主和里29鄰成功街46之1號,0920-984313,-,3間,NT$3600-3600(定價係指各種房型之最高備查價格區間，各房型實際售價請依旅宿業者公布為主。),3600,-
寬品居站前民宿,花蓮縣花蓮市國盛里27鄰國民八街151號,0933-483811,-,4間,NT$3600-4200(定價係指各種房型之最高備查價格區間，各房型實際售價請依旅宿業者公布為主。),3600,-
檜樂行旅民宿,花蓮縣吉安鄉仁里村40鄰吉豐路二段86號,0919-354535,-,5間,NT$3600-8600(定價係指各種房型之最高備查價格區間，各房型實際售價請依旅宿業者公布為主。),3600,-
日光漫旅民宿,花蓮縣花蓮市主和里29鄰成功街46之5號,0933-060573,-,3間,NT$3600-4200(定價係指各種房型之最高備查價格區間，各房型實際售價請依旅宿業者公布為主。),3600,-
花蓮安隱民宿,花蓮縣花蓮市國盛里19鄰國民九街50號,0932-147253,-,5間,NT$3600-6860(定價係指各種房型之最高備查價格區間，各房型實際售價請依旅宿業者公布為主。),3600,-
新京站民宿,花蓮縣花蓮市富陽路16號,0937-168139,http://www.tw161688.com,5間,NT$3680-5680(定價係指各種房型之最高備查價格區間，各房型實際售價請依旅宿業者公布為主。),3680,-
康迎民宿,花蓮縣花蓮市富陽路16-1號,0922-937963,-,5間,NT$3680-5680(定價係指各種房型之最高備查價格區間，各房型實際售價請依旅宿業者公布為主。),3680,-
富爾捷火車站前民宿,花蓮縣新城鄉北埔村26鄰復興路259號,0905-295536,-,14間,NT$3760-5560(定價係指各種房型之最高備查價格區間，各房型實際售價請依旅宿業者公布為主。),3760,-
河岩躍舍民宿,花蓮縣富里鄉學田村3鄰復興路83號,0917-707019,-,5間,NT$3780-5980(定價係指各種房型之最高備查價格區間，各房型實際售價請依旅宿業者公布為主。),3780,-
法洛米民宿,花蓮縣吉安鄉干城村干城一街135號,0988-815135,-,4間,NT$3800-5600(定價係指各種房型之最高備查價格區間，各房型實際售價請依旅宿業者公布為主。),3800,-
艾米卡薩民宿,花蓮縣花蓮市中順街29號,03-8311667,-,4間,NT$3800-6000(定價係指各種房型之最高備查價格區間，各房型實際售價請依旅宿業者公布為主。),3800,-
車站一百米民宿,花蓮縣花蓮市國興一街20號,0965-312180,-,5間,NT$3800-3800(定價係指各種房型之最高備查價格區間，各房型實際售價請依旅宿業者公布為主。),3800,-
後山圓夢民宿,花蓮縣新城鄉康樂村精舍街88巷2-1號,03-8263828,-,2間,NT$3800-3800(定價係指各種房型之最高備查價格區間，各房型實際售價請依旅宿業者公布為主。),3800,-
洄瀾灣民宿,花蓮縣吉安鄉仁安村海濱15號,03-8520280,http://hualienbay.hlbnb.com.tw/,5間,NT$3800-4800(定價係指各種房型之最高備查價格區間，各房型實際售價請依旅宿業者公布為主。),3800,-
我的幸福烘焙房民宿,花蓮縣新城鄉順安村草林1之8號,03-8612058,-,5間,NT$3800-6800(定價係指各種房型之最高備查價格區間，各房型實際售價請依旅宿業者公布為主。),3800,-
印象花蓮民宿,花蓮縣花蓮市國裕里富裕五街105號,03-8578077,http://www.normansbnb.com,4間,NT$3800-6400(定價係指各種房型之最高備查價格區間，各房型實際售價請依旅宿業者公布為主。),3800,-
璞拉漫ㄚ瑪民宿,花蓮縣花蓮市民勤里民權六街31號,0919-908809,-,4間,NT$3800-5200(定價係指各種房型之最高備查價格區間，各房型實際售價請依旅宿業者公布為主。),3800,-
