旅宿名稱,地址,電話,官方網站,總房間數,定價,定價i,星級
太信大飯店,雲林縣斗六市太平路7號7-9樓,05-5352889,-,47間,NT$4900-4900(定價係指各種房型之最高備查價格區間，各房型實際售價請依旅宿業者公布為主。),4900,-
凹凸宿嬉遊,雲林縣古坑鄉永光村文昌路56巷12號,0930-939017,https://www.facebook.com/stayyunlinwithus/,4間,NT$5000-5000(定價係指各種房型之最高備查價格區間，各房型實際售價請依旅宿業者公布為主。),5000,-
皇居汽車旅館(禾楓斗六館),雲林縣斗六市建興路11號,05-5325111,http://www.hhsm.com.tw,21間,NT$5800-8000(定價係指各種房型之最高備查價格區間，各房型實際售價請依旅宿業者公布為主。),5800,-
寄寓,雲林縣莿桐鄉大美村6鄰大美21-196號,0911-103346,-,4間,NT$6000-6000(定價係指各種房型之最高備查價格區間，各房型實際售價請依旅宿業者公布為主。),6000,-
觀月商務休閒旅館,雲林縣斗六市雲林路二段196號,05-5343333,http://www.moonarea.com.tw,41間,NT$6760-9160(定價係指各種房型之最高備查價格區間，各房型實際售價請依旅宿業者公布為主。),6760,3
金花園汽車旅館,雲林縣虎尾鎮東明路9號,05-6338866,http://www.mymotel.com,56間,NT$7000-7360(定價係指各種房型之最高備查價格區間，各房型實際售價請依旅宿業者公布為主。),7000,-
風華渡假旅館,雲林縣虎尾鎮平和里平和20-15號,05-6366666,https://yunlin.orientluxuryhotel.com.tw/,31間,NT$7000-7000(定價係指各種房型之最高備查價格區間，各房型實際售價請依旅宿業者公布為主。),7000,-
朝聖酒店,雲林縣北港鎮中山路146號3樓,05-7822999,https://kaoyuhotel-s.com.tw/,99間,NT$8000-18000(定價係指各種房型之最高備查價格區間，各房型實際售價請依旅宿業者公布為主。),8000,-
虎尾春秋,雲林縣虎尾鎮信義路69號,05-6360618,-,24間,NT$9500-11000(定價係指各種房型之最高備查價格區間，各房型實際售價請依旅宿業者公布為主。),9500,-
