旅宿名稱,地址,電話,官方網站,總房間數,定價,定價i,星級
立建賓館,"臺北市松山區八德路四段656,656-1號7-8樓",02-27691135,https://www.facebook.com/leechanhotel,66間,NT$3500-5500(定價係指各種房型之最高備查價格區間，各房型實際售價請依旅宿業者公布為主。),3500,-
皇家季節酒店2館,臺北市大同區南京西路330號1至11樓,"02-25556488,25586488",http://www.taiwanseasonshotel.com,46間,NT$3500-9000(定價係指各種房型之最高備查價格區間，各房型實際售價請依旅宿業者公布為主。),3500,-
幸福大旅社,臺北市萬華區內江街55巷26號1-4樓,02-23716808,-,22間,NT$3500-4500(定價係指各種房型之最高備查價格區間，各房型實際售價請依旅宿業者公布為主。),3500,-
香都大飯店(香城長安),臺北市中山區長安東路一段52號1-7樓,02-25312121,http://www.city-hotel.com.tw,35間,NT$3520-4400(定價係指各種房型之最高備查價格區間，各房型實際售價請依旅宿業者公布為主。),3520,-
洛碁大飯店林森館,臺北市中山區林森北路617號1至10樓,02-25955225,http://www.greenworldhotels.com/,80間,NT$3600-6600(定價係指各種房型之最高備查價格區間，各房型實際售價請依旅宿業者公布為主。),3600,-
互舍商旅台北館,臺北市大同區重慶北路二段172號1至14樓、5樓之1至14樓之1及174號、保安街13、11號4樓,02-25533919,http://www.hu-house.com,148間,NT$3600-36000(定價係指各種房型之最高備查價格區間，各房型實際售價請依旅宿業者公布為主。),3600,-
橙舍背包客國際青年旅館,臺北市萬華區漢口街二段41號1-3樓,02-23119559,-,5間,NT$3600-9000(定價係指各種房型之最高備查價格區間，各房型實際售價請依旅宿業者公布為主。),3600,-
安和旅館,臺北市大安區安和路一段139號B1-7樓,02-27005088,http://ah.evergreenhotel.com.tw,45間,NT$3600-5200(定價係指各種房型之最高備查價格區間，各房型實際售價請依旅宿業者公布為主。),3600,-
橙舍青年旅館（臺北二館）,"臺北市萬華區漢口街二段56號2-3樓,58號3樓",02-23119559,-,22間,NT$3600-16000(定價係指各種房型之最高備查價格區間，各房型實際售價請依旅宿業者公布為主。),3600,-
香城大飯店松山分店,臺北市松山區市民大道六段67號1-9樓,02-27693969,http://www.city-hotel.com.tw,56間,NT$3600-4000(定價係指各種房型之最高備查價格區間，各房型實際售價請依旅宿業者公布為主。),3600,-
東京國際飯店,臺北市中山區長春路39號2-6樓,02-25643733,http://www.tokyohotel.com.tw/,43間,NT$3600-9000(定價係指各種房型之最高備查價格區間，各房型實際售價請依旅宿業者公布為主。),3600,-
國王大飯店,臺北市中山區南京東路1段118號,02-25811111,http://www.emperorhotel.com.tw/,97間,NT$3600-12000(定價係指各種房型之最高備查價格區間，各房型實際售價請依旅宿業者公布為主。),3600,-
長春精品旅館,臺北市松山區慶城街29號,02-27188268,https://www.taiwantravelmap.com/hotel/750-ch-index.html,86間,NT$3600-5200(定價係指各種房型之最高備查價格區間，各房型實際售價請依旅宿業者公布為主。),3600,-
清翼居旅店童話館,臺北市中正區開封街1段36號3-7樓,02-23117168,http://tp.morwinghotel.com/,39間,NT$3700-4900(定價係指各種房型之最高備查價格區間，各房型實際售價請依旅宿業者公布為主。),3700,-
富裕自由旅店-北車開封館,臺北市中正區開封街1段41號2-9樓,02-23881788,https://www.hotelrf.com/our-hotels.html,42間,NT$3800-25000(定價係指各種房型之最高備查價格區間，各房型實際售價請依旅宿業者公布為主。),3800,-
薇閣精品旅館,"臺北市中山區錦州街27、29號,31號2-4樓",02-25318000,-,87間,NT$3800-9000(定價係指各種房型之最高備查價格區間，各房型實際售價請依旅宿業者公布為主。),3800,-
新驛旅店,臺北市中正區懷寧街7號,02-23148008,-,51間,NT$3800-5800(定價係指各種房型之最高備查價格區間，各房型實際售價請依旅宿業者公布為主。),3800,-
太豪大飯店,臺北市松山區興安街137號1-6樓,02-27195152,http://www.city-hotel.com.tw,38間,NT$3800-4800(定價係指各種房型之最高備查價格區間，各房型實際售價請依旅宿業者公布為主。),3800,-
悅心旅,臺北市大同區重慶北路1段61號1樓至3樓,02-25591525,-,14間,NT$3800-6800(定價係指各種房型之最高備查價格區間，各房型實際售價請依旅宿業者公布為主。),3800,-
儷萊旅館,"臺北市中正區中華路一段21號4-5樓,8-11樓",02-23111440,-,78間,NT$3960-12000(定價係指各種房型之最高備查價格區間，各房型實際售價請依旅宿業者公布為主。),3960,2
探索汽車旅館南港館,臺北市南港區重陽路66號1至4樓,02-26537727,-,61間,NT$3980-19980(定價係指各種房型之最高備查價格區間，各房型實際售價請依旅宿業者公布為主。),3980,-
凱微精品旅館,臺北市中山區林森北路381號9-10樓,02-25426879,http://kaiwei.mmmtravel.com.tw,28間,NT$3980-5000(定價係指各種房型之最高備查價格區間，各房型實際售價請依旅宿業者公布為主。),3980,-
旅樂序精品旅館三館,臺北市中正區懷寧街34號1至8樓,02-23758333,http://www.hotelrelaxclub.com/,41間,NT$3988-5188(定價係指各種房型之最高備查價格區間，各房型實際售價請依旅宿業者公布為主。),3988,-
高雅賓館,臺北市大安區和平東路三段139號及139號2-7樓、141號及141號2-5樓,02-27388947,http://www.elegance-taipei.com,30間,NT$3990-4500(定價係指各種房型之最高備查價格區間，各房型實際售價請依旅宿業者公布為主。),3990,-
新驛旅店西門捷運店,"臺北市中正區衡陽路124號1-7樓,寶慶路63號",02-77252288,-,66間,NT$4000-7000(定價係指各種房型之最高備查價格區間，各房型實際售價請依旅宿業者公布為主。),4000,-
叙美精旅,臺北市中正區重慶南路1段111號,02-23832088,http://www.beautyhotels.com.tw,38間,NT$4000-8000(定價係指各種房型之最高備查價格區間，各房型實際售價請依旅宿業者公布為主。),4000,-
背包棧旅店西門店,臺北市萬華區康定路25巷13號,02-89783666,-,19間,NT$4000-12000(定價係指各種房型之最高備查價格區間，各房型實際售價請依旅宿業者公布為主。),4000,-
豪景大酒店,臺北市萬華區環河南路1段77號,02-23113131,http://www.riverview.com.tw,217間,NT$4000-10000(定價係指各種房型之最高備查價格區間，各房型實際售價請依旅宿業者公布為主。),4000,-
家賓大旅社,臺北市文山區景文街42號6-7樓,02-29325915,-,32間,NT$4000-6000(定價係指各種房型之最高備查價格區間，各房型實際售價請依旅宿業者公布為主。),4000,-
北門臥客青年旅舍,臺北市大同區甘谷街26號2樓之1,02-25557177,http://www.wecomehostel.com,5間,NT$4000-8000(定價係指各種房型之最高備查價格區間，各房型實際售價請依旅宿業者公布為主。),4000,-
第一大飯店,臺北市中山區南京東路2段63號,02-25418234,http://www.firsthoteltaipei.com,176間,NT$4000-10000(定價係指各種房型之最高備查價格區間，各房型實際售價請依旅宿業者公布為主。),4000,-
幸福蘋果旅店,臺北市萬華區峨眉街109、109-2號(1樓部分、2至7樓),02-2311-7877,-,49間,NT$4000-8000(定價係指各種房型之最高備查價格區間，各房型實際售價請依旅宿業者公布為主。),4000,-
儷客旅店-站前店,臺北市中正區忠孝西路一段72號5樓及5樓之1,02-23118081,https://www.muzikhotel.com.tw/,30間,NT$4000-5400(定價係指各種房型之最高備查價格區間，各房型實際售價請依旅宿業者公布為主。),4000,-
台灣青旅,臺北市中正區青島西路11號地下1樓,02-23613000,http://www.TaiwanYH.com,12間,NT$4000-5000(定價係指各種房型之最高備查價格區間，各房型實際售價請依旅宿業者公布為主。),4000,-
水滴米窩,臺北市中正區忠孝西路1段50號7樓、7樓之1、之2、之3、8樓,02-23810028,-,200間,NT$4000-6600(定價係指各種房型之最高備查價格區間，各房型實際售價請依旅宿業者公布為主。),4000,-
葛瑞絲商旅敦北館,臺北市松山區敦化北路216號1樓至5樓,02-27886682,https://www.gracehotel.com.tw,34間,NT$4180-14080(定價係指各種房型之最高備查價格區間，各房型實際售價請依旅宿業者公布為主。),4180,-
丹迪旅店-大安森林公園店,臺北市大安區信義路三段33號3-10樓,02-27076899,http://www.dandyhotel.com.tw,73間,NT$4200-8800(定價係指各種房型之最高備查價格區間，各房型實際售價請依旅宿業者公布為主。),4200,-
皇家大飯店,臺北市中正區懷寧街5-1號1-6樓,02-23111668,https://www.taipeiroyalhotel.com/,40間,NT$4280-6680(定價係指各種房型之最高備查價格區間，各房型實際售價請依旅宿業者公布為主。),4280,-
藝築文旅開封館,臺北市萬華區開封街二段63號,02-23312986,-,12間,NT$4280-17800(定價係指各種房型之最高備查價格區間，各房型實際售價請依旅宿業者公布為主。),4280,-
京都商務旅館,臺北市中山區長春路38號3-10樓,02-25673366,https://www.mrhost.com.tw/store/p307/taipeikyotohotel.html,40間,NT$4300-9000(定價係指各種房型之最高備查價格區間，各房型實際售價請依旅宿業者公布為主。),4300,-
新驛旅店復興北路店,臺北市中山區復興北路338號,02-25158777,-,120間,NT$4300-7300(定價係指各種房型之最高備查價格區間，各房型實際售價請依旅宿業者公布為主。),4300,-
台北碧瑤飯店,臺北市松山區八德路二段367號1-10樓,02-27813121,http://www.hotelb.com.tw/,84間,NT$4300-7800(定價係指各種房型之最高備查價格區間，各房型實際售價請依旅宿業者公布為主。),4300,-
瑞華旅社,臺北市大安區忠孝東路四段235號4-5樓,02-27413147,-,20間,NT$4300-4300(定價係指各種房型之最高備查價格區間，各房型實際售價請依旅宿業者公布為主。),4300,-
方舟旅店長安復興,臺北市中山區長安東路二段246號3樓、10樓及11樓,02-27727750,-,82間,NT$4300-18880(定價係指各種房型之最高備查價格區間，各房型實際售價請依旅宿業者公布為主。),4300,-
好駐旅館,臺北市中山區新生北路一段106號6樓、7樓、7樓之1-9,02-25213131,-,29間,NT$4360-7360(定價係指各種房型之最高備查價格區間，各房型實際售價請依旅宿業者公布為主。),4360,-
華麗大飯店,臺北市萬華區康定路41號,02-23818111,http://f-hotel.com.tw,88間,NT$4370-6120(定價係指各種房型之最高備查價格區間，各房型實際售價請依旅宿業者公布為主。),4370,-
福泰桔子商務旅館（林森店）,臺北市中山區林森北路139號1樓至8樓及地下室,02-25632688,-,88間,NT$4400-4950(定價係指各種房型之最高備查價格區間，各房型實際售價請依旅宿業者公布為主。),4400,-
盤古捷旅,臺北市中山區中山北路1段135巷39號(地上層至7層),02-25671001,http://www.panco-hotels.com.tw/,50間,NT$4400-8800(定價係指各種房型之最高備查價格區間，各房型實際售價請依旅宿業者公布為主。),4400,-
聖雄商旅,臺北市松山區基隆路一段8號、10號17至18樓,02-27600920,https://www.zuker.com.tw/,37間,NT$4400-7700(定價係指各種房型之最高備查價格區間，各房型實際售價請依旅宿業者公布為主。),4400,-
洛碁大飯店山水閣,臺北市中山區中山北路二段181號1-5樓,02-25971281,https://sansui.greenworldhotels.com/,32間,NT$4500-6600(定價係指各種房型之最高備查價格區間，各房型實際售價請依旅宿業者公布為主。),4500,-
洛碁大飯店慶天閣,臺北市中山區中山北路二段181號7-9樓,02-25971281,-,24間,NT$4500-6600(定價係指各種房型之最高備查價格區間，各房型實際售價請依旅宿業者公布為主。),4500,-
印石時尚旅館,臺北市文山區秀明路二段15號,02-86617070,http://gorates-hotel.com/web/summary/67,50間,NT$4500-12000(定價係指各種房型之最高備查價格區間，各房型實際售價請依旅宿業者公布為主。),4500,-
洛碁大飯店協美,臺北市中山區中山北路二段181號10-12樓,02-25971281,-,24間,NT$4500-6600(定價係指各種房型之最高備查價格區間，各房型實際售價請依旅宿業者公布為主。),4500,-
洛碁大飯店新仕界,臺北市萬華區昆明街139號2樓、141號3至9樓、7樓之1至13、8樓之1至8,02-23118863,http://newworld.greenworldhotels.com/,107間,NT$4500-8000(定價係指各種房型之最高備查價格區間，各房型實際售價請依旅宿業者公布為主。),4500,2
二十輪旅店大安店,臺北市大安區大安路一段183號，185號，185號2樓至7樓,02-27032220,http://www.swiio.com,30間,NT$4500-5000(定價係指各種房型之最高備查價格區間，各房型實際售價請依旅宿業者公布為主。),4500,-
丹迪旅店-天母店,臺北市士林區中山北路六段728巷2號1-7樓,02-28732222,-,54間,NT$4600-7000(定價係指各種房型之最高備查價格區間，各房型實際售價請依旅宿業者公布為主。),4600,-
山樂溫泉,臺北市北投區泉源路1巷17號1-2樓,02-28913388,-,9間,NT$4600-15000(定價係指各種房型之最高備查價格區間，各房型實際售價請依旅宿業者公布為主。),4600,-
老爺商務會館,臺北市中山區南京西路1號8-11樓,02-25316171,http://www.hotelroyal.com.tw,76間,NT$4620-7260(定價係指各種房型之最高備查價格區間，各房型實際售價請依旅宿業者公布為主。),4620,-
薇閣精品旅館(大直館),臺北市中山區敬業三路11號,02-85026000,-,96間,NT$4700-16800(定價係指各種房型之最高備查價格區間，各房型實際售價請依旅宿業者公布為主。),4700,-
葳皇時尚飯店,"臺北市大同區延平北路二段197號3,4,11樓",02-25575379,http://www.vonehotel.com/,48間,NT$4720-6520(定價係指各種房型之最高備查價格區間，各房型實際售價請依旅宿業者公布為主。),4720,-
艾爾行旅,臺北市大安區忠孝東路四段87號7樓、7樓之2、7樓之3、7樓之4及7樓之8,02-27418080,https://www.hej-hotel.com.tw/,40間,NT$4800-26000(定價係指各種房型之最高備查價格區間，各房型實際售價請依旅宿業者公布為主。),4800,-
富園國際商務飯店,臺北市萬華區中華路一段178號,02-23887890,http://www.rich-gardenhotel.com.tw,45間,NT$4800-10000(定價係指各種房型之最高備查價格區間，各房型實際售價請依旅宿業者公布為主。),4800,-
萬事達旅店(中華店),臺北市萬華區中華路一段82號1-9樓,02-23820889,http://www.wonstar.com.tw,56間,NT$4800-10800(定價係指各種房型之最高備查價格區間，各房型實際售價請依旅宿業者公布為主。),4800,-
采舍精品旅館,臺北市中山區農安街34號3樓及7樓,02-25963969,-,35間,NT$4800-6800(定價係指各種房型之最高備查價格區間，各房型實際售價請依旅宿業者公布為主。),4800,-
能量旅店,臺北市萬華區康定路25巷38號,02-23121211,http://www.energyinn.com.tw/,4間,NT$4800-6400(定價係指各種房型之最高備查價格區間，各房型實際售價請依旅宿業者公布為主。),4800,-
老爺會館台北林森,"臺北市中山區林森北路83號4-10樓,11,11-1,11-2,12,12-1,12-2樓",02-25676336,http://www.hotelroyal.com.tw/linsen/,81間,NT$4840-5500(定價係指各種房型之最高備查價格區間，各房型實際售價請依旅宿業者公布為主。),4840,-
怡品商旅,臺北市大安區忠孝東路四段87號13﹑14樓,02-27766136,http://www.eastin-taipei.com.tw,81間,NT$4880-20880(定價係指各種房型之最高備查價格區間，各房型實際售價請依旅宿業者公布為主。),4880,-
西門星辰大飯店,臺北市萬華區峨眉街94號2至9樓,02-23898898,http://www.ximen-citizenhotel.com/,65間,NT$4880-9380(定價係指各種房型之最高備查價格區間，各房型實際售價請依旅宿業者公布為主。),4880,-
宜家居商旅,臺北市北投區中和街40號3樓及3樓之1,02-28910502,http://www.e-jia.com.tw,39間,NT$4900-4900(定價係指各種房型之最高備查價格區間，各房型實際售價請依旅宿業者公布為主。),4900,-
二十輪旅店,臺北市萬華區武昌街二段72號5樓、6樓、10樓,02-23810500,-,48間,NT$4900-5400(定價係指各種房型之最高備查價格區間，各房型實際售價請依旅宿業者公布為主。),4900,-
玉璽精品飯店,臺北市士林區中山北路七段14巷2之3號2至10樓、11樓（11層及12層）,02-28766579,-,85間,NT$4950-6600(定價係指各種房型之最高備查價格區間，各房型實際售價請依旅宿業者公布為主。),4950,-
雀客旅館台北信義,臺北市信義區信義路四段468號3-13樓,02-23459777,-,88間,NT$5000-8800(定價係指各種房型之最高備查價格區間，各房型實際售價請依旅宿業者公布為主。),5000,-
金財神旅館,臺北市中正區中華路一段21號3樓,02-23110066,-,12間,NT$5000-12000(定價係指各種房型之最高備查價格區間，各房型實際售價請依旅宿業者公布為主。),5000,2
台北天晴旅店,臺北市中正區懷寧街92-2號1至6樓,02-23319391,-,15間,NT$5000-20000(定價係指各種房型之最高備查價格區間，各房型實際售價請依旅宿業者公布為主。),5000,-
兄弟大飯店,臺北市松山區南京東路3段255號,02-27123456,http://www.brotherhotel.com.tw,250間,NT$5000-6700(定價係指各種房型之最高備查價格區間，各房型實際售價請依旅宿業者公布為主。),5000,4
台糖台北會館,臺北市中正區中華路一段39號,02-23885522,https://www.taipeihotel-tsc.com.tw,68間,NT$5000-7200(定價係指各種房型之最高備查價格區間，各房型實際售價請依旅宿業者公布為主。),5000,-
東皇大飯店,臺北市北投區溫泉路108號1-6樓,02-28913027,-,39間,NT$5000-8000(定價係指各種房型之最高備查價格區間，各房型實際售價請依旅宿業者公布為主。),5000,-
宏都金殿大飯店,臺北市大安區安和路2段100號2-9樓,02-27556599,http://www.hdpalace.com.tw,32間,NT$5000-16000(定價係指各種房型之最高備查價格區間，各房型實際售價請依旅宿業者公布為主。),5000,-
悅來旅館,臺北市中正區中華路一段21號6-7樓,02-23110066,-,26間,NT$5000-12000(定價係指各種房型之最高備查價格區間，各房型實際售價請依旅宿業者公布為主。),5000,2
儷萊飯店(普亨萊大飯店),臺北市中正區中華路一段21號12樓,02-23111440,-,13間,NT$5000-12000(定價係指各種房型之最高備查價格區間，各房型實際售價請依旅宿業者公布為主。),5000,2
番茄行旅,臺北市大同區太原路156-2號5樓,02-25555930,-,5間,NT$5000-5000(定價係指各種房型之最高備查價格區間，各房型實際售價請依旅宿業者公布為主。),5000,-
復新文旅,"臺北市中山區復興北路282號3,6樓",02-25099359,http://www.foreverinn.com.tw,19間,NT$5000-6500(定價係指各種房型之最高備查價格區間，各房型實際售價請依旅宿業者公布為主。),5000,-
君帥旅館,臺北市萬華區成都路68號8-10樓,02-23718812,-,35間,NT$5000-8000(定價係指各種房型之最高備查價格區間，各房型實際售價請依旅宿業者公布為主。),5000,-
函舍旅館,臺北市萬華區成都路68號4-5樓,02-23718812,-,20間,NT$5000-8000(定價係指各種房型之最高備查價格區間，各房型實際售價請依旅宿業者公布為主。),5000,-
配普特行旅,臺北市大同區鄭州路21巷4號(1樓至3樓),02-25583669,-,9間,NT$5000-12000(定價係指各種房型之最高備查價格區間，各房型實際售價請依旅宿業者公布為主。),5000,-
熱海大飯店,臺北市北投區光明路258號B1-11樓,02-28915161,http://www.atamihotel.com.tw,265間,NT$5100-16400(定價係指各種房型之最高備查價格區間，各房型實際售價請依旅宿業者公布為主。),5100,-
台北馥華商旅南港館,臺北市南港區三重路23號1-4樓,02-27852655,-,66間,NT$5100-7000(定價係指各種房型之最高備查價格區間，各房型實際售價請依旅宿業者公布為主。),5100,-
蜂巢BeeHouse,"臺北市大同區太原路55,57號",02-25599000,https://www.b-house.com.tw/,31間,NT$5200-7200(定價係指各種房型之最高備查價格區間，各房型實際售價請依旅宿業者公布為主。),5200,-
台北馥華商旅敦北館,臺北市松山區敦化北路4巷52號1至7樓,02-66131300,http://www.simplehotel.com.tw,73間,NT$5200-6500(定價係指各種房型之最高備查價格區間，各房型實際售價請依旅宿業者公布為主。),5200,-
雀客快捷台北永康,臺北市中正區信義路二段73號(1至7樓、1樓夾層、公共使用),02-23212721,-,43間,NT$5200-5200(定價係指各種房型之最高備查價格區間，各房型實際售價請依旅宿業者公布為主。),5200,-
紫園旅社,臺北市大同區南京西路18巷30號,02-25557178,http://www.purplegarden.com.tw,27間,NT$5200-6200(定價係指各種房型之最高備查價格區間，各房型實際售價請依旅宿業者公布為主。),5200,-
旅樂序精品旅館五館,臺北市中正區重慶南路一段20號B1樓至10樓,02-23756777,http://www.hotelrelaxclub.com/,57間,NT$5200-6400(定價係指各種房型之最高備查價格區間，各房型實際售價請依旅宿業者公布為主。),5200,-
喬合大飯店,臺北市大安區復興南路一段136號1-4樓,02-27765877,http://deja-vu.city-hotel.com.tw/,69間,NT$5200-8000(定價係指各種房型之最高備查價格區間，各房型實際售價請依旅宿業者公布為主。),5200,-
立多精品旅館,"臺北市萬華區開封街二段53號3-5,7-9樓",02-23817899,http://www.liduobesthotel.com.tw/Taipei/,22間,NT$5200-6800(定價係指各種房型之最高備查價格區間，各房型實際售價請依旅宿業者公布為主。),5200,-
優美飯店,臺北市中山區民生東路一段28號1-8樓,02-25255678,-,63間,NT$5250-7650(定價係指各種房型之最高備查價格區間，各房型實際售價請依旅宿業者公布為主。),5250,-
雀客旅館　,臺北市中山區松江路253號1至13樓,02-77266277,http://www.checkinn.com.tw,65間,NT$5300-6500(定價係指各種房型之最高備查價格區間，各房型實際售價請依旅宿業者公布為主。),5300,-
東姿商務旅館,臺北市中山區一江街33號1-4樓,02-25638866,http://www.easternbeauty.tw,29間,NT$5400-7500(定價係指各種房型之最高備查價格區間，各房型實際售價請依旅宿業者公布為主。),5400,-
洛碁大飯店舞衣南京館,臺北市中山區南京東路二段163號1-8樓,02-25035511,https://mainanjing.greenworldhotels.com/,40間,NT$5400-6600(定價係指各種房型之最高備查價格區間，各房型實際售價請依旅宿業者公布為主。),5400,-
賓王大飯店,臺北市大同區南京西路163號3至4樓,02-25555182,-,53間,NT$5500-15000(定價係指各種房型之最高備查價格區間，各房型實際售價請依旅宿業者公布為主。),5500,-
大欣大飯店,臺北市中山區中山北路二段27巷2-2號1-5樓,02-25652155,-,32間,NT$5500-6500(定價係指各種房型之最高備查價格區間，各房型實際售價請依旅宿業者公布為主。),5500,-
大地清旅,臺北市中山區長安東路二段246號4至5樓,02-27110102,http://www.hihorizon.com,36間,NT$5500-5500(定價係指各種房型之最高備查價格區間，各房型實際售價請依旅宿業者公布為主。),5500,-
朗司旅館,臺北市大安區信義路3段147巷18號、2樓至7樓、2樓之1及6樓之1,02-27018110,http://www.cheznoushotel.com,25間,NT$5500-18000(定價係指各種房型之最高備查價格區間，各房型實際售價請依旅宿業者公布為主。),5500,-
台北捷運-北投會館(捷之旅),臺北市北投區大業路527巷88號(2至3樓),02-28930105,https://btresort.metro.taipei/,42間,NT$5500-12000(定價係指各種房型之最高備查價格區間，各房型實際售價請依旅宿業者公布為主。),5500,-
方舟旅店,臺北市中正區信義路二段255號1至4樓,02-23912600,http://www.arkhotel.com.tw,12間,NT$5500-5500(定價係指各種房型之最高備查價格區間，各房型實際售價請依旅宿業者公布為主。),5500,-
喜瑞飯店,臺北市中山區長安東路一段64號B1-10樓,02-25410077,http://www.ambiencehotel.com.tw,61間,NT$5600-17000(定價係指各種房型之最高備查價格區間，各房型實際售價請依旅宿業者公布為主。),5600,-
涪美飯店,臺北市中正區重慶南路一段94號,02-23810086,http://hotelb7journey.beautyhotels.com.tw/,49間,NT$5600-20000(定價係指各種房型之最高備查價格區間，各房型實際售價請依旅宿業者公布為主。),5600,-
苓旅站前,臺北市中正區忠孝西路一段72號4樓,02-23814755,-,35間,NT$5680-6880(定價係指各種房型之最高備查價格區間，各房型實際售價請依旅宿業者公布為主。),5680,-
苓旅旅館萬年館,臺北市萬華區西寧南路70號7樓,02-23814188,-,29間,NT$5680-6880(定價係指各種房型之最高備查價格區間，各房型實際售價請依旅宿業者公布為主。),5680,-
