旅宿名稱,地址,電話,官方網站,總房間數,定價,定價i,星級
東龍大飯店,臺北市萬華區漢口街二段23號1-7樓,02-23116969,http://www.east-dragon.com.tw,70間,NT$1920-3200(定價係指各種房型之最高備查價格區間，各房型實際售價請依旅宿業者公布為主。),1920,-
麗雅精品旅館,臺北市中山區長春路62號8樓之1,02-25411133,-,12間,NT$1980-1980(定價係指各種房型之最高備查價格區間，各房型實際售價請依旅宿業者公布為主。),1980,-
溫拿旅館,臺北市北投區承德路7段380號1-5樓,02-28213191,-,28間,NT$1980-2500(定價係指各種房型之最高備查價格區間，各房型實際售價請依旅宿業者公布為主。),1980,-
鴨川旅館,臺北市中山區中山北路二段65巷2弄60號1-6樓,02-25603965,-,20間,NT$2000-2000(定價係指各種房型之最高備查價格區間，各房型實際售價請依旅宿業者公布為主。),2000,-
美代溫泉飯店,臺北市北投區光明路281號1-3樓,02-28912174,https://www.beautyagespringhotel.com.tw/,20間,NT$2000-5600(定價係指各種房型之最高備查價格區間，各房型實際售價請依旅宿業者公布為主。),2000,-
正二旅館,臺北市中正區漢口街一段2號3-9樓,02-23718230,-,55間,NT$2000-20000(定價係指各種房型之最高備查價格區間，各房型實際售價請依旅宿業者公布為主。),2000,-
柯達大飯店台北松江,臺北市中山區松江路251號,02-25159999,http://songjiang.khotels.com.tw/zh-TW/,85間,NT$2000-22000(定價係指各種房型之最高備查價格區間，各房型實際售價請依旅宿業者公布為主。),2000,-
東楓商旅,臺北市大安區忠孝東路四段209號7樓、7樓之1、7樓之2、211號7樓,02-27211511,-,22間,NT$2000-20000(定價係指各種房型之最高備查價格區間，各房型實際售價請依旅宿業者公布為主。),2000,-
夜光商旅,臺北市萬華區內江街55巷11號1至4樓、13號2至4樓,02-23815059,-,16間,NT$2000-4200(定價係指各種房型之最高備查價格區間，各房型實際售價請依旅宿業者公布為主。),2000,-
大來商旅,臺北市松山區長春路432號1-7樓,02-27160011,http://www.delighthotel.com.tw,62間,NT$2000-9900(定價係指各種房型之最高備查價格區間，各房型實際售價請依旅宿業者公布為主。),2000,-
華達大飯店,臺北市中正區重慶南路一段1號6樓,02-23110212,-,14間,NT$2000-4200(定價係指各種房型之最高備查價格區間，各房型實際售價請依旅宿業者公布為主。),2000,-
途中‧台北國際青年旅舍,臺北市北投區光明路82號1至5樓,02-28910230,http://www.onmywayhostel.com,10間,NT$2000-5600(定價係指各種房型之最高備查價格區間，各房型實際售價請依旅宿業者公布為主。),2000,-
福君海悅大飯店,臺北市大同區重慶北路一段62號1、4至10樓,02-25551122,http://www.FORTUNEHOTEL.COM,168間,NT$2000-18000(定價係指各種房型之最高備查價格區間，各房型實際售價請依旅宿業者公布為主。),2000,-
仙渡莊旅社,臺北市北投區大度路三段304號,02-28913537,-,14間,NT$2000-3000(定價係指各種房型之最高備查價格區間，各房型實際售價請依旅宿業者公布為主。),2000,-
唐門客棧,臺北市中正區信義路二段33號2樓,02-23963322,-,28間,NT$2000-3000(定價係指各種房型之最高備查價格區間，各房型實際售價請依旅宿業者公布為主。),2000,-
晶樺商務旅店,臺北市萬華區西園路一段168號10樓,02-23048788,-,10間,NT$2000-2000(定價係指各種房型之最高備查價格區間，各房型實際售價請依旅宿業者公布為主。),2000,-
乃晶旅社,臺北市萬華區西園路一段168號12樓,02-23043795,-,10間,NT$2000-2000(定價係指各種房型之最高備查價格區間，各房型實際售價請依旅宿業者公布為主。),2000,-
台灣柒天精品旅店,臺北市萬華區環河南路二段282號1至4樓,02-23085222,https://www.facebook.com/7dayshoteltw/,36間,NT$2000-3000(定價係指各種房型之最高備查價格區間，各房型實際售價請依旅宿業者公布為主。),2000,-
路徒PLUS行旅-主題館,臺北市中正區忠孝西路一段80號5至12樓,02-23311788,https://roadersplushotel.com/,109間,NT$2000-43880(定價係指各種房型之最高備查價格區間，各房型實際售價請依旅宿業者公布為主。),2000,-
希爾商旅台北館,臺北市中山區南京東路二段11號4至5樓,02-25678858,https://hotelshere.com.tw/,32間,NT$2000-8000(定價係指各種房型之最高備查價格區間，各房型實際售價請依旅宿業者公布為主。),2000,-
情覓汽車旅館,臺北市中山區植福路189號2樓,02-85020689,-,16間,NT$2100-3980(定價係指各種房型之最高備查價格區間，各房型實際售價請依旅宿業者公布為主。),2100,-
西門大飯店,臺北市萬華區中華路一段78號2-6樓,02-23819922,http://ximen.ximenhotel.com.tw/,78間,NT$2180-12880(定價係指各種房型之最高備查價格區間，各房型實際售價請依旅宿業者公布為主。),2180,-
馥麗精品旅館,臺北市內湖區內湖路1段325號1-5樓,02-26586167,http://www.elegancehotel.com.tw,28間,NT$2180-5700(定價係指各種房型之最高備查價格區間，各房型實際售價請依旅宿業者公布為主。),2180,-
台北青年國際旅館,臺北市中正區許昌街19號1樓及4-10樓,02-23113201,http://www.ymcahotel.tw,99間,NT$2200-7200(定價係指各種房型之最高備查價格區間，各房型實際售價請依旅宿業者公布為主。),2200,-
慶爾喜旅館長沙一館,臺北市萬華區長沙街二段11號2樓,02-77309920,-,15間,NT$2200-3000(定價係指各種房型之最高備查價格區間，各房型實際售價請依旅宿業者公布為主。),2200,-
約克旅店,臺北市中正區南陽街13號4樓,02-23705528,-,17間,NT$2280-5690(定價係指各種房型之最高備查價格區間，各房型實際售價請依旅宿業者公布為主。),2280,-
東鑫商務旅館,"臺北市大安區忠孝東路四段209號11樓,11樓-1,-2,211號11樓,11樓-1",02-87736638,-,25間,NT$2280-3650(定價係指各種房型之最高備查價格區間，各房型實際售價請依旅宿業者公布為主。),2280,-
友徠精品旅館,臺北市南港區重陽路57巷15號,02-26510101,http://www.ulinemotel.com.tw,26間,NT$2280-8200(定價係指各種房型之最高備查價格區間，各房型實際售價請依旅宿業者公布為主。),2280,-
旅居文旅-松山驛站,臺北市松山區八德路四段626號3樓,02-27635889,-,18間,NT$2280-8000(定價係指各種房型之最高備查價格區間，各房型實際售價請依旅宿業者公布為主。),2280,-
新仕商務旅店　　,臺北市中山區民生西路8號及附2-12樓,02-25627466,http://www.shin-shih.com.tw/,44間,NT$2280-2580(定價係指各種房型之最高備查價格區間，各房型實際售價請依旅宿業者公布為主。),2280,-
貴族商務旅館,"臺北市士林區忠誠路二段21巷10,12號1至6樓",02-28323388,http://www.noble-hotel.com.tw,49間,NT$2280-5560(定價係指各種房型之最高備查價格區間，各房型實際售價請依旅宿業者公布為主。),2280,-
卡樂町旅店,臺北市萬華區內江街55巷22號,02-23826000,http://www.colormixhotel.com/,20間,NT$2288-2288(定價係指各種房型之最高備查價格區間，各房型實際售價請依旅宿業者公布為主。),2288,-
西門邑居自由旅行會館,臺北市萬華區西寧南路67號10樓,02-23616167,-,8間,NT$2300-3800(定價係指各種房型之最高備查價格區間，各房型實際售價請依旅宿業者公布為主。),2300,-
綺樂文旅開封館,臺北市中正區開封街一段35號1至8樓,02-23615889,https://hedohotel.com/,63間,NT$2300-12000(定價係指各種房型之最高備查價格區間，各房型實際售價請依旅宿業者公布為主。),2300,-
國際大旅館,臺北市北投區湖山路一段7號,02-28617100,-,44間,NT$2310-3190(定價係指各種房型之最高備查價格區間，各房型實際售價請依旅宿業者公布為主。),2310,-
姆提文創旅店,臺北市大安區信義路三段147巷5弄4號1樓,02-23897563,https://cafe.nihao.com.tw/,11間,NT$2380-16000(定價係指各種房型之最高備查價格區間，各房型實際售價請依旅宿業者公布為主。),2380,-
台北星辰旅館,臺北市中正區金山南路一段80號1至7樓,02-23971377,http://www.taipei-citizen-hotel.com.tw/,52間,NT$2380-11700(定價係指各種房型之最高備查價格區間，各房型實際售價請依旅宿業者公布為主。),2380,-
長虹大飯店,"臺北市萬華區漢中街36號1,3-8樓",02-23119193,-,68間,NT$2380-7200(定價係指各種房型之最高備查價格區間，各房型實際售價請依旅宿業者公布為主。),2380,-
瑪奇商務旅店,臺北市文山區景中街30巷6號3-4樓,02-29321000,-,26間,NT$2380-3280(定價係指各種房型之最高備查價格區間，各房型實際售價請依旅宿業者公布為主。),2380,-
台北世聯商旅,臺北市中山區松江路90巷5號1至7樓,02-25626161,https://tp.linkworldhotel.com.tw,44間,NT$2400-5300(定價係指各種房型之最高備查價格區間，各房型實際售價請依旅宿業者公布為主。),2400,-
沃田旅店,臺北市士林區中山北路七段127號1至13樓,02-28752288,http://mellowfields.com.tw/,172間,NT$2400-7500(定價係指各種房型之最高備查價格區間，各房型實際售價請依旅宿業者公布為主。),2400,-
浩室物業1館,臺北市萬華區昆明街316號、318號,02-77553617,https://reurl.cc/yr0nxy,11間,NT$2400-9600(定價係指各種房型之最高備查價格區間，各房型實際售價請依旅宿業者公布為主。),2400,-
上華旅館,臺北市中山區雙城街5號2-6樓,02-25911190,http://www.goodlife-hotel.com.tw,40間,NT$2400-2800(定價係指各種房型之最高備查價格區間，各房型實際售價請依旅宿業者公布為主。),2400,-
丰居旅店忠孝館,臺北市大安區復興南路1段126巷1號3樓(含3樓、3樓夾層、4樓),02-77116368,-,21間,NT$2420-20000(定價係指各種房型之最高備查價格區間，各房型實際售價請依旅宿業者公布為主。),2420,-
蒲園飯店,臺北市松山區八德路四段176號地下2樓、地下1樓、1樓、3樓至5樓、7樓,02-27530772,http://www.garden-hotel.com.tw,32間,NT$2480-18000(定價係指各種房型之最高備查價格區間，各房型實際售價請依旅宿業者公布為主。),2480,-
晴悅旅店,臺北市中山區新生北路三段10號2-3樓,02-25992211,https://www.facebook.com/CYHotelTaipei/,19間,NT$2480-3380(定價係指各種房型之最高備查價格區間，各房型實際售價請依旅宿業者公布為主。),2480,-
旅樂序精品旅館二館,臺北市中正區漢口街一段15號1至8樓,02-23757555,-,58間,NT$2488-9800(定價係指各種房型之最高備查價格區間，各房型實際售價請依旅宿業者公布為主。),2488,-
一等好旅店,"臺北市松山區八德路四段624巷2號B1-1樓,4號2-6樓",02-27609255,-,32間,NT$2500-2900(定價係指各種房型之最高備查價格區間，各房型實際售價請依旅宿業者公布為主。),2500,-
和旅瓏旅館西門館,臺北市萬華區西寧南路105號2至5樓、2樓之1至5樓之1,02-23616569,https://www.hatagoplus.com/index.html,42間,NT$2500-5800(定價係指各種房型之最高備查價格區間，各房型實際售價請依旅宿業者公布為主。),2500,-
安庭澔思青年旅舍,臺北市大同區承德路一段66號12樓,02-25526176,-,4間,NT$2500-8000(定價係指各種房型之最高備查價格區間，各房型實際售價請依旅宿業者公布為主。),2500,-
百樂匯大飯店,臺北市北投區溫泉路99號1-4樓,02-28928288,http://www.waterhouse.com.tw,33間,NT$2500-32800(定價係指各種房型之最高備查價格區間，各房型實際售價請依旅宿業者公布為主。),2500,-
背包棧旅店-台北長春店,臺北市中山區長春路258巷6號2樓,02-25180188,http://www.bph.com.tw/,43間,NT$2500-24000(定價係指各種房型之最高備查價格區間，各房型實際售價請依旅宿業者公布為主。),2500,-
凱統大飯店,臺北市大安區忠孝東路三段8號3-9樓,02-27211162,http://kdmhotel.com.tw,56間,NT$2580-3280(定價係指各種房型之最高備查價格區間，各房型實際售價請依旅宿業者公布為主。),2580,-
迪樂商旅,臺北市大同區延平北路一段121號1至6樓,02-25551130,-,28間,NT$2580-4080(定價係指各種房型之最高備查價格區間，各房型實際售價請依旅宿業者公布為主。),2580,-
陸號行旅萬年館,臺北市萬華區西寧南路70號6樓,02-23619069,-,39間,NT$2580-3580(定價係指各種房型之最高備查價格區間，各房型實際售價請依旅宿業者公布為主。),2580,-
龍山旅社,臺北市萬華區西園路一段125巷13-1號1-3樓,02-23064990,http://www.longshaninn.com/zh-tw,14間,NT$2600-2600(定價係指各種房型之最高備查價格區間，各房型實際售價請依旅宿業者公布為主。),2600,-
皇家玫瑰旅館新生館,臺北市大安區新生南路一段103巷37號(1至5樓),02-27522077,http://www.rosehotel.com.tw/tw/,21間,NT$2600-10000(定價係指各種房型之最高備查價格區間，各房型實際售價請依旅宿業者公布為主。),2600,-
文舺行旅,臺北市萬華區西園路一段139號1-4樓,02-23064990,-,9間,NT$2600-4800(定價係指各種房型之最高備查價格區間，各房型實際售價請依旅宿業者公布為主。),2600,-
時尚居商旅,臺北市中山區民生東路3段9巷1之1號、1之2號、1之3號2樓至4樓,02-25090102,-,8間,NT$2600-2600(定價係指各種房型之最高備查價格區間，各房型實際售價請依旅宿業者公布為主。),2600,-
野趣旅舍T.O.HOTEL,臺北市大同區承德路二段28號1至5樓,02-25521300,https://www.facebook.com/tohotelbooking/,16間,NT$2680-9800(定價係指各種房型之最高備查價格區間，各房型實際售價請依旅宿業者公布為主。),2680,-
麗都大飯店,臺北市大安區信義路三段11號1-11樓,02-27065600,http://www.rido.com.tw,73間,NT$2700-9000(定價係指各種房型之最高備查價格區間，各房型實際售價請依旅宿業者公布為主。),2700,-
承攜行旅台北台大館,臺北市中正區羅斯福路三段98號1-8樓,02-23657367,-,35間,NT$2730-3680(定價係指各種房型之最高備查價格區間，各房型實際售價請依旅宿業者公布為主。),2730,-
東驛商務旅館,臺北市萬華區昆明街76號8-9樓,02-23831999,http://www.e-house.tw,34間,NT$2780-2980(定價係指各種房型之最高備查價格區間，各房型實際售價請依旅宿業者公布為主。),2780,-
靜好文旅by墾趣,臺北市中山區南京東路2段11號11樓,02-25718875,https://www.chillroof.com.tw,10間,NT$2780-12700(定價係指各種房型之最高備查價格區間，各房型實際售價請依旅宿業者公布為主。),2780,-
璞邸旅店,臺北市中正區重慶南路1段7號1至4樓,02-23815566,http://bouti.com.tw/,13間,NT$2790-6300(定價係指各種房型之最高備查價格區間，各房型實際售價請依旅宿業者公布為主。),2790,-
漫慢米窩旅店,"臺北市中山區中山北路二段183巷30,32號3樓",02-25861880,-,13間,NT$2800-4800(定價係指各種房型之最高備查價格區間，各房型實際售價請依旅宿業者公布為主。),2800,-
西悠巢旅台北館,臺北市大同區民生西路198號之2(代表號),02-25585500,http://cu-taipei-uniongo.toongmao.com.tw/index.php,87間,NT$2850-4400(定價係指各種房型之最高備查價格區間，各房型實際售價請依旅宿業者公布為主。),2850,2
華大HOTEL,臺北市信義區永吉路30巷150號1-7樓,02-27635313,-,24間,NT$2880-3780(定價係指各種房型之最高備查價格區間，各房型實際售價請依旅宿業者公布為主。),2880,-
陽明山美國渡假村,臺北市士林區臺北市士林區凱旋路69號、71號及61巷2弄6號、8號、10號,02-28623232,-,20間,NT$2880-7980(定價係指各種房型之最高備查價格區間，各房型實際售價請依旅宿業者公布為主。),2880,-
雅莊旅館,"臺北市中山區民族東路438號B1至4樓,440號B1至5樓",02-25075999,http://www.attichotel.com.tw/,37間,NT$2880-3080(定價係指各種房型之最高備查價格區間，各房型實際售價請依旅宿業者公布為主。),2880,-
城市商旅南東館,臺北市松山區南京東路五段411號地下三樓至7樓,02-27425888,http://www.citysuites.com.tw,127間,NT$3000-20000(定價係指各種房型之最高備查價格區間，各房型實際售價請依旅宿業者公布為主。),3000,-
建山大旅社,臺北市大同區歸綏街182號2-4樓,02-25520680,http://www.jianshan1977.com/,13間,NT$3000-6000(定價係指各種房型之最高備查價格區間，各房型實際售價請依旅宿業者公布為主。),3000,-
洛碁大飯店花華分館,臺北市中正區漢口街一段36號1-8樓及地下室,02-23123811,http://flora.greenworldhotels.com/,56間,NT$3000-8500(定價係指各種房型之最高備查價格區間，各房型實際售價請依旅宿業者公布為主。),3000,-
友華賓館,"臺北市松山區八德路四段656,656-1號6樓",02-27630505,https://besthoteltw5.wixsite.com/besthotel,30間,NT$3000-4400(定價係指各種房型之最高備查價格區間，各房型實際售價請依旅宿業者公布為主。),3000,-
力歐時尚旅館,臺北市中正區延平南路9號1-9樓,02-23145296,http://www.liohotel.com.tw/,37間,NT$3000-5000(定價係指各種房型之最高備查價格區間，各房型實際售價請依旅宿業者公布為主。),3000,-
台北臥客旅店,臺北市大同區甘谷街26號7樓,02-25557177,-,13間,NT$3000-3000(定價係指各種房型之最高備查價格區間，各房型實際售價請依旅宿業者公布為主。),3000,-
銀河旅館,臺北市萬華區漢中街147巷6號1至4樓,02-23116606,http://www.galaxyinn.com.tw,21間,NT$3000-3000(定價係指各種房型之最高備查價格區間，各房型實際售價請依旅宿業者公布為主。),3000,-
南陽街壹號旅店,臺北市中正區南陽街1號3樓至4樓,02-23888377,http://www.nysloft.com/,79間,NT$3000-4800(定價係指各種房型之最高備查價格區間，各房型實際售價請依旅宿業者公布為主。),3000,-
伊倫商務旅館,臺北市中山區松江路123巷10號1-4樓,02-25076666,http://www.city-hotel.com.tw,31間,NT$3000-4000(定價係指各種房型之最高備查價格區間，各房型實際售價請依旅宿業者公布為主。),3000,-
果芒驛站旅店,臺北市中正區忠孝西路一段50號23樓之18,02-23706808,https://mango-hotel.com,2間,NT$3000-6000(定價係指各種房型之最高備查價格區間，各房型實際售價請依旅宿業者公布為主。),3000,-
日好青旅,臺北市大同區甘谷街26號6樓,02-25558667,-,11間,NT$3000-6000(定價係指各種房型之最高備查價格區間，各房型實際售價請依旅宿業者公布為主。),3000,-
台灣燦路都飯店,臺北市中山區民權東路一段9號2-10樓,02-25973610,http://www.sunroute-taipei.com,125間,NT$3050-4550(定價係指各種房型之最高備查價格區間，各房型實際售價請依旅宿業者公布為主。),3050,-
鉑泊客,臺北市中正區漢口街1段50號1-5樓,02-23755555,-,58間,NT$3080-3680(定價係指各種房型之最高備查價格區間，各房型實際售價請依旅宿業者公布為主。),3080,-
雀客快捷台北車站,臺北市大同區太原路64號1至8樓,02-25590577,-,58間,NT$3200-6800(定價係指各種房型之最高備查價格區間，各房型實際售價請依旅宿業者公布為主。),3200,-
新月商旅,臺北市中山區新生北路一段122號1-7樓,02-25213301,-,42間,NT$3200-3700(定價係指各種房型之最高備查價格區間，各房型實際售價請依旅宿業者公布為主。),3200,-
洛碁三貝茲,臺北市松山區八德路四段16號1-7樓,02-27630555,http://triplebeds.greenworldhotels.com,54間,NT$3200-13800(定價係指各種房型之最高備查價格區間，各房型實際售價請依旅宿業者公布為主。),3200,-
捷絲旅西門町店,臺北市中正區中華路一段41號5-9樓,02-23709000,http://www.justsleep.com.tw/,143間,NT$3200-10120(定價係指各種房型之最高備查價格區間，各房型實際售價請依旅宿業者公布為主。),3200,-
新驛旅店台北車站三館,"臺北市大同區長安西路77,79號1-7樓",02-77327777,http://www.cityinn.com.tw,66間,NT$3200-5600(定價係指各種房型之最高備查價格區間，各房型實際售價請依旅宿業者公布為主。),3200,-
信星旅館,臺北市大同區華陰街48號至48之11號4樓、50號至50之11號5樓,02-25562015,http://www.starhostel.com.tw,57間,NT$3200-4200(定價係指各種房型之最高備查價格區間，各房型實際售價請依旅宿業者公布為主。),3200,-
新驛旅店台北車站二館,臺北市大同區長安西路83號,02-2555-5577,http://www.cityinn.com.tw,50間,NT$3200-5600(定價係指各種房型之最高備查價格區間，各房型實際售價請依旅宿業者公布為主。),3200,-
北城大飯店,臺北市中山區長春路279號B1-12樓,02-25017601,http://www.cityhotel.com.tw,55間,NT$3200-3600(定價係指各種房型之最高備查價格區間，各房型實際售價請依旅宿業者公布為主。),3200,-
香城大飯店豪悅分店,"臺北市中山區松江路93巷9號1-8樓,9號2-5樓-1~7,6樓-1~3,7樓-1,8樓-1,97巷18號",02-25177272,-,32間,NT$3200-4000(定價係指各種房型之最高備查價格區間，各房型實際售價請依旅宿業者公布為主。),3200,-
豪城商旅民生館,臺北市松山區民生東路三段113巷7弄11號1樓至6樓,02-27137078,http://www.city-hotel.com.tw/,38間,NT$3200-4000(定價係指各種房型之最高備查價格區間，各房型實際售價請依旅宿業者公布為主。),3200,-
璞漣商務旅館西門店,臺北市萬華區成都路27巷6號,02-23718616,http://www.hotel-puri.com.tw,57間,NT$3300-4500(定價係指各種房型之最高備查價格區間，各房型實際售價請依旅宿業者公布為主。),3300,-
水都溫泉會館,臺北市北投區光明路283號,02-28979060,http://www.spaspringresort.com.tw/,33間,NT$3300-6000(定價係指各種房型之最高備查價格區間，各房型實際售價請依旅宿業者公布為主。),3300,-
皇家季節酒店1館,臺北市大同區南京西路326號1樓、2樓、3樓、4樓、5樓，及8樓、9樓,"02-25554288,25556488",http://www.taiwanseasonshotel.com,48間,NT$3300-4300(定價係指各種房型之最高備查價格區間，各房型實際售價請依旅宿業者公布為主。),3300,-
多郎明哥旅館,臺北市大安區信義路三段73號,02-27001200,http://www.dolamanco.com.tw,30間,NT$3380-4180(定價係指各種房型之最高備查價格區間，各房型實際售價請依旅宿業者公布為主。),3380,-
和怡商務旅館,臺北市南港區重陽路122號,02-27890505,http://www.kofhotel.com,43間,NT$3380-6140(定價係指各種房型之最高備查價格區間，各房型實際售價請依旅宿業者公布為主。),3380,-
謙匯普樂室行旅,臺北市信義區信義路5段109號地下1樓,02-87864188,-,40間,NT$3380-5580(定價係指各種房型之最高備查價格區間，各房型實際售價請依旅宿業者公布為主。),3380,-
探索汽車旅館延平館,臺北市士林區延平北路五段23號2至5樓及23之1號2至5樓,02-88112588,http://discoverygroup.com.tw,40間,NT$3380-12880(定價係指各種房型之最高備查價格區間，各房型實際售價請依旅宿業者公布為主。),3380,-
西門星辰精典大飯店,臺北市萬華區峨眉街72號1至8樓,02-23831123,-,25間,NT$3380-5380(定價係指各種房型之最高備查價格區間，各房型實際售價請依旅宿業者公布為主。),3380,-
璽愛旅店,"臺北市中正區忠孝西路一段72號3樓,3樓之1",02-23880808,http://www.slovehotel.com.tw/,39間,NT$3400-4300(定價係指各種房型之最高備查價格區間，各房型實際售價請依旅宿業者公布為主。),3400,-
香城大飯店,臺北市大安區信義路四段295號1至11樓,02-27049546,http://www.city-hotel.com.tw/,60間,NT$3400-3800(定價係指各種房型之最高備查價格區間，各房型實際售價請依旅宿業者公布為主。),3400,-
享住旅店JustLiveInn,"臺北市中正區漢口街一段4,6號2-4樓",02-23713151,http://www.miyihotel.com.tw,18間,NT$3450-4650(定價係指各種房型之最高備查價格區間，各房型實際售價請依旅宿業者公布為主。),3450,-
109HostelTaipei台北109青旅,臺北市中正區博愛路36號3樓,0905-972109,https://109hostel.com/,6間,NT$3500-12000(定價係指各種房型之最高備查價格區間，各房型實際售價請依旅宿業者公布為主。),3500,-
智慧環境會館-菁山遊憩區,臺北市士林區菁山路101巷71弄16號,02-28625116,http://www.star-fountain.com,17間,NT$3500-10000(定價係指各種房型之最高備查價格區間，各房型實際售價請依旅宿業者公布為主。),3500,-
同一大飯店,臺北市中山區農安街36號3-10樓　,02-25923977,-,95間,NT$3500-6000(定價係指各種房型之最高備查價格區間，各房型實際售價請依旅宿業者公布為主。),3500,3
和昌商務旅館台北西門館,臺北市萬華區桂林路24號1-5樓,02-23088828,-,16間,NT$3500-4800(定價係指各種房型之最高備查價格區間，各房型實際售價請依旅宿業者公布為主。),3500,-
