旅宿名稱,地址,電話,官方網站,總房間數,定價,定價i,星級
雀客藏居台北陽明山,臺北市士林區陽明山格致路237號,02-28616661,-,50間,NT$9000-18000(定價係指各種房型之最高備查價格區間，各房型實際售價請依旅宿業者公布為主。),9000,-
香樹花園酒店,臺北市中山區堤頂大道二段566號1樓、2樓、4樓（四層至六層）、7樓（七層至十一層）,02-85023955,http://www.saurahotel.com.tw,84間,NT$9000-45000(定價係指各種房型之最高備查價格區間，各房型實際售價請依旅宿業者公布為主。),9000,-
城市商旅北門館,臺北市大同區長安西路265號1至6樓及267號1至6樓,02-25525777,https://www.citysuites.com.tw/zh-tw/%E5%8F%B0%E5%8C%97%E5%8C%97%E9%96%80%E9%A4%A8/About,65間,NT$9000-12000(定價係指各種房型之最高備查價格區間，各房型實際售價請依旅宿業者公布為主。),9000,-
城市商旅北門二館,臺北市大同區長安西路271號2樓至4樓、275號1樓至4樓,02-25525777,-,19間,NT$9000-12000(定價係指各種房型之最高備查價格區間，各房型實際售價請依旅宿業者公布為主。),9000,-
劍潭璞旅,臺北市士林區承德路四段250號,02-28831777,http://www.jiantanboutechhotel.com.tw,240間,NT$9000-11000(定價係指各種房型之最高備查價格區間，各房型實際售價請依旅宿業者公布為主。),9000,-
台北商旅(大安館),臺北市大安區大安路一段135號,02-77119933,http://www.suitetpe.com,48間,NT$9200-11500(定價係指各種房型之最高備查價格區間，各房型實際售價請依旅宿業者公布為主。),9200,-
台北松山意舍酒店,臺北市南港區市民大道七段8號17樓至21樓,02-26532828,http://www.amba-hotels.com,190間,NT$9200-112930(定價係指各種房型之最高備查價格區間，各房型實際售價請依旅宿業者公布為主。),9200,-
洛碁大飯店南京館,臺北市中山區南京東路三段8號1樓至14樓,02-25098882,http://grandnanjing.greenworldhotels.com,116間,NT$9300-16000(定價係指各種房型之最高備查價格區間，各房型實際售價請依旅宿業者公布為主。),9300,-
福華大飯店,臺北市大安區仁愛路3段160號,02-2700,http://www.howard-hotels.com.tw,606間,NT$9500-55000(定價係指各種房型之最高備查價格區間，各房型實際售價請依旅宿業者公布為主。),9500,5
詩漫精品旅館,臺北市中正區館前路8號6樓,02-23820111,http://www.smileinn.com.tw/,33間,NT$9770-11530(定價係指各種房型之最高備查價格區間，各房型實際售價請依旅宿業者公布為主。),9770,-
老爺大酒店,臺北市中山區中山北路2段37之1號,02-25423266,http://www.royal-taipei.com.tw,202間,NT$9800-58000(定價係指各種房型之最高備查價格區間，各房型實際售價請依旅宿業者公布為主。),9800,5
日月星商旅,臺北市士林區重慶北路四段202號1-4樓、204號1樓,02-28119395,http://www.huluhotel111.com/,19間,NT$9800-16800(定價係指各種房型之最高備查價格區間，各房型實際售價請依旅宿業者公布為主。),9800,-
凱達大飯店,臺北市萬華區艋舺大道167號,02-23066777,http://www.caesarmetro.com,745間,NT$9800-68800(定價係指各種房型之最高備查價格區間，各房型實際售價請依旅宿業者公布為主。),9800,-
大新飯店,臺北市中山區長春路246號11-12樓,02-25068866,-,11間,NT$9800-11800(定價係指各種房型之最高備查價格區間，各房型實際售價請依旅宿業者公布為主。),9800,-
安捷國際公寓酒店,臺北市大同區市民大道1段201號15樓、15樓之1至之3、之5至之10,02-25592900,-,9間,NT$9800-15800(定價係指各種房型之最高備查價格區間，各房型實際售價請依旅宿業者公布為主。),9800,-
新舍商旅-林森館,臺北市中山區林森北路477號,02-77431000,https://www.discoverygroup.com.tw/brand/xinshehotel/,79間,NT$9900-16500(定價係指各種房型之最高備查價格區間，各房型實際售價請依旅宿業者公布為主。),9900,-
南港老爺行旅,臺北市南港區經貿二路196號.196號10樓至20樓,02-77500588,http://www.hotelroyal.com.tw/nangang/,179間,NT$9900-15180(定價係指各種房型之最高備查價格區間，各房型實際售價請依旅宿業者公布為主。),9900,-
合尊酒店SHotel,臺北市松山區敦化北路150號,02-27121777,http://www.shotel.com/,101間,NT$10000-150000(定價係指各種房型之最高備查價格區間，各房型實際售價請依旅宿業者公布為主。),10000,-
亞太飯店北投館,臺北市北投區幽雅路31號,02-28983088,https://www.apresort.com.tw,140間,NT$10000-38390(定價係指各種房型之最高備查價格區間，各房型實際售價請依旅宿業者公布為主。),10000,-
雲富大飯店,臺北市中山區長春路24號2樓至8樓,02-25316767,-,55間,NT$10000-36000(定價係指各種房型之最高備查價格區間，各房型實際售價請依旅宿業者公布為主。),10000,-
禾順行旅,臺北市萬華區廣州街247號及247號2至6樓,02-23081000,-,98間,NT$10000-20000(定價係指各種房型之最高備查價格區間，各房型實際售價請依旅宿業者公布為主。),10000,-
東棧商務旅店,"臺北市大安區忠孝東路四段209號8樓,8樓-1,-2,211號8樓,8樓-1",02-27117721,http://eastinn.vdthotel.com/,23間,NT$10000-20000(定價係指各種房型之最高備查價格區間，各房型實際售價請依旅宿業者公布為主。),10000,-
金帥商務旅店,臺北市萬華區昆明街142號7-8樓,02-23818131,http://www.kingshi-hotel.com.tw/,37間,NT$10000-15000(定價係指各種房型之最高備查價格區間，各房型實際售價請依旅宿業者公布為主。),10000,-
豪贊旅店,臺北市萬華區昆明街34號2樓,02-23702199,-,14間,NT$10000-20000(定價係指各種房型之最高備查價格區間，各房型實際售價請依旅宿業者公布為主。),10000,-
台北馥敦飯店,臺北市松山區復興北路315號1-7樓,02-27138181,http://www.taipeifullerton.com.tw/north/,71間,NT$10000-70000(定價係指各種房型之最高備查價格區間，各房型實際售價請依旅宿業者公布為主。),10000,-
富裕自由商旅,臺北市大安區忠孝東路四段235號2樓、2樓之1、3樓、3樓之1、4樓之1、5樓之1、6樓之1、7樓、7樓之1及9樓,02-27413147,http://www.hotelrf.com/rfhotel,67間,NT$10000-25000(定價係指各種房型之最高備查價格區間，各房型實際售價請依旅宿業者公布為主。),10000,-
歐華酒店,臺北市中山區林森北路646號,02-25853258,https://www.rivierataipei.com/zh-hant/,112間,NT$10000-30000(定價係指各種房型之最高備查價格區間，各房型實際售價請依旅宿業者公布為主。),10000,-
美麗信花園酒店,臺北市中山區市民大道三段83號,02-87728800,http://www.miramargarden.com.tw,203間,NT$10000-90000(定價係指各種房型之最高備查價格區間，各房型實際售價請依旅宿業者公布為主。),10000,-
趣西門旅店,臺北市萬華區武昌街二段72號7樓,02-23618266,-,27間,NT$10000-20000(定價係指各種房型之最高備查價格區間，各房型實際售價請依旅宿業者公布為主。),10000,-
悠趣旅店,臺北市松山區長安東路2段219號12樓,02-27752277,-,27間,NT$10000-15000(定價係指各種房型之最高備查價格區間，各房型實際售價請依旅宿業者公布為主。),10000,-
富裕自由旅店林森館,臺北市中山區林森北路85巷23號1至2樓,02-25671333,-,11間,NT$10000-15000(定價係指各種房型之最高備查價格區間，各房型實際售價請依旅宿業者公布為主。),10000,-
慶爾喜旅館長沙二館,臺北市萬華區長沙街二段11號3樓之1,02-77309920,-,6間,NT$10000-10000(定價係指各種房型之最高備查價格區間，各房型實際售價請依旅宿業者公布為主。),10000,-
丰居旅店北車館,臺北市中正區重慶南路一段60號,02-23142121,http://via-hotel.com.tw/,23間,NT$10000-12000(定價係指各種房型之最高備查價格區間，各房型實際售價請依旅宿業者公布為主。),10000,-
昇美精旅,臺北市中山區新生北路二段25號1-6樓,02-25111399,http://www.beautyhotels.com.tw/,42間,NT$10000-15000(定價係指各種房型之最高備查價格區間，各房型實際售價請依旅宿業者公布為主。),10000,-
旅城驛鎮,臺北市中山區松江路95-1號6樓,02-25081848,-,10間,NT$10000-12000(定價係指各種房型之最高備查價格區間，各房型實際售價請依旅宿業者公布為主。),10000,-
星西門行旅,臺北市萬華區西寧南路36號9樓、9樓之1、9樓之31至43、9樓之45至51、10樓之1,02-23313188,-,54間,NT$10000-20000(定價係指各種房型之最高備查價格區間，各房型實際售價請依旅宿業者公布為主。),10000,-
天閣酒店台北復興,臺北市松山區復興北路147號1至12樓,02-87128000,http://www.tango-hotels.com,70間,NT$10200-30000(定價係指各種房型之最高備查價格區間，各房型實際售價請依旅宿業者公布為主。),10200,-
阿樹國際旅店,臺北市松山區八德路三段76號1樓、4樓至14樓,02-25787728,http://www.artreehotel.com.tw/,141間,NT$10400-36000(定價係指各種房型之最高備查價格區間，各房型實際售價請依旅宿業者公布為主。),10400,-
天閣酒店台北劍潭,臺北市士林區基河路16之6號1樓至12樓,02-28862999,-,72間,NT$10500-30000(定價係指各種房型之最高備查價格區間，各房型實際售價請依旅宿業者公布為主。),10500,-
金都精緻溫泉飯店,臺北市北投區光明路240號1-6樓,02-28911228,-,31間,NT$10500-12800(定價係指各種房型之最高備查價格區間，各房型實際售價請依旅宿業者公布為主。),10500,-
漢普頓酒店,臺北市中山區建國北路2段7號,02-25069696,https://www.hcpt.com.tw/,129間,NT$10780-60000(定價係指各種房型之最高備查價格區間，各房型實際售價請依旅宿業者公布為主。),10780,-
九昱晴美,臺北市中山區林森北路568號2至13樓，3樓之1、2、3、5、6至12樓之1、2、3、5、6，13樓之1,02-66080807,http://www.jolleyhotels.com/,62間,NT$10800-21800(定價係指各種房型之最高備查價格區間，各房型實際售價請依旅宿業者公布為主。),10800,-
貴都飯店,臺北市萬華區西藏路192-1號,02-23029345,http://www.crystalhotel.com.tw,69間,NT$10800-22800(定價係指各種房型之最高備查價格區間，各房型實際售價請依旅宿業者公布為主。),10800,-
密都大飯店,臺北市中山區長春路246號2-9樓,02-25068866,-,48間,NT$10800-16800(定價係指各種房型之最高備查價格區間，各房型實際售價請依旅宿業者公布為主。),10800,-
寶格利時尚旅館,臺北市萬華區中華路一段168號1-15樓,02-23821314,http://www.burgaryhotel.com,46間,NT$10800-11800(定價係指各種房型之最高備查價格區間，各房型實際售價請依旅宿業者公布為主。),10800,-
有誠商旅,臺北市士林區至善路二段55號4樓至10樓,02-88615599,http://www.yusensehotel.com,64間,NT$11000-18000(定價係指各種房型之最高備查價格區間，各房型實際售價請依旅宿業者公布為主。),11000,-
春天酒店,臺北市北投區幽雅路18號1-6樓,02-28924546,http://www.springresort.com.tw/,81間,NT$11000-25000(定價係指各種房型之最高備查價格區間，各房型實際售價請依旅宿業者公布為主。),11000,-
台北北投雅樂軒酒店,臺北市北投區中央里大業路302號、300巷1號，2樓,02-77011788,https://www.alofttaipeibeitou.tw/,292間,NT$11000-28000(定價係指各種房型之最高備查價格區間，各房型實際售價請依旅宿業者公布為主。),11000,-
宜家商旅,臺北市內湖區成功路二段512、514號1至10樓,02-27956777,-,159間,NT$11000-13200(定價係指各種房型之最高備查價格區間，各房型實際售價請依旅宿業者公布為主。),11000,-
皇家季節酒店,臺北市北投區中山路26號1-5樓,02-28969798,http://royalseasons.leefanggroup.com/,44間,NT$11000-11000(定價係指各種房型之最高備查價格區間，各房型實際售價請依旅宿業者公布為主。),11000,-
愛活商旅,臺北市萬華區西寧南路36號10樓之3,02-2361,-,22間,NT$11000-20000(定價係指各種房型之最高備查價格區間，各房型實際售價請依旅宿業者公布為主。),11000,-
長榮桂冠酒店(台北),臺北市中山區松江路63號,02-25019988,http://www.evergreen-hotels.com/branch/taipei,95間,NT$11500-68000(定價係指各種房型之最高備查價格區間，各房型實際售價請依旅宿業者公布為主。),11500,-
維多麗亞酒店,臺北市中山區敬業四路168號,02-85020007,http://www.grandvictoria.com.tw/,96間,NT$11550-23100(定價係指各種房型之最高備查價格區間，各房型實際售價請依旅宿業者公布為主。),11550,5
台灣西鐵國際旅館,臺北市萬華區中華路一段88號1樓、6樓至28樓,02-23143939,-,298間,NT$11700-18000(定價係指各種房型之最高備查價格區間，各房型實際售價請依旅宿業者公布為主。),11700,-
天閣酒店(台北南西),臺北市中山區南京西路3號1至9樓,02-25679999,http://www.tango-hotels.com,52間,NT$11800-11800(定價係指各種房型之最高備查價格區間，各房型實際售價請依旅宿業者公布為主。),11800,-
思泊客,"臺北市信義區信義路五段16號B1,18號B1,B1-1",02-27230999,http://www.sparklehotel.com.tw,45間,NT$11800-11800(定價係指各種房型之最高備查價格區間，各房型實際售價請依旅宿業者公布為主。),11800,-
台北六福萬怡酒店,臺北市南港區忠孝東路七段359號7-30樓,02-21716565,http://www.courtyardtaipei.com,465間,NT$12000-100000(定價係指各種房型之最高備查價格區間，各房型實際售價請依旅宿業者公布為主。),12000,5
台北寒舍喜來登大飯店,臺北市中正區忠孝東路1段12號,02-23215511,http://www.sheratongrandtaipei.com,692間,NT$12000-22000(定價係指各種房型之最高備查價格區間，各房型實際售價請依旅宿業者公布為主。),12000,5
台北五號商旅,臺北市中正區延平南路160之5號(1樓至4樓),02-23883067,http://cheztaipeino5.com/,6間,NT$12000-12000(定價係指各種房型之最高備查價格區間，各房型實際售價請依旅宿業者公布為主。),12000,-
台北士林萬麗酒店,臺北市士林區中山北路五段470巷8號,02-88612389,-,104間,NT$12000-120000(定價係指各種房型之最高備查價格區間，各房型實際售價請依旅宿業者公布為主。),12000,-
台北花園大酒店,臺北市中正區中華路2段1號,02-23143300,http://www.taipeigarden.com.tw,241間,NT$12000-21000(定價係指各種房型之最高備查價格區間，各房型實際售價請依旅宿業者公布為主。),12000,-
華弘怡亨酒店,臺北市大安區敦化南路一段370號,02-27848888,http://www.eclathotels.com/,68間,NT$12000-38000(定價係指各種房型之最高備查價格區間，各房型實際售價請依旅宿業者公布為主。),12000,-
美亞商旅,臺北市中正區忠孝西路一段50號3樓至5樓及3樓之1至5樓之1,02-23313001,http://www.mayerinn.com,264間,NT$12000-24000(定價係指各種房型之最高備查價格區間，各房型實際售價請依旅宿業者公布為主。),12000,-
國聯大飯店,臺北市大安區光復南路200號,02-27731515,http://www.unitedhotel.com.tw,243間,NT$12000-40000(定價係指各種房型之最高備查價格區間，各房型實際售價請依旅宿業者公布為主。),12000,-
珂曼旅館,臺北市萬華區西寧南路77號1-15樓、2樓之1-15樓之1、3樓之2-14樓之2、12樓之3-13樓之3、12樓之5,02-23886000,-,61間,NT$12000-22000(定價係指各種房型之最高備查價格區間，各房型實際售價請依旅宿業者公布為主。),12000,-
六福居,臺北市中山區南京東路一段38號,02-77010165,http://www.leofooresidences.com.tw,49間,NT$12000-17000(定價係指各種房型之最高備查價格區間，各房型實際售價請依旅宿業者公布為主。),12000,-
台北中山九昱希爾頓逸林酒店,"臺北市中山區中山北路一段123號1樓,121巷1號1-14樓",02-66199999,-,105間,NT$12000-18000(定價係指各種房型之最高備查價格區間，各房型實際售價請依旅宿業者公布為主。),12000,-
馥良旅店,臺北市萬華區漢中街52號12樓至13樓,02-2311-2555,https://www.taiwanstay.net.tw/room/33748,32間,NT$12000-20000(定價係指各種房型之最高備查價格區間，各房型實際售價請依旅宿業者公布為主。),12000,-
城市商旅昆明館（HOTELPAPAWHALE）,臺北市萬華區昆明街46號地下1樓、46號及46號2至4樓、4樓之2、4樓之3,02-23311177,http://www.papawhale.com/,335間,NT$12020-22000(定價係指各種房型之最高備查價格區間，各房型實際售價請依旅宿業者公布為主。),12020,-
雀客旅館台北南京,臺北市中山區南京東路3段16號,02-25161610,-,56間,NT$12100-24000(定價係指各種房型之最高備查價格區間，各房型實際售價請依旅宿業者公布為主。),12100,-
門埕青旅,臺北市大同區鄭州路21巷10號(1至3樓),02-25585676,-,2間,NT$12600-12600(定價係指各種房型之最高備查價格區間，各房型實際售價請依旅宿業者公布為主。),12600,-
沃客商旅-西門館,臺北市萬華區中華路一段144號10樓,02-23812633,-,23間,NT$12800-12800(定價係指各種房型之最高備查價格區間，各房型實際售價請依旅宿業者公布為主。),12800,-
WESTGATEHOTEL永安棧,臺北市萬華區中華路一段150號,02-23313161,http://www.westgatehotel.com.tw,121間,NT$12800-12800(定價係指各種房型之最高備查價格區間，各房型實際售價請依旅宿業者公布為主。),12800,-
北投天玥泉溫泉會館,臺北市北投區中山路3號3樓,02-28988661,http://www.tyq.com.tw/,21間,NT$12800-12800(定價係指各種房型之最高備查價格區間，各房型實際售價請依旅宿業者公布為主。),12800,-
雅璞文旅,臺北市中正區黎明里10鄰館前路8號5樓及8樓,02-23709966,-,64間,NT$12800-16800(定價係指各種房型之最高備查價格區間，各房型實際售價請依旅宿業者公布為主。),12800,-
瑞桑德旅店北車館,臺北市中正區重慶南路一段1號5樓,02-23710811,http://www.oxygenhoteltaipei.com,14間,NT$12800-16800(定價係指各種房型之最高備查價格區間，各房型實際售價請依旅宿業者公布為主。),12800,-
陸號行旅西門館,臺北市萬華區臺北市萬華區中華路一段152號5樓、5樓之1、9樓、10樓；成都路1號9樓、10樓,02-23144003,https://inn-3088.business.site/,27間,NT$12800-14800(定價係指各種房型之最高備查價格區間，各房型實際售價請依旅宿業者公布為主。),12800,-
西門航棧旅館,"臺北市萬華區中華路一段144號7-8樓,7樓之1,8樓之1",02-23880777,-,38間,NT$12880-12880(定價係指各種房型之最高備查價格區間，各房型實際售價請依旅宿業者公布為主。),12880,-
酩月大飯店,臺北市萬華區成都路21號4至5樓，23號4至5樓，27巷1號4至5樓,02-23755218,-,31間,NT$12880-16880(定價係指各種房型之最高備查價格區間，各房型實際售價請依旅宿業者公布為主。),12880,-
明日大飯店,臺北市萬華區成都路23號、27巷1號6至8樓,02-23755500,-,40間,NT$12880-16880(定價係指各種房型之最高備查價格區間，各房型實際售價請依旅宿業者公布為主。),12880,-
明星大飯店,臺北市萬華區成都路21號2至3樓、23號2至3樓、27巷1號2至3樓,02-23755227,-,34間,NT$12880-16880(定價係指各種房型之最高備查價格區間，各房型實際售價請依旅宿業者公布為主。),12880,-
玩行旅台北館,臺北市中正區金山南路1段8號1樓至8樓,02-23212680,https://www.wowhappy-taipei.com.tw/,49間,NT$12880-13880(定價係指各種房型之最高備查價格區間，各房型實際售價請依旅宿業者公布為主。),12880,-
陸號行旅中華館,臺北市萬華區中華路一段90號9樓、11樓,02-23112522,-,72間,NT$12880-20880(定價係指各種房型之最高備查價格區間，各房型實際售價請依旅宿業者公布為主。),12880,-
日星商旅,臺北市萬華區成都路111號1樓-6樓,02-2375,https://taiwanstay.net.tw/room/33229,11間,NT$12880-29800(定價係指各種房型之最高備查價格區間，各房型實際售價請依旅宿業者公布為主。),12880,-
台北君品大酒店,臺北市大同區承德路1段3號(1樓.5樓~16樓及地下1樓.地下3樓),02-21819999,http://www.palaisdechinehotel.com/,286間,NT$13000-323400(定價係指各種房型之最高備查價格區間，各房型實際售價請依旅宿業者公布為主。),13000,5
和逸．台北民生館,臺北市中山區民生東路二段178號1至12樓,02-77063399,-,135間,NT$13000-85000(定價係指各種房型之最高備查價格區間，各房型實際售價請依旅宿業者公布為主。),13000,4
台北中山雅樂軒酒店,臺北市中山區雙城街1號,02-77439999,https://aloftzhongshan.com.tw/,88間,NT$13000-15000(定價係指各種房型之最高備查價格區間，各房型實際售價請依旅宿業者公布為主。),13000,-
峻美精旅,臺北市中山區長春路62號6樓,02-25312338,http://hotelbnight.beautyhotels.com.tw/,15間,NT$13000-22000(定價係指各種房型之最高備查價格區間，各房型實際售價請依旅宿業者公布為主。),13000,-
格拉斯麗台北飯店,臺北市中正區忠孝東路2段89號3至19樓,02-23220111,-,248間,NT$13000-13000(定價係指各種房型之最高備查價格區間，各房型實際售價請依旅宿業者公布為主。),13000,-
城市商旅站前館,臺北市大同區延平北路一段51號1至3樓及53號1樓,02-25507000,-,92間,NT$13200-19800(定價係指各種房型之最高備查價格區間，各房型實際售價請依旅宿業者公布為主。),13200,-
神旺商務酒店,臺北市中山區南京東路一段128號2至13樓,02-25115185,http://www.swresidences.com,81間,NT$13600-13600(定價係指各種房型之最高備查價格區間，各房型實際售價請依旅宿業者公布為主。),13600,-
大地酒店,臺北市北投區奇岩路1號,02-55518888,http://thegaiahotel.com/,48間,NT$13800-60000(定價係指各種房型之最高備查價格區間，各房型實際售價請依旅宿業者公布為主。),13800,-
艾特文旅,臺北市萬華區武昌街二段124之2號4樓,02-23885558,https://artoteltaipei.com/,29間,NT$13920-17520(定價係指各種房型之最高備查價格區間，各房型實際售價請依旅宿業者公布為主。),13920,-
北投麗禧溫泉酒店,臺北市北投區幽雅路30號,02-28988888,https://www.gvrb.com.tw/,66間,NT$14000-70000(定價係指各種房型之最高備查價格區間，各房型實際售價請依旅宿業者公布為主。),14000,5
台北美福大飯店,臺北市中山區樂群二路55號,02-77223399,https://www.grandmayfull.com/,146間,NT$14000-200000(定價係指各種房型之最高備查價格區間，各房型實際售價請依旅宿業者公布為主。),14000,5
宜津美侖大飯店,"臺北市大安區復興南路1段315號,317號,317號2樓",02-55793888,-,143間,NT$14000-56000(定價係指各種房型之最高備查價格區間，各房型實際售價請依旅宿業者公布為主。),14000,-
城市商旅德立莊二館,臺北市中正區衡陽路97號2樓、97之1號2樓、99號2樓、101號2樓、101號2樓之1、103號2樓、103號2樓之1、105號2樓、延平南路110號2-4樓,02-23703258,-,199間,NT$14000-16000(定價係指各種房型之最高備查價格區間，各房型實際售價請依旅宿業者公布為主。),14000,-
亞都麗緻大飯店,臺北市中山區民權東路2段41號,02-25971234,http://taipei.landishotelsresorts.com/chinese-trad/,219間,NT$14080-107800(定價係指各種房型之最高備查價格區間，各房型實際售價請依旅宿業者公布為主。),14080,-
雀客旅館台北內湖,臺北市內湖區民權東路6段123巷34弄1號1-12樓,02-87925319,-,87間,NT$14300-14300(定價係指各種房型之最高備查價格區間，各房型實際售價請依旅宿業者公布為主。),14300,-
沐蘭精品旅館,臺北市中山區堤頂大道2段460號,02-85023397,http://mulantp.swmall.com.tw/,46間,NT$14500-14500(定價係指各種房型之最高備查價格區間，各房型實際售價請依旅宿業者公布為主。),14500,-
金弘旅社,臺北市大同區南京西路316號4樓,02-25554038,-,19間,NT$14800-14800(定價係指各種房型之最高備查價格區間，各房型實際售價請依旅宿業者公布為主。),14800,-
寧夏2號旅店,臺北市大同區寧夏路2號,02-25507619,http://www.ningxiano2inn.com,19間,NT$14880-16880(定價係指各種房型之最高備查價格區間，各房型實際售價請依旅宿業者公布為主。),14880,-
柯達大飯店敦南店,臺北市大安區敦化南路二段238號B1-14樓,02-27323333,http://dunnan.khotels.com.tw/zh-TW/,77間,NT$15000-22000(定價係指各種房型之最高備查價格區間，各房型實際售價請依旅宿業者公布為主。),15000,-
鵲絲旅店豪麗旺館,臺北市信義區基隆路二段15-2號,02-23453511,https://guidehotel.com.tw/holypro-hotel/,20間,NT$15000-27000(定價係指各種房型之最高備查價格區間，各房型實際售價請依旅宿業者公布為主。),15000,-
皇家玫瑰旅館站前館,臺北市中山區華陰街3號1-4樓,02-25217222,http://www.rosehotel.com.tw/tw/,12間,NT$15000-15000(定價係指各種房型之最高備查價格區間，各房型實際售價請依旅宿業者公布為主。),15000,-
