旅宿名稱,地址,電話,官方網站,總房間數,定價,定價i,星級
石話石說民宿,苗栗縣三義鄉廣盛村40鄰八股路館前6巷1之1號,037-873743,-,1間,NT$7600-7600(定價係指各種房型之最高備查價格區間，各房型實際售價請依旅宿業者公布為主。),7600,-
勻淨湖民宿,苗栗縣大湖鄉新開村3鄰新開70之2號,037-951007,-,2間,NT$7800-9800(定價係指各種房型之最高備查價格區間，各房型實際售價請依旅宿業者公布為主。),7800,-
景山林,苗栗縣卓蘭鎮景山里4鄰景山63之3號,04-25921586,-,1間,NT$7800-7800(定價係指各種房型之最高備查價格區間，各房型實際售價請依旅宿業者公布為主。),7800,-
北河莊園,苗栗縣公館鄉北河村13鄰北河138之2號,0928-360108,https://www.facebook.com/PeiHochuangyuan/,5間,NT$7900-7900(定價係指各種房型之最高備查價格區間，各房型實際售價請依旅宿業者公布為主。),7900,-
21杉林別墅,苗栗縣南庄鄉南江村19鄰南江9之2號,037-821258,http://www.araucaria-villa21.tw,5間,NT$8000-10000(定價係指各種房型之最高備查價格區間，各房型實際售價請依旅宿業者公布為主。),8000,-
巧克力雲莊,苗栗縣大湖鄉富興村4鄰水尾坪82號,037-996916,-,5間,NT$8000-8000(定價係指各種房型之最高備查價格區間，各房型實際售價請依旅宿業者公布為主。),8000,-
F商旅三義館,"苗栗縣三義鄉廣盛村復興路16-1號B1-8樓,16-2號1-8樓",037-878788,http://sanyi.fhotels.com.tw/,43間,NT$8000-8000(定價係指各種房型之最高備查價格區間，各房型實際售價請依旅宿業者公布為主。),8000,3
逗號民宿,苗栗縣南庄鄉南江村17鄰福南58號,0975-820058,-,4間,NT$8000-8000(定價係指各種房型之最高備查價格區間，各房型實際售價請依旅宿業者公布為主。),8000,-
寶康花卉農場,苗栗縣南庄鄉田美村12鄰四灣47-2號,037-825947,-,5間,NT$8000-8000(定價係指各種房型之最高備查價格區間，各房型實際售價請依旅宿業者公布為主。),8000,-
雲莊空間密碼民宿,苗栗縣大湖鄉富興村12鄰水尾坪49-20號,037-996916,-,4間,NT$8000-8000(定價係指各種房型之最高備查價格區間，各房型實際售價請依旅宿業者公布為主。),8000,-
忘煩花自在民宿,苗栗縣大湖鄉武榮村8鄰坑美寮53號,04-25895892,-,1間,NT$8000-8000(定價係指各種房型之最高備查價格區間，各房型實際售價請依旅宿業者公布為主。),8000,-
輕山居,苗栗縣通霄鎮福興里10鄰福興112之33號,0933-206929,-,5間,NT$8000-10000(定價係指各種房型之最高備查價格區間，各房型實際售價請依旅宿業者公布為主。),8000,-
六沐森民宿,苗栗縣公館鄉仁安村6鄰仁安99之21號,0988-771506,-,4間,NT$8000-10000(定價係指各種房型之最高備查價格區間，各房型實際售價請依旅宿業者公布為主。),8000,-
樂吧溪畔莊園,苗栗縣南庄鄉獅山村5鄰田美22之5號,0988-396817,-,5間,NT$8000-8000(定價係指各種房型之最高備查價格區間，各房型實際售價請依旅宿業者公布為主。),8000,-
幸福倍增,苗栗縣南庄鄉南富村17鄰四灣27之3號,037-825988,-,3間,NT$8000-8000(定價係指各種房型之最高備查價格區間，各房型實際售價請依旅宿業者公布為主。),8000,-
草山境,苗栗縣公館鄉開礦村2鄰開礦26之10號,0933-533195,-,5間,NT$8800-8800(定價係指各種房型之最高備查價格區間，各房型實際售價請依旅宿業者公布為主。),8800,-
竹美民宿,苗栗縣泰安鄉錦水村9鄰橫龍山35之2號,037-941889,-,5間,NT$8800-9800(定價係指各種房型之最高備查價格區間，各房型實際售價請依旅宿業者公布為主。),8800,-
蘇維拉民宿,苗栗縣南庄鄉田美村16鄰四灣92號,0932-331510,-,3間,NT$8800-12600(定價係指各種房型之最高備查價格區間，各房型實際售價請依旅宿業者公布為主。),8800,-
御賞屋民宿,苗栗縣大湖鄉富興村9鄰八寮灣1-60號,037-997068,-,5間,NT$9000-12000(定價係指各種房型之最高備查價格區間，各房型實際售價請依旅宿業者公布為主。),9000,-
弍寓民宿,苗栗縣卓蘭鎮西坪里4鄰西坪43之18號,0978-213198,-,4間,NT$9600-12000(定價係指各種房型之最高備查價格區間，各房型實際售價請依旅宿業者公布為主。),9600,-
弌宅民宿,苗栗縣卓蘭鎮西坪里4鄰西坪43之19號,0932-535492,-,4間,NT$9600-12000(定價係指各種房型之最高備查價格區間，各房型實際售價請依旅宿業者公布為主。),9600,-
享沐時光,苗栗縣苑裡鎮石鎮里錦山8-1、8-2號,037-742878,https://www.facebook.com/LaShineMoodResort/,90間,NT$9800-36000(定價係指各種房型之最高備查價格區間，各房型實際售價請依旅宿業者公布為主。),9800,-
翡翠別館,苗栗縣南庄鄉員林村15鄰屯營68號,0901-308866,-,3間,NT$10000-18800(定價係指各種房型之最高備查價格區間，各房型實際售價請依旅宿業者公布為主。),10000,-
莎力畝民宿,苗栗縣泰安鄉中興村5鄰司馬限19號,0972-910536,https://www.lokah-salimu.com.tw/,1間,NT$10000-10000(定價係指各種房型之最高備查價格區間，各房型實際售價請依旅宿業者公布為主。),10000,-
翩翩泰安,苗栗縣泰安鄉錦水村11鄰圓墩86之6號,037-941099,http://www.ppta.com.tw,6間,NT$10000-15000(定價係指各種房型之最高備查價格區間，各房型實際售價請依旅宿業者公布為主。),10000,-
和風民宿,苗栗縣公館鄉仁安村6鄰仁安100之17號,037-233498,-,3間,NT$10000-10000(定價係指各種房型之最高備查價格區間，各房型實際售價請依旅宿業者公布為主。),10000,-
龜樹民宿,苗栗縣公館鄉玉谷村1鄰玉谷7之5號,0938-202734,-,3間,NT$10000-15000(定價係指各種房型之最高備查價格區間，各房型實際售價請依旅宿業者公布為主。),10000,-
山田民宿,苗栗縣南庄鄉田美村3鄰田美66之1號,0909-071498,-,5間,NT$10000-10000(定價係指各種房型之最高備查價格區間，各房型實際售價請依旅宿業者公布為主。),10000,-
莓景風采民宿,苗栗縣大湖鄉大湖村1鄰中原路80號,0922-662376,-,5間,NT$10000-12000(定價係指各種房型之最高備查價格區間，各房型實際售價請依旅宿業者公布為主。),10000,-
八角居所民宿,苗栗縣獅潭鄉新豐村6鄰八角坑2之1號,0963-577866,http://www.aroundthetree.com.tw,4間,NT$12000-16000(定價係指各種房型之最高備查價格區間，各房型實際售價請依旅宿業者公布為主。),12000,-
蘊慢築民宿,苗栗縣公館鄉福星村8鄰福星262之5號,0937-586860,-,2間,NT$12000-16000(定價係指各種房型之最高備查價格區間，各房型實際售價請依旅宿業者公布為主。),12000,-
福村養生農場,苗栗縣公館鄉福德村1鄰福德7-1號,037-220675,-,2間,NT$12500-30000(定價係指各種房型之最高備查價格區間，各房型實際售價請依旅宿業者公布為主。),12500,-
沁澐森林莊園,苗栗縣三義鄉雙潭村16鄰崩山下45之1號,037-951236,-,5間,NT$12800-16800(定價係指各種房型之最高備查價格區間，各房型實際售價請依旅宿業者公布為主。),12800,-
福山居莊園,苗栗縣三義鄉鯉魚潭村9鄰南片山下52-9號,0953-203370,-,5間,NT$14000-14000(定價係指各種房型之最高備查價格區間，各房型實際售價請依旅宿業者公布為主。),14000,-
八角隱士莊園,苗栗縣獅潭鄉新豐村6鄰八角坑2之2號,0963-577866,-,4間,NT$14000-16000(定價係指各種房型之最高備查價格區間，各房型實際售價請依旅宿業者公布為主。),14000,-
櫻花樹夏民宿,苗栗縣竹南鎮正南里10鄰中山路47號,0913-736622,-,5間,NT$16000-18000(定價係指各種房型之最高備查價格區間，各房型實際售價請依旅宿業者公布為主。),16000,-
格拉斯行館,苗栗縣南庄鄉南江村5鄰東江80號6樓,037-823636,-,9間,NT$16000-20000(定價係指各種房型之最高備查價格區間，各房型實際售價請依旅宿業者公布為主。),16000,-
星之森民宿,苗栗縣南庄鄉南江村3鄰東江31之15號,0902-277580,-,3間,NT$19000-19000(定價係指各種房型之最高備查價格區間，各房型實際售價請依旅宿業者公布為主。),19000,-
樹也民宿,苗栗縣三義鄉龍騰村5鄰外庄27-1號,037-881712,-,4間,NT$22000-22000(定價係指各種房型之最高備查價格區間，各房型實際售價請依旅宿業者公布為主。),22000,-
弎弄民宿,苗栗縣卓蘭鎮西坪里4鄰西坪43-17號,0935-326423,-,5間,NT$25000-35000(定價係指各種房型之最高備查價格區間，各房型實際售價請依旅宿業者公布為主。),25000,-
肆院民宿,苗栗縣卓蘭鎮西坪里4鄰西坪43-16號,0927-950880,-,5間,NT$25000-35000(定價係指各種房型之最高備查價格區間，各房型實際售價請依旅宿業者公布為主。),25000,-
三義壹號民宿,苗栗縣三義鄉双潭村7鄰双連潭99號,0926-355757,-,4間,NT$25000-35000(定價係指各種房型之最高備查價格區間，各房型實際售價請依旅宿業者公布為主。),25000,-
