旅宿名稱,地址,電話,官方網站,總房間數,定價,定價i,星級
天堂鳥民宿,苗栗縣南庄鄉南江村5鄰東江98號,037-821727,-,4間,NT$4000-6000(定價係指各種房型之最高備查價格區間，各房型實際售價請依旅宿業者公布為主。),4000,-
野薑花森林坊,苗栗縣三義鄉雙潭村13鄰崩山下3號,037-879143,-,3間,NT$4000-6000(定價係指各種房型之最高備查價格區間，各房型實際售價請依旅宿業者公布為主。),4000,-
桐顏桐雨渡假山莊,苗栗縣南庄鄉蓬萊村9鄰四二份8之18號,0939-119415,http://www.tky.tw,5間,NT$4000-6300(定價係指各種房型之最高備查價格區間，各房型實際售價請依旅宿業者公布為主。),4000,-
陶然渡假山莊,苗栗縣南庄鄉蓬萊村9鄰42份8-5號,037-823015,-,5間,NT$4200-6500(定價係指各種房型之最高備查價格區間，各房型實際售價請依旅宿業者公布為主。),4200,-
雅心山莊,苗栗縣頭屋鄉明德村10鄰明德路127號,037-251056,-,3間,NT$4200-4200(定價係指各種房型之最高備查價格區間，各房型實際售價請依旅宿業者公布為主。),4200,-
綠波浪森林會館民宿,苗栗縣三義鄉龍騰村13鄰龍騰3之6號,0989-966858,-,5間,NT$4200-8500(定價係指各種房型之最高備查價格區間，各房型實際售價請依旅宿業者公布為主。),4200,-
琪海汽車旅館,苗栗縣竹南鎮八德1路181號,037-628628,-,40間,NT$4200-4200(定價係指各種房型之最高備查價格區間，各房型實際售價請依旅宿業者公布為主。),4200,-
山水居民宿,苗栗縣大湖鄉栗林村13鄰內雙坑5-5號,037-951513,-,3間,NT$4200-4800(定價係指各種房型之最高備查價格區間，各房型實際售價請依旅宿業者公布為主。),4200,-
櫻之芳庭民宿,苗栗縣公館鄉福星村7鄰福星227之9號,037-237387,-,3間,NT$4200-4200(定價係指各種房型之最高備查價格區間，各房型實際售價請依旅宿業者公布為主。),4200,-
苗栗桐馨莊園民宿,苗栗縣公館鄉福星村1鄰福星29之2號,0960-584818,-,5間,NT$4200-9600(定價係指各種房型之最高備查價格區間，各房型實際售價請依旅宿業者公布為主。),4200,-
新之住民宿,苗栗縣南庄鄉南江村5鄰東江73之6號,0932-615151,https://enjoynewlive.tw/,5間,NT$4300-5800(定價係指各種房型之最高備查價格區間，各房型實際售價請依旅宿業者公布為主。),4300,-
總統民宿,苗栗縣南庄鄉田美村12鄰紫金山莊93號,037-823717,-,4間,NT$4500-14000(定價係指各種房型之最高備查價格區間，各房型實際售價請依旅宿業者公布為主。),4500,-
普羅旺斯鄉村民宿,苗栗縣南庄鄉蓬萊村9鄰42份8之35號,0911-811835,http://www.facebook.com/NanZhuangPuLuoWangSiXiangCunMinSu,5間,NT$4500-12000(定價係指各種房型之最高備查價格區間，各房型實際售價請依旅宿業者公布為主。),4500,-
新百香民宿,苗栗縣南庄鄉南江村14鄰小東河23之5號,037-825850,-,5間,NT$4500-4500(定價係指各種房型之最高備查價格區間，各房型實際售價請依旅宿業者公布為主。),4500,-
西湖渡假大飯店,苗栗縣三義鄉西湖村西湖11號,037-876699,https://www.westlake.com.tw/,245間,NT$4500-16500(定價係指各種房型之最高備查價格區間，各房型實際售價請依旅宿業者公布為主。),4500,-
綠丘行旅,苗栗縣通霄鎮城南里5鄰城南66之5號,037-783858,-,5間,NT$4500-6500(定價係指各種房型之最高備查價格區間，各房型實際售價請依旅宿業者公布為主。),4500,-
綠野神農休閒民宿,苗栗縣公館鄉仁安村9鄰仁安122-28號,037-233855,http://www.facebook.com/GreenShennong2014,4間,NT$4500-4500(定價係指各種房型之最高備查價格區間，各房型實際售價請依旅宿業者公布為主。),4500,-
祁家院,苗栗縣公館鄉館東村10鄰館東143之9號,037-233118,-,3間,NT$4500-5500(定價係指各種房型之最高備查價格區間，各房型實際售價請依旅宿業者公布為主。),4500,-
桐遊柿界民宿,苗栗縣公館鄉館東村12鄰館東166之6號,037-232358,-,2間,NT$4500-4500(定價係指各種房型之最高備查價格區間，各房型實際售價請依旅宿業者公布為主。),4500,-
霧上雲端,苗栗縣大湖鄉栗林村9鄰薑麻園13號,037-951522,-,5間,NT$4500-7000(定價係指各種房型之最高備查價格區間，各房型實際售價請依旅宿業者公布為主。),4500,-
坪林五二民宿,苗栗縣卓蘭鎮坪林里5鄰坪林52號,04-25921168,-,2間,NT$4500-4500(定價係指各種房型之最高備查價格區間，各房型實際售價請依旅宿業者公布為主。),4500,-
麥克尼景觀莊園,苗栗縣南庄鄉東村17鄰南庄121號,037-821859,-,4間,NT$4600-4600(定價係指各種房型之最高備查價格區間，各房型實際售價請依旅宿業者公布為主。),4600,-
日光森林,苗栗縣大湖鄉大南村2鄰小南勢2之2號,0927-940227,https://sunlightforest.ego.tw/,4間,NT$4600-6800(定價係指各種房型之最高備查價格區間，各房型實際售價請依旅宿業者公布為主。),4600,-
合谷民宿,苗栗縣南庄鄉蓬萊村1鄰紅毛館1之1號,0905-234117,https://booking.owlting.com/hogu.retreat,3間,NT$4600-8600(定價係指各種房型之最高備查價格區間，各房型實際售價請依旅宿業者公布為主。),4600,-
水采田家,苗栗縣三義鄉鯉魚潭村12鄰上山下60-5號,0938-887009,-,2間,NT$4600-6600(定價係指各種房型之最高備查價格區間，各房型實際售價請依旅宿業者公布為主。),4600,-
桐莊,苗栗縣公館鄉福德村4鄰福德35-12號,037-220788,-,4間,NT$4600-4800(定價係指各種房型之最高備查價格區間，各房型實際售價請依旅宿業者公布為主。),4600,-
清風朗月莊,苗栗縣公館鄉福星村10鄰福星312之8號,037-222068,-,3間,NT$4600-7000(定價係指各種房型之最高備查價格區間，各房型實際售價請依旅宿業者公布為主。),4600,-
戀戀山水農莊民宿,苗栗縣公館鄉開礦村2鄰開礦30號,0903-929218,http://www.inlove.com.tw,2間,NT$4680-7680(定價係指各種房型之最高備查價格區間，各房型實際售價請依旅宿業者公布為主。),4680,-
富邑山莊,苗栗縣南庄鄉田美村4鄰田美72之1號,037-825376,-,3間,NT$4800-4800(定價係指各種房型之最高備查價格區間，各房型實際售價請依旅宿業者公布為主。),4800,-
山房子,苗栗縣南庄鄉南江村10鄰石坑18之8號,0933-969573,http://www.mhouse.tw,4間,NT$4800-7800(定價係指各種房型之最高備查價格區間，各房型實際售價請依旅宿業者公布為主。),4800,-
紅蜻蜓民宿,苗栗縣通霄鎮南和里11鄰南和135之2號,037-783376,http://tonbohome.8898go.com,5間,NT$4800-7200(定價係指各種房型之最高備查價格區間，各房型實際售價請依旅宿業者公布為主。),4800,-
觀霧山莊,苗栗縣泰安鄉梅園村觀霧8號,037-268818,http://www.guanwuvilla.com/,33間,NT$4800-15400(定價係指各種房型之最高備查價格區間，各房型實際售價請依旅宿業者公布為主。),4800,-
伽芝萊民宿,苗栗縣通霄鎮福興里13鄰福興148-6號,037-783918,-,5間,NT$4800-6800(定價係指各種房型之最高備查價格區間，各房型實際售價請依旅宿業者公布為主。),4800,-
力新小築,苗栗縣南庄鄉南江村5鄰東江100號,037-822179,http://www.lisin.com.tw,5間,NT$4800-4800(定價係指各種房型之最高備查價格區間，各房型實際售價請依旅宿業者公布為主。),4800,-
南庄東村民宿,苗栗縣南庄鄉東村10鄰南庄75之1號,037-825220,-,1間,NT$4800-4800(定價係指各種房型之最高備查價格區間，各房型實際售價請依旅宿業者公布為主。),4800,-
尋找愛麗絲民宿,苗栗縣通霄鎮福興里2鄰福興13之6號,0930-760857,-,5間,NT$4800-6600(定價係指各種房型之最高備查價格區間，各房型實際售價請依旅宿業者公布為主。),4800,-
我的家51-6民宿,苗栗縣公館鄉福星村2鄰福星51之6號,037-230070,http://516.tnn.tw,4間,NT$4800-5800(定價係指各種房型之最高備查價格區間，各房型實際售價請依旅宿業者公布為主。),4800,-
南庄風鈴木咖啡民宿,苗栗縣南庄鄉東村16鄰南庄79之5號,037-822568,-,5間,NT$4800-4800(定價係指各種房型之最高備查價格區間，各房型實際售價請依旅宿業者公布為主。),4800,-
靛靛民宿,苗栗縣三義鄉勝興村10鄰勝興13之5號,0921-385055,-,3間,NT$4800-6600(定價係指各種房型之最高備查價格區間，各房型實際售價請依旅宿業者公布為主。),4800,-
錦水溫泉飯店,苗栗縣泰安鄉錦水村橫龍山72號,037-941333,http://www.kingspa.com.tw,83間,NT$4950-11000(定價係指各種房型之最高備查價格區間，各房型實際售價請依旅宿業者公布為主。),4950,-
上山回家民宿,苗栗縣大湖鄉東興村5鄰上湖85之5號,0972-906927,http://naifuka.wordpress.com,2間,NT$5000-9800(定價係指各種房型之最高備查價格區間，各房型實際售價請依旅宿業者公布為主。),5000,-
水漾西湖,苗栗縣三義鄉西湖村2鄰西湖21之1號,037-878528,-,2間,NT$5000-5000(定價係指各種房型之最高備查價格區間，各房型實際售價請依旅宿業者公布為主。),5000,-
馨藝庭園民宿,苗栗縣西湖鄉高埔村2鄰大窩10之9號,037-987558,-,3間,NT$5000-8000(定價係指各種房型之最高備查價格區間，各房型實際售價請依旅宿業者公布為主。),5000,-
好珈農莊,苗栗縣三義鄉龍騰村8鄰外庄62之6號,037-881766,http://www.facebook.com/hokataiwan,5間,NT$5000-14000(定價係指各種房型之最高備查價格區間，各房型實際售價請依旅宿業者公布為主。),5000,-
燕子陶,苗栗縣南庄鄉南江村19鄰南江6之3號,0919-703015,-,3間,NT$5000-8000(定價係指各種房型之最高備查價格區間，各房型實際售價請依旅宿業者公布為主。),5000,-
風山雅筑莊園民宿,苗栗縣銅鑼鄉盛隆村5鄰盛隆45之18號,0912-856602,http://www.royalcastle.com.tw,4間,NT$5000-8000(定價係指各種房型之最高備查價格區間，各房型實際售價請依旅宿業者公布為主。),5000,-
印象莊園民宿,苗栗縣西湖鄉高埔村3鄰大窩20之9號,037-981618,-,3間,NT$5000-6800(定價係指各種房型之最高備查價格區間，各房型實際售價請依旅宿業者公布為主。),5000,-
焉之美術空間館,苗栗縣三義鄉龍騰村1鄰龍騰12號,037-871698,https://154911459842.web.fullinn.tw/,1間,NT$5000-5000(定價係指各種房型之最高備查價格區間，各房型實際售價請依旅宿業者公布為主。),5000,-
觀心農舍,苗栗縣三義鄉双湖村双湖99-1號,0932-312563,-,3間,NT$5000-5000(定價係指各種房型之最高備查價格區間，各房型實際售價請依旅宿業者公布為主。),5000,-
湯源民宿,苗栗縣泰安鄉錦水村7鄰圓墩63之3號,037-941398,-,2間,NT$5000-5000(定價係指各種房型之最高備查價格區間，各房型實際售價請依旅宿業者公布為主。),5000,-
湯之美溫泉,苗栗縣泰安鄉錦水村10鄰橫龍山59之7號,037-941638,-,5間,NT$5000-6000(定價係指各種房型之最高備查價格區間，各房型實際售價請依旅宿業者公布為主。),5000,-
黃石山莊,苗栗縣三義鄉雙潭村13鄰崩山下2號,037-878502,-,5間,NT$5000-6000(定價係指各種房型之最高備查價格區間，各房型實際售價請依旅宿業者公布為主。),5000,-
癩蛤蟆民宿,苗栗縣三義鄉龍騰村8鄰外庄66號,0932-529911,-,3間,NT$5000-5000(定價係指各種房型之最高備查價格區間，各房型實際售價請依旅宿業者公布為主。),5000,-
炭鄉八八庭園民宿,苗栗縣三義鄉雙湖村22鄰大坑88號,0932-524719,-,5間,NT$5000-8000(定價係指各種房型之最高備查價格區間，各房型實際售價請依旅宿業者公布為主。),5000,-
石坑口民宿,苗栗縣南庄鄉南江村13鄰石坑61之6號,037-685656,-,5間,NT$5000-6500(定價係指各種房型之最高備查價格區間，各房型實際售價請依旅宿業者公布為主。),5000,-
萊穗民宿,苗栗縣苑裡鎮舊社里4鄰舊社37之2號,0978-391598,-,3間,NT$5000-10000(定價係指各種房型之最高備查價格區間，各房型實際售價請依旅宿業者公布為主。),5000,-
慈夢柔民宿,苗栗縣大湖鄉富興村9鄰八寮灣1-10號,037-990099,-,4間,NT$5020-6380(定價係指各種房型之最高備查價格區間，各房型實際售價請依旅宿業者公布為主。),5020,-
水岸明珠,苗栗縣南庄鄉西村11鄰大屋坑32-5號,037-822268,-,3間,NT$5200-7200(定價係指各種房型之最高備查價格區間，各房型實際售價請依旅宿業者公布為主。),5200,-
翡翠如意民宿,苗栗縣竹南鎮大埔里1鄰大埔街129號,037-676803,-,5間,NT$5200-5200(定價係指各種房型之最高備查價格區間，各房型實際售價請依旅宿業者公布為主。),5200,-
蓬萊仙境渡假山莊,苗栗縣南庄鄉蓬萊村10鄰四二份20之8號,037-821511,-,5間,NT$5280-5280(定價係指各種房型之最高備查價格區間，各房型實際售價請依旅宿業者公布為主。),5280,-
屋登莊園,苗栗縣頭屋鄉獅潭村8鄰獅潭101之2號,0933-919768,-,4間,NT$5400-12000(定價係指各種房型之最高備查價格區間，各房型實際售價請依旅宿業者公布為主。),5400,-
穆月樓民宿,苗栗縣泰安鄉清安村3鄰小南角16-2號,037-941609,-,4間,NT$5500-6000(定價係指各種房型之最高備查價格區間，各房型實際售價請依旅宿業者公布為主。),5500,-
山行寄野民宿,苗栗縣南庄鄉東河村12鄰橫屏背25-1號,037-825438,-,4間,NT$5500-8500(定價係指各種房型之最高備查價格區間，各房型實際售價請依旅宿業者公布為主。),5500,-
三義說走就走民宿,苗栗縣三義鄉廣盛村39鄰八股路館前2巷1之22號,0963-125550,-,3間,NT$5500-8000(定價係指各種房型之最高備查價格區間，各房型實際售價請依旅宿業者公布為主。),5500,-
楓葉地圖民宿,苗栗縣大湖鄉東興村5鄰上湖108號,037-997299,-,4間,NT$5600-8600(定價係指各種房型之最高備查價格區間，各房型實際售價請依旅宿業者公布為主。),5600,-
翡翠金鑽民宿,苗栗縣竹南鎮大埔里1鄰大埔街131號,037-582131,https://www.feitsuei-jintzuan-ruyihotel.com.tw,5間,NT$5600-5600(定價係指各種房型之最高備查價格區間，各房型實際售價請依旅宿業者公布為主。),5600,-
揚昊民宿,苗栗縣苑裡鎮蕉埔里8鄰蕉埔86之6號,0911-174143,-,4間,NT$5600-8400(定價係指各種房型之最高備查價格區間，各房型實際售價請依旅宿業者公布為主。),5600,-
地圖楓葉民宿,苗栗縣大湖鄉東興村5鄰上湖109號,037-997299,-,5間,NT$5600-12000(定價係指各種房型之最高備查價格區間，各房型實際售價請依旅宿業者公布為主。),5600,-
綠意山莊民宿,苗栗縣苑裡鎮蕉埔里8鄰蕉埔86之5號,0983-5050121,-,4間,NT$5600-8400(定價係指各種房型之最高備查價格區間，各房型實際售價請依旅宿業者公布為主。),5600,-
愛麗舍精品旅館,苗栗縣頭份市中華路1489號,037-590088,https://motel.elysees.biz,27間,NT$5800-12000(定價係指各種房型之最高備查價格區間，各房型實際售價請依旅宿業者公布為主。),5800,-
星宿民宿,苗栗縣南庄鄉蓬萊村4鄰紅毛館53-1號,037-821626,-,4間,NT$5800-6200(定價係指各種房型之最高備查價格區間，各房型實際售價請依旅宿業者公布為主。),5800,-
自然風情民宿,苗栗縣卓蘭鎮西坪里12鄰西坪134之7號,04-25896666,http://www.naturalview.tw,4間,NT$5800-7800(定價係指各種房型之最高備查價格區間，各房型實際售價請依旅宿業者公布為主。),5800,-
任意宿民宿,苗栗縣苑裡鎮苑北里16鄰成功路7巷9號,037-868232,http://www.facebook.com/nsquarehostel,2間,NT$6000-8000(定價係指各種房型之最高備查價格區間，各房型實際售價請依旅宿業者公布為主。),6000,-
問樵山居,苗栗縣南庄鄉田美村1鄰田美20號,0936-246535,-,3間,NT$6000-6000(定價係指各種房型之最高備查價格區間，各房型實際售價請依旅宿業者公布為主。),6000,-
湯悅溫泉會館,苗栗縣泰安鄉錦水村橫龍山45號,037-941941,-,4間,NT$6000-6000(定價係指各種房型之最高備查價格區間，各房型實際售價請依旅宿業者公布為主。),6000,-
日光呼吸,苗栗縣頭屋鄉明德村2鄰明德43-1號,037-256889,-,2間,NT$6000-8000(定價係指各種房型之最高備查價格區間，各房型實際售價請依旅宿業者公布為主。),6000,-
禾家商旅,苗栗縣苗栗市建功里忠孝路77號,037-356666,http://he-jia-hotel.com.tw,20間,NT$6000-18000(定價係指各種房型之最高備查價格區間，各房型實際售價請依旅宿業者公布為主。),6000,-
橘子民宿,苗栗縣竹南鎮竹南里7鄰民治街12號,0917-265133,https://www.shop1688.com.tw/aom20200930034,3間,NT$6000-6000(定價係指各種房型之最高備查價格區間，各房型實際售價請依旅宿業者公布為主。),6000,-
石風民宿,苗栗縣大湖鄉富興村6鄰水尾5-10號,037-993366,-,1間,NT$6000-6000(定價係指各種房型之最高備查價格區間，各房型實際售價請依旅宿業者公布為主。),6000,-
哈利匠民宿,苗栗縣泰安鄉士林村4鄰馬那邦2-6號,0932-503824,-,2間,NT$6000-6000(定價係指各種房型之最高備查價格區間，各房型實際售價請依旅宿業者公布為主。),6000,-
綠風民宿,苗栗縣公館鄉福德村4鄰福德36-21號,037-238553,-,1間,NT$6000-6000(定價係指各種房型之最高備查價格區間，各房型實際售價請依旅宿業者公布為主。),6000,-
雲也山莊,苗栗縣卓蘭鎮西坪里10鄰西坪122之6號,04-25892829,-,5間,NT$6000-7500(定價係指各種房型之最高備查價格區間，各房型實際售價請依旅宿業者公布為主。),6000,-
藝術家莊園民宿,苗栗縣西湖鄉高埔村2鄰大窩10之11號,0917-165563,-,3間,NT$6000-8000(定價係指各種房型之最高備查價格區間，各房型實際售價請依旅宿業者公布為主。),6000,-
春雨庄園,苗栗縣南庄鄉獅山村1鄰田美16之2號,037-825918,-,3間,NT$6000-6000(定價係指各種房型之最高備查價格區間，各房型實際售價請依旅宿業者公布為主。),6000,-
看山民宿,苗栗縣獅潭鄉新店村15鄰大東勢20之5號,0953-762208,-,3間,NT$6000-10000(定價係指各種房型之最高備查價格區間，各房型實際售價請依旅宿業者公布為主。),6000,-
日出溫泉渡假飯店,苗栗縣泰安鄉錦水村橫龍山34號,037-941988,https://hothotel.com.tw/system/,21間,NT$6000-10000(定價係指各種房型之最高備查價格區間，各房型實際售價請依旅宿業者公布為主。),6000,-
怡花優靜民宿,苗栗縣南庄鄉田美村3鄰田美55之2號,0933-435841,-,3間,NT$6000-6000(定價係指各種房型之最高備查價格區間，各房型實際售價請依旅宿業者公布為主。),6000,-
西湖漫漫民宿,苗栗縣西湖鄉高埔村1鄰筧窩7之1號,0978-113372,-,4間,NT$6000-9500(定價係指各種房型之最高備查價格區間，各房型實際售價請依旅宿業者公布為主。),6000,-
石壁民宿,苗栗縣大湖鄉富興村1鄰法雲寺5之3號,0933-874094,-,4間,NT$6000-13800(定價係指各種房型之最高備查價格區間，各房型實際售價請依旅宿業者公布為主。),6000,-
山語,苗栗縣南庄鄉南江村18鄰長崎下25號,0925-326066,-,2間,NT$6000-6000(定價係指各種房型之最高備查價格區間，各房型實際售價請依旅宿業者公布為主。),6000,-
岩川民宿,苗栗縣卓蘭鎮景山里4鄰景山63之1號,04-25921680,https://www.springcreek.com.tw/,5間,NT$6000-9000(定價係指各種房型之最高備查價格區間，各房型實際售價請依旅宿業者公布為主。),6000,-
耶西民宿,苗栗縣南庄鄉獅山村8鄰獅山20-2號,0936-044153,-,2間,NT$6000-6000(定價係指各種房型之最高備查價格區間，各房型實際售價請依旅宿業者公布為主。),6000,-
南庄橄欖樹咖啡民宿,苗栗縣南庄鄉蓬萊村9鄰42份7-6號,0919-822379,-,4間,NT$6100-6100(定價係指各種房型之最高備查價格區間，各房型實際售價請依旅宿業者公布為主。),6100,-
幸福綠光,苗栗縣南庄鄉南江村14鄰小東河17之3號,037-821751,http://www.greenshine.com.tw/,4間,NT$6200-6200(定價係指各種房型之最高備查價格區間，各房型實際售價請依旅宿業者公布為主。),6200,-
寄野山行,苗栗縣南庄鄉東河村12鄰橫屏背25之5號,037-825438,-,5間,NT$6200-8500(定價係指各種房型之最高備查價格區間，各房型實際售價請依旅宿業者公布為主。),6200,-
泰安觀止溫泉會館,苗栗縣泰安鄉錦水村圓墩58-7號,037-941951,-,9間,NT$6320-6320(定價係指各種房型之最高備查價格區間，各房型實際售價請依旅宿業者公布為主。),6320,-
馥藝金鬱金香酒店,苗栗縣竹南鎮公園路106號,037-539888,https://www.goldentulip-aesthetics.com.tw/,191間,NT$6400-32800(定價係指各種房型之最高備查價格區間，各房型實際售價請依旅宿業者公布為主。),6400,-
釣魚台農莊,苗栗縣頭屋鄉明德村21鄰仁隆52號,037-254897,http://www.dutfarm.com/story.html,3間,NT$6500-9500(定價係指各種房型之最高備查價格區間，各房型實際售價請依旅宿業者公布為主。),6500,-
楓林時尚汽車旅館,苗栗縣公館鄉五谷村2鄰五谷二路216號,037-228988,-,26間,NT$6500-6500(定價係指各種房型之最高備查價格區間，各房型實際售價請依旅宿業者公布為主。),6500,-
湯神民宿,苗栗縣大湖鄉大寮村12鄰大窩1-10號,037-991948,http://www.ts-spa.com.tw/,3間,NT$6600-6600(定價係指各種房型之最高備查價格區間，各房型實際售價請依旅宿業者公布為主。),6600,-
夏內爾渡假民宿,苗栗縣大湖鄉富興村7鄰八寮灣38號,037-992199,-,5間,NT$6600-12000(定價係指各種房型之最高備查價格區間，各房型實際售價請依旅宿業者公布為主。),6600,-
御花苑民宿,苗栗縣大湖鄉義和村11鄰和興22之8號,0965-211668,-,5間,NT$6600-8800(定價係指各種房型之最高備查價格區間，各房型實際售價請依旅宿業者公布為主。),6600,-
兔子跳跳親子民宿,苗栗縣竹南鎮大埔里2鄰科專八路10號,0903-296846,-,4間,NT$6800-8000(定價係指各種房型之最高備查價格區間，各房型實際售價請依旅宿業者公布為主。),6800,-
慕雲想莊園饗旅,苗栗縣頭屋鄉象山村15鄰濫坑57之2號,037-252868,-,4間,NT$6800-6800(定價係指各種房型之最高備查價格區間，各房型實際售價請依旅宿業者公布為主。),6800,-
一葉蘭民宿,苗栗縣南庄鄉東河村24鄰鹿場21-1號,037-821012,-,5間,NT$6800-6800(定價係指各種房型之最高備查價格區間，各房型實際售價請依旅宿業者公布為主。),6800,-
向草語蟲民宿,苗栗縣三義鄉勝興村13鄰勝興50之1號,037-876416,-,5間,NT$6880-6880(定價係指各種房型之最高備查價格區間，各房型實際售價請依旅宿業者公布為主。),6880,-
尚順君樂飯店,苗栗縣頭份市育樂街6號,037-539555,http://www.groyalhotel.com/,218間,NT$7000-52800(定價係指各種房型之最高備查價格區間，各房型實際售價請依旅宿業者公布為主。),7000,4
桐花森林渡假民宿,苗栗縣南庄鄉南江村3鄰東江31-6號,037-825166,-,3間,NT$7000-8800(定價係指各種房型之最高備查價格區間，各房型實際售價請依旅宿業者公布為主。),7000,-
菊園,苗栗縣大湖鄉栗林村9鄰薑麻園15號,037-951522,-,3間,NT$7000-7000(定價係指各種房型之最高備查價格區間，各房型實際售價請依旅宿業者公布為主。),7000,-
進泉莊民宿,苗栗縣獅潭鄉新店村12鄰新店164之3號,0935-335745,-,2間,NT$7000-9000(定價係指各種房型之最高備查價格區間，各房型實際售價請依旅宿業者公布為主。),7000,-
碩玥民宿,苗栗縣公館鄉仁安村9鄰122之10號,0966-615696,-,4間,NT$7000-9000(定價係指各種房型之最高備查價格區間，各房型實際售價請依旅宿業者公布為主。),7000,-
閱微森林,苗栗縣南庄鄉東村16鄰南庄83之1號,0921-776035,http://www.spring-villa.com/,4間,NT$7200-8800(定價係指各種房型之最高備查價格區間，各房型實際售價請依旅宿業者公布為主。),7200,-
湖畔星館民宿,苗栗縣大湖鄉義和村8鄰淋漓坪127號,037-996795,http://www.spendtime.com.tw,5間,NT$7200-10000(定價係指各種房型之最高備查價格區間，各房型實際售價請依旅宿業者公布為主。),7200,-
水星花時間,苗栗縣大湖鄉義和村8鄰淋漓坪110號,037-996796,http://www.spendtime.com.tw,5間,NT$7200-8600(定價係指各種房型之最高備查價格區間，各房型實際售價請依旅宿業者公布為主。),7200,-
登陸天王星,苗栗縣大湖鄉義和村8鄰淋漓坪120號,037-996796,-,3間,NT$7200-8600(定價係指各種房型之最高備查價格區間，各房型實際售價請依旅宿業者公布為主。),7200,-
木星花時間民宿,苗栗縣大湖鄉義和村8鄰淋漓坪113號,037-996796,-,5間,NT$7200-8600(定價係指各種房型之最高備查價格區間，各房型實際售價請依旅宿業者公布為主。),7200,-
